adType,categoriesCode,categoriesName,companyId,companyName,companyPrivate,description,employment,id,isClassified,isStandout,jobTitle,jobUrl,locations,postingDuration,postedAt,salarycurrency,salaryMin,salaryMax,salaryPeriod,salaryTerm,sellingPoints
standout,"501,130","Akuntansi / Keuangan,Audit & Pajak",426314,PT Balina Agung Perkasa,false,TUGAS &amp; TANGGUNG JAWAB Menghitung perpajakkan dan pelaporan pajak Pelaporan dan perhitungan pajak Menghitung biaya Membuat laporan sesuai dengan...,full_time,3731801,false,true,STAFF PAJAK,https://www.jobstreet.co.id/id/job/staff-pajak-3731801?token=0~80018015-025a-4683-9a93-f449f2b58686&sectionRank=846&jobId=jobstreet-id-job-3731801,Jakarta Timur,13 hours ago,2021-12-24T04:27:13Z,IDR,4500000,6000000,monthly,,
standout,"508,191","Komputer/Teknologi Informasi,IT-Perangkat Lunak",jobstreet-id-305622,PT Trutrip Teknologi Indonesia,false,We are looking for an experienced Senior Developer to be responsible for overseeing junior developers on projects and supporting various development...,full_time,3731800,false,true,Senior Frontend Developer,https://www.jobstreet.co.id/id/job/senior-frontend-developer-3731800?token=0~80018015-025a-4683-9a93-f449f2b58686&sectionRank=847&jobId=jobstreet-id-job-3731800,Jakarta Raya,13 hours ago,2021-12-24T04:26:20Z,IDR,10000000,14000000,monthly,,
standard,"508,191","Komputer/Teknologi Informasi,IT-Perangkat Lunak",439401,PT Mash Moshem Indonesia,false,"Dibutuhkan seorang yang memiliki kemauan keras untuk berkontribusi dalam Team, memberikan fresh idea untuk bergabung di perusahaan dengan kriteria...",full_time,3731799,false,false,STAFF IT - MOBILE APPS,https://www.jobstreet.co.id/id/job/staff-it-mobile-apps-3731799?token=0~80018015-025a-4683-9a93-f449f2b58686&sectionRank=848&jobId=jobstreet-id-job-3731799,Surabaya,13 hours ago,2021-12-24T04:26:09Z,,,,monthly,,
standout,"508,191","Komputer/Teknologi Informasi,IT-Perangkat Lunak",426116,PT Airmas Perkasa,false,"Job Description Participate in the entire application lifecycle, focusing on coding and debugging. Write clean code to develop functional web...",full_time,3731798,false,true,Backend Developer,https://www.jobstreet.co.id/id/job/backend-developer-3731798?token=0~80018015-025a-4683-9a93-f449f2b58686&sectionRank=849&jobId=jobstreet-id-job-3731798,Jakarta Barat,13 hours ago,2021-12-24T04:24:48Z,,,,monthly,,
standout,"508,191","Komputer/Teknologi Informasi,IT-Perangkat Lunak",jobstreet-id-305622,PT Trutrip Teknologi Indonesia,false,We are looking for an experienced Senior Developer to be responsible for overseeing junior developers on projects and supporting various development...,full_time,3731797,false,true,Senior PHP Backend Developer,https://www.jobstreet.co.id/id/job/senior-php-backend-developer-3731797?token=0~80018015-025a-4683-9a93-f449f2b58686&sectionRank=850&jobId=jobstreet-id-job-3731797,Jakarta Raya,13 hours ago,2021-12-24T04:24:09Z,,,,monthly,,
standard,"510,115","Manufaktur,Pemeliharaan",jobstreet-id-278,PT Hitachi Astemo Bekasi Powertrain Systems,false,Kualifikasi : Usia 25 - 30 tahun Background pendidikan SMA/Diploma/Sarjana Memiliki pengalaman 1-3 tahun di Maintenance Fasih berbahasa Inggris baik...,full_time,3731796,false,false,Staff Maintenance Building,https://www.jobstreet.co.id/id/job/staff-maintenance-building-3731796?token=0~80018015-025a-4683-9a93-f449f2b58686&sectionRank=851&jobId=jobstreet-id-job-3731796,Bekasi,13 hours ago,2021-12-24T04:23:55Z,,,,monthly,,
standard,"503,139","Penjualan / Pemasaran,Pemasaran/Pengembangan Bisnis",jobstreet-id-343769,Yan Proland,false,Requirements : Good Looking Pengalaman dibidang Property Memahami dunia digital Memiliki Laptop/tablet dan kendaraan Expert didunia marketing Terbiasa...,full_time,3731795,false,false,Marketing Executive,https://www.jobstreet.co.id/id/job/marketing-executive-3731795?token=0~80018015-025a-4683-9a93-f449f2b58686&sectionRank=852&jobId=jobstreet-id-job-3731795,Batam,13 hours ago,2021-12-24T04:23:50Z,,,,monthly,,
standard,"504,141","Seni/Media/Komunikasi,Hubungan Masyarakat",433544,PT Indocare Citrapasific,false,Tugas dan Tanggung Jawab: Melaksanakan brand activation yang kreatif dan tepat; Mengusulkan ide-ide baru dalam brand activation. Melakukan kerjasama...,full_time,3731794,false,false,Communication Activation,https://www.jobstreet.co.id/id/job/communication-activation-3731794?token=0~80018015-025a-4683-9a93-f449f2b58686&sectionRank=853&jobId=jobstreet-id-job-3731794,Jakarta Barat,13 hours ago,2021-12-24T04:23:04Z,,,,monthly,,
standard,"511,180","Bangunan/Konstruksi,Arsitek/Desain Interior",438228,PT Wahana Solarhat Sejahtera,false,Deskripsi Pekerjaan: Bertanggung jawab terhadap memasarkan produk-produk perusahaan dengan menjadi hubungan dan komunikasi yang baik dengan pelanggan...,full_time,3731793,false,false,Sales Staff,https://www.jobstreet.co.id/id/job/sales-staff-3731793?token=0~80018015-025a-4683-9a93-f449f2b58686&sectionRank=854&jobId=jobstreet-id-job-3731793,Jakarta Raya,13 hours ago,2021-12-24T04:22:48Z,,,,monthly,,
standout,"514,116","Lainnya,Lainnya/Kategori tidak tersedia",jobstreet-id-327825,tokolobo,false,"Requirement• Maximum 30 years old, Fresh Graduates are welcome• Proven work as a photographer &amp; videographer (Please provide resume/CV with link...",full_time,3731792,false,true,Photographer & Videographer Social Media,https://www.jobstreet.co.id/id/job/photographer-videographer-social-media-3731792?token=0~80018015-025a-4683-9a93-f449f2b58686&sectionRank=855&jobId=jobstreet-id-job-3731792,Jakarta Barat,13 hours ago,2021-12-24T04:22:10Z,,,,monthly,,
standard,"505,138","Pelayanan,Pengacara / Asisten Legal",436672,PT Samyang Indonesia,false,Kualifikasi:• Usia Maksimal 35 tahun• Pengetahuan tentang hukum serta peraturan negara yang  sedang berlaku.• Dapat melakukan pekerjaan secara...,full_time,3731791,false,false,Senior Legal (Drafter),https://www.jobstreet.co.id/id/job/senior-legal-drafter-3731791?token=0~80018015-025a-4683-9a93-f449f2b58686&sectionRank=856&jobId=jobstreet-id-job-3731791,Jakarta Utara,13 hours ago,2021-12-24T04:21:32Z,,,,monthly,,
standout,"503,139","Penjualan / Pemasaran,Pemasaran/Pengembangan Bisnis",426520,PT Carlcare Service Ila,false,"Qualification : Candidate must possess at least Bachelor's Degree in Business Studies/Administration/Management, Marketing or equivalent. Required...",full_time,3731790,false,true,Business Development Manager,https://www.jobstreet.co.id/id/job/business-development-manager-3731790?token=0~80018015-025a-4683-9a93-f449f2b58686&sectionRank=857&jobId=jobstreet-id-job-3731790,Jakarta Raya,13 hours ago,2021-12-24T04:21:10Z,IDR,15000000,18000000,monthly,,
standard,"501,131","Akuntansi / Keuangan,Akuntansi Umum / Pembiayaan",jobstreet-id-47837,PT Wahana Lestari Makmur Inderalaya,false,Kualifikasi : Pendidikan minimal D3 Akuntansi Berusia maksimal 25 tahun Berpengalaman minimal 1 tahun di bidang akuntansi Memahami pekerjaan akuntansi...,full_time,3731789,false,false,Adm Akuntansi,https://www.jobstreet.co.id/id/job/adm-akuntansi-3731789?token=0~80018015-025a-4683-9a93-f449f2b58686&sectionRank=858&jobId=jobstreet-id-job-3731789,Jakarta Pusat,13 hours ago,2021-12-24T04:21:07Z,IDR,4000000,4500000,monthly,,
standard,"503,145","Penjualan / Pemasaran,Penjualan Ritel",428871,PT Valdo Sumber Daya Mandiri,false,Sales Representatif Area Jawa TimurKualifikasi : Usia Maks 35 Tahun Memiliki kendaraan roda 2 (dua) dan SIM C Pendidikan Min SMA/SMK Berpengalaman di...,full_time,3731788,false,false,Sales Representatif ( lokasi Jawa Timur),https://www.jobstreet.co.id/id/job/sales-representatif-lokasi-jawa-timur-3731788?token=0~80018015-025a-4683-9a93-f449f2b58686&sectionRank=859&jobId=jobstreet-id-job-3731788,Jawa Timur,13 hours ago,2021-12-24T04:20:52Z,IDR,2000000,2800000,monthly,,
standard,"511,150","Bangunan/Konstruksi,Properti/Real Estate",jobstreet-id-343500,OMAHKU PROPERTI,false,Kualifikasi : Usia Maksimal 30 Tahun Pendidikan Minimal SMA/SMK/D3/S1 Diutamakan yang mempunyai pengalaman di bidang Properti dan Asuransi Memiliki...,full_time,3731786,false,false,SALES EXECUTIVE (Konsultan Properti),https://www.jobstreet.co.id/id/job/sales-executive-konsultan-properti-3731786?token=0~80018015-025a-4683-9a93-f449f2b58686&sectionRank=860&jobId=jobstreet-id-job-3731786,Banyuwangi,13 hours ago,2021-12-24T04:18:44Z,,,,monthly,,
standard,"502,146","Sumber Daya Manusia/Personalia,Sekretaris",427899,PT OS Selnajaya Indonesia,false,"One of our client (a manufacturing company) in Karawang, currently looking for Japanese Interpreter, with requirements as...",full_time,3731775,false,false,Japanese Interpreter (Supervisor Level),https://www.jobstreet.co.id/id/job/japanese-interpreter-supervisor-level-3731775?token=0~80018015-025a-4683-9a93-f449f2b58686&sectionRank=861&jobId=jobstreet-id-job-3731775,"Karawang,Purwakarta",13 hours ago,2021-12-24T04:18:29Z,IDR,8000000,12000000,monthly,,
standard,"503,203","Penjualan / Pemasaran,Digital Marketing",jobstreet-id-343614,Fenuza Muslim Wear,false,"Kualifikasi : Usia 18- 26 tahun SMK, D3, S1 sederajat Jujur dan bertanggung jawab Kreatif, komunikatif dan inovatif Mampu dan paham teknik serta angel...",full_time,3731785,false,false,Content Creator,https://www.jobstreet.co.id/id/job/content-creator-3731785?token=0~80018015-025a-4683-9a93-f449f2b58686&sectionRank=862&jobId=jobstreet-id-job-3731785,Jawa Barat,13 hours ago,2021-12-24T04:18:09Z,,,,monthly,,
standard,"510,197","Manufaktur,Penjaminan Kualitas / QA",jobstreet-id-245520,PT Beaute Haul Indonesia (Beautyhaul - Somethinc),false,Job Description: Memastikan bahwa produk yang dihasilkan oleh pabrik dan masuk ke warehouse telah memenuhi standar kualitas yang ditetapkan Mengelola...,full_time,3731784,false,false,Quality Improvement Lead (penempatan warehouse),https://www.jobstreet.co.id/id/job/quality-improvement-lead-penempatan-warehouse-3731784?token=0~80018015-025a-4683-9a93-f449f2b58686&sectionRank=863&jobId=jobstreet-id-job-3731784,Tangerang,13 hours ago,2021-12-24T04:17:52Z,,,,monthly,,
standard,"501,131","Akuntansi / Keuangan,Akuntansi Umum / Pembiayaan",530163,PT Sumber Bintang Perkasa,false,"PT Sumber Bintang Perkasa (SBP) adalah induk perusahaan PT Bintang Hartono Jaya, PT Mitra Aksesoris Indonesia &amp; PT Bintang Terang Perkasa. Semua...",full_time,3731782,false,false,ACCOUNTING ASSISTANT MANAGER,https://www.jobstreet.co.id/id/job/accounting-assistant-manager-3731782?token=0~80018015-025a-4683-9a93-f449f2b58686&sectionRank=864&jobId=jobstreet-id-job-3731782,Jakarta Raya,13 hours ago,2021-12-24T04:17:16Z,,,,monthly,,
standout,"507,105","Pendidikan/Pelatihan,Pendidikan",438831,PT. Benesse Indonesia,false,PT. Benesse Indonesia (Shinkenjuku Online) membuka kesempatan untuk bergabung bersama kami untuk mengisi posisi Fulltime Tutor Matematika dengan...,full_time,3731781,false,true,Fulltime Tutor Matematika (Shinkenjuku Online),https://www.jobstreet.co.id/id/job/fulltime-tutor-matematika-shinkenjuku-online-3731781?token=0~80018015-025a-4683-9a93-f449f2b58686&sectionRank=865&jobId=jobstreet-id-job-3731781,"Papua,Jakarta Raya,Jawa Barat,Jawa Tengah,Jawa Timur,Yogyakarta,Banten",13 hours ago,2021-12-24T04:15:48Z,,,,monthly,,"Budaya Organisasi yang baik,Kesempatan meningkatkan kemampuan mengajar,Suasana kerja yang menyenangkan"
standard,"502,137","Sumber Daya Manusia/Personalia,Sumber Daya Manusia / HR",530163,PT Sumber Bintang Perkasa,false,"PT Sumber Bintang Perkasa (SBP) is a holding company for PT Bintang Hartono Jaya, PT Mitra Aksesoris Indonesia &amp; PT Bintang Terang Perkasa. All...",full_time,3731780,false,false,HR SERVICE & OPERATION OFFICER (HR GENERALIST),https://www.jobstreet.co.id/id/job/hr-service-operation-officer-hr-generalist-3731780?token=0~80018015-025a-4683-9a93-f449f2b58686&sectionRank=866&jobId=jobstreet-id-job-3731780,Jakarta Raya,13 hours ago,2021-12-24T04:15:44Z,,,,monthly,,
standard,"501,131","Akuntansi / Keuangan,Akuntansi Umum / Pembiayaan",435567,PT Nusa Jaya Port,false,"Responsibilities : Report all transactions and journals of finance, accounting, tax financial reports (Profit/Loss, Balance Sheet, Cashflow) Budgeting...",full_time,3731779,false,false,Finance Accounting and Tax Supervisor,https://www.jobstreet.co.id/id/job/finance-accounting-and-tax-supervisor-3731779?token=0~80018015-025a-4683-9a93-f449f2b58686&sectionRank=867&jobId=jobstreet-id-job-3731779,Jakarta Selatan,13 hours ago,2021-12-24T04:15:37Z,IDR,7000000,8500000,monthly,,
standard,"503,203","Penjualan / Pemasaran,Digital Marketing",506844,PT. Kredit Utama Fintech Indonesia,false,"Jobdesk:- Assisting in the planning and execution of the digital marketing strategies.- Develop, implement and manage our social media strategy.-...",full_time,3731777,false,false,Digital Marketing Manager,https://www.jobstreet.co.id/id/job/digital-marketing-manager-3731777?token=0~80018015-025a-4683-9a93-f449f2b58686&sectionRank=868&jobId=jobstreet-id-job-3731777,Jakarta Pusat,13 hours ago,2021-12-24T04:14:55Z,IDR,10000000,14000000,monthly,,
standard,"501,131","Akuntansi / Keuangan,Akuntansi Umum / Pembiayaan",436628,PT Saka Agung Abadi,false,"Responsibilities:  Bertanggung jawab dalam merencanakan, mengarahkan, memonitor dan mengevaluasi sistem kerja akunting, pengelolaan data keuangan dan...",full_time,3731776,false,false,Finance Accounting Manager,https://www.jobstreet.co.id/id/job/finance-accounting-manager-3731776?token=0~80018015-025a-4683-9a93-f449f2b58686&sectionRank=869&jobId=jobstreet-id-job-3731776,Bali,13 hours ago,2021-12-24T04:14:42Z,,,,monthly,,
standard,"510,115","Manufaktur,Pemeliharaan",437760,Time International,false,"Job Description: Manages After Sales Service Department team members, including customer service interactions, reports, and repairs. Provides the...",full_time,3731773,false,false,Time Care Manager (Aftersales),https://www.jobstreet.co.id/id/job/time-care-manager-aftersales-3731773?token=0~80018015-025a-4683-9a93-f449f2b58686&sectionRank=870&jobId=jobstreet-id-job-3731773,Jakarta Raya,13 hours ago,2021-12-24T04:13:50Z,,,,monthly,,
standard,"501,130","Akuntansi / Keuangan,Audit & Pajak",437392,PT Sungai Budi ( Sungai Budi Group ),false,Kualifikasi: Usia maksimal 28 tahun Minimal pendidikan S1 Akuntansi/Semua jurusan Fresh graduated/ memiliki pengalaman minimal 1 tahun di bidang audit...,full_time,3731772,false,false,STAFF INTERNAL AUDITOR,https://www.jobstreet.co.id/id/job/staff-internal-auditor-3731772?token=0~8ba43ea2-69b2-4144-b95d-0bf4a2472476&sectionRank=871&jobId=jobstreet-id-job-3731772,Jakarta Raya,13 hours ago,2021-12-24T04:13:39Z,,,,monthly,,
standard,"504,141","Seni/Media/Komunikasi,Hubungan Masyarakat",426107,PT Agung Automall,false,"Deskripsi Pekerjaan: Mengelola (merencanakan, mengimplementasikan, mengembangkan dan mengevaluasi) semua kegiatan program CSR termasuk materi dan...",contract,3731771,false,false,Corporate Communication & CSR Specialist,https://www.jobstreet.co.id/id/job/corporate-communication-csr-specialist-3731771?token=0~8ba43ea2-69b2-4144-b95d-0bf4a2472476&sectionRank=872&jobId=jobstreet-id-job-3731771,Jakarta Pusat,13 hours ago,2021-12-24T04:13:37Z,,,,monthly,,
standout,"503,142","Penjualan / Pemasaran,Penjualan - Korporasi",jobstreet-id-28554,PT GED Lintas Indonesia,false,Kualifiasi :1. Pendidikan min S1 semua jurusan2. Usia 25-35th3. Pengalaman min 1th Sales dengan pengalaman Logistik (Warehouse/3PL)4. Memiliki...,full_time,3731768,false,true,Sales Executive 3PL (Logistics),https://www.jobstreet.co.id/id/job/sales-executive-3pl-logistics-3731768?token=0~8ba43ea2-69b2-4144-b95d-0bf4a2472476&sectionRank=873&jobId=jobstreet-id-job-3731768,Jakarta Selatan,13 hours ago,2021-12-24T04:12:09Z,IDR,6000000,7000000,monthly,,
standard,"505,138","Pelayanan,Pengacara / Asisten Legal",437712,Thamrin Group,false,Tugas &amp; Tanggung Jawab : Melakukan pengendalian dan pengelolaan dokumen legal &amp; asset perusahaan Memberikan opini legal berkaitan dengan aspek...,full_time,3731766,false,false,Corporate Legal Manager,https://www.jobstreet.co.id/id/job/corporate-legal-manager-3731766?token=0~8ba43ea2-69b2-4144-b95d-0bf4a2472476&sectionRank=874&jobId=jobstreet-id-job-3731766,Sumatera Selatan,13 hours ago,2021-12-24T04:11:12Z,,,,monthly,,
standard,"507,105","Pendidikan/Pelatihan,Pendidikan",jobstreet-id-343579,SMK Muhammadiyah 1 Genteng,false,"Lowongan PekerjaanGuru Teknik Pekerjaan dan JaringanKualifikasi : Pendidikan minimal S-1 Linier IPK minimal 3,00 Memiliki Semangat yang tinggi,...",full_time,3731764,false,false,Guru Teknik Komputer Jaringan,https://www.jobstreet.co.id/id/job/guru-teknik-komputer-jaringan-3731764?token=0~8ba43ea2-69b2-4144-b95d-0bf4a2472476&sectionRank=875&jobId=jobstreet-id-job-3731764,Banyuwangi,13 hours ago,2021-12-24T04:09:50Z,,,,monthly,,
standout,"503,142","Penjualan / Pemasaran,Penjualan - Korporasi",531120,PT. Aseli Dagadu Djokdja,false,"Memprospek klien potensial dan menjaga hubungan dan kepercayaan dari klien lama. Menemui, menghubungi atau memberikan informasi kepada pihak-pihak...",full_time,3731763,false,true,ACCOUNT OFFICER DAGADU DJOKDJA,https://www.jobstreet.co.id/id/job/account-officer-dagadu-djokdja-3731763?token=0~8ba43ea2-69b2-4144-b95d-0bf4a2472476&sectionRank=876&jobId=jobstreet-id-job-3731763,Yogyakarta,13 hours ago,2021-12-24T04:09:43Z,,,,monthly,,"Lingkungan & rekan kerja yang Smart, Smile, & Sensible,Paket gaji dan benefit lainnya yang menarik,Jenjang karir bagi yang berprestasi"
standout,"503,142","Penjualan / Pemasaran,Penjualan - Korporasi",434395,PT Korea Tomorrow & Global  Indonesia,false,Job Responsibility : Plan and establish annual department work plans. Review and approve/ disapprove its department annual operational budget...,full_time,3731762,false,true,Key Account Manager,https://www.jobstreet.co.id/id/job/key-account-manager-3731762?token=0~8ba43ea2-69b2-4144-b95d-0bf4a2472476&sectionRank=877&jobId=jobstreet-id-job-3731762,Jakarta Raya,13 hours ago,2021-12-24T04:08:55Z,,,,monthly,,"Joy To Every Moment,Career Development,Positive Working Environment"
standard,"507,105","Pendidikan/Pelatihan,Pendidikan",jobstreet-id-343578,MTS 6 Malang,false,Lowongan PekerjaanGuru PJOKKualifikasi : Usia maksimal 35 tahun Minimal pendidikan S-1 Linier Kreatif dan inovatif Mampu bekerja sama dalam tim Mampu...,full_time,3731761,false,false,Guru PJOK,https://www.jobstreet.co.id/id/job/guru-pjok-3731761?token=0~8ba43ea2-69b2-4144-b95d-0bf4a2472476&sectionRank=878&jobId=jobstreet-id-job-3731761,Malang,13 hours ago,2021-12-24T04:08:25Z,,,,monthly,,
standard,"508,191","Komputer/Teknologi Informasi,IT-Perangkat Lunak",jobstreet-id-169527,PT Mitra Semeru Indonesia,false,"PowerCommerce.Asia is the Leading E-commerce Omnichannel Enabler and Supply Chain Technology Solution – Services Company, open vacancy for position...",full_time,3731760,false,false,Front End Developer,https://www.jobstreet.co.id/id/job/front-end-developer-3731760?token=0~8ba43ea2-69b2-4144-b95d-0bf4a2472476&sectionRank=879&jobId=jobstreet-id-job-3731760,Jakarta Selatan,13 hours ago,2021-12-24T04:08:16Z,IDR,20000000,30000000,monthly,,
standard,"503,145","Penjualan / Pemasaran,Penjualan Ritel",jobstreet-id-343766,DMAMAM,false,Kualifikasi : Usia Maximal 35 Tahun Rajin Beribadah Pendidikan Minimal S1 Pemasaran / komunikasi atau bidang yang terkait Memiliki pengalaman minimal...,full_time,3731758,false,false,Supervisor Sales,https://www.jobstreet.co.id/id/job/supervisor-sales-3731758?token=0~8ba43ea2-69b2-4144-b95d-0bf4a2472476&sectionRank=880&jobId=jobstreet-id-job-3731758,Bogor,13 hours ago,2021-12-24T04:08:04Z,IDR,3000000,4000000,monthly,,
standard,"501,131","Akuntansi / Keuangan,Akuntansi Umum / Pembiayaan",jobstreet-id-343574,PT Rajasa Kemenangan Mandiri,false,"Kualifikasi : Lulusan D3, lulusan SMK dipersilahkan untuk melamar. Pengalaman kerja 1-2 tahun di bagian keuangan. Deskripsi pekerjaan : Mencatat...",full_time,3731756,false,false,Finance & Accounting,https://www.jobstreet.co.id/id/job/finance-accounting-3731756?token=0~8ba43ea2-69b2-4144-b95d-0bf4a2472476&sectionRank=881&jobId=jobstreet-id-job-3731756,Jakarta Pusat,13 hours ago,2021-12-24T04:06:46Z,,,,monthly,,
standard,"501,131","Akuntansi / Keuangan,Akuntansi Umum / Pembiayaan",431846,PT Dutapalma Nusantara (Darmex Agro Group),false,"Job Desc : Presenting financial statements accurately, in detail and on time Manage accounting functions to produce the financial statements required...",full_time,3731755,false,false,Accounting Assistant Manager,https://www.jobstreet.co.id/id/job/accounting-assistant-manager-3731755?token=0~8ba43ea2-69b2-4144-b95d-0bf4a2472476&sectionRank=882&jobId=jobstreet-id-job-3731755,Jakarta Selatan,13 hours ago,2021-12-24T04:06:17Z,,,,monthly,,
standard,"506,107","Hotel/Restoran,Makanan/Minuman/Pelayanan Restoran",jobstreet-id-343714,Arion coffee and tea,false,"Qualifications: Maximal 25 years old Well Groomed Hard Working, Discipline and Good attitude Able to work under pressure Able to work in a team...",full_time,3731754,false,false,SERVER,https://www.jobstreet.co.id/id/job/server-3731754?token=0~8ba43ea2-69b2-4144-b95d-0bf4a2472476&sectionRank=883&jobId=jobstreet-id-job-3731754,Yogyakarta,13 hours ago,2021-12-24T04:06:04Z,,,,monthly,,
standard,"510,197","Manufaktur,Penjaminan Kualitas / QA",428384,PT Star Cosmos,false,Tugas dan Tanggung Jawab: Memantau perkembangan semua produk yang di produksi oleh perusahaan. Memverifikasi Kualitas produk. Memonitor setiap proses...,contract,3731753,false,false,Inspektor Quality Control,https://www.jobstreet.co.id/id/job/inspektor-quality-control-3731753?token=0~8ba43ea2-69b2-4144-b95d-0bf4a2472476&sectionRank=884&jobId=jobstreet-id-job-3731753,Tangerang,13 hours ago,2021-12-24T04:05:55Z,,,,monthly,,
standout,"504,101","Seni/Media/Komunikasi,Seni / Desain Kreatif",jobstreet-id-79141,OPTIK WINSEE,false,"Deskripsi Pekerjaan Mendesain flyer, brosur, banner, dll Mengedit foto atau gambar. Membuat desain produk baru. Membuat desain untuk pemasaran produk....",full_time,3731751,false,true,Graphic Designer,https://www.jobstreet.co.id/id/job/graphic-designer-3731751?token=0~8ba43ea2-69b2-4144-b95d-0bf4a2472476&sectionRank=885&jobId=jobstreet-id-job-3731751,Jakarta Pusat,13 hours ago,2021-12-24T04:05:44Z,,,,monthly,,
standard,"508,193","Komputer/Teknologi Informasi,IT-Admin Jaringan/Sistem/Database",430211,Agung Sedayu Group,false,Tugas &amp; Tanggung Jawab: Melakukan kegiatan IT Audit dengan perencanaan audit yang telah disiapkan maupun penugasan khusus Membuat draft laporan...,full_time,3731750,false,false,IT Audit Staff,https://www.jobstreet.co.id/id/job/it-audit-staff-3731750?token=0~8ba43ea2-69b2-4144-b95d-0bf4a2472476&sectionRank=886&jobId=jobstreet-id-job-3731750,Jakarta Utara,13 hours ago,2021-12-24T04:05:27Z,,,,monthly,,
standard,"506,107","Hotel/Restoran,Makanan/Minuman/Pelayanan Restoran",jobstreet-id-343741,Kangen 49 Coffee Shop & Resto,false,"Kualifikasi : Usia minimal 18 - 25 tahun Pendidikan minimal SMA / SMK sederajat Mampu bekerja sama dalam tim Rapih, rajin, bersih dan disiplin...",full_time,3731748,false,false,WAITER,https://www.jobstreet.co.id/id/job/waiter-3731748?token=0~8ba43ea2-69b2-4144-b95d-0bf4a2472476&sectionRank=887&jobId=jobstreet-id-job-3731748,Pekanbaru,13 hours ago,2021-12-24T04:05:09Z,,,,monthly,,
standard,"501,131","Akuntansi / Keuangan,Akuntansi Umum / Pembiayaan",jobstreet-id-299247,PT Bumi Lestari Investama,false,Deskripsi Pekerjaan:1.    Melakukan review journal voucher depreciations &amp; general journal.2.    Melakukan review journal voucher accounts payable...,full_time,3731746,false,false,"Accounting, Finance & Tax Staff",https://www.jobstreet.co.id/id/job/accounting-finance-tax-staff-3731746?token=0~8ba43ea2-69b2-4144-b95d-0bf4a2472476&sectionRank=888&jobId=jobstreet-id-job-3731746,Jakarta Raya,13 hours ago,2021-12-24T04:04:37Z,IDR,5000000,6000000,monthly,,
standard,"501,131","Akuntansi / Keuangan,Akuntansi Umum / Pembiayaan",431846,PT Dutapalma Nusantara (Darmex Agro Group),false,Job Descriptions: Bank reconciliation Memory Accounting Journal Filling data / voucher Create sales invoices Making financial reporting  Requirements...,full_time,3731744,false,false,Accounting Staff,https://www.jobstreet.co.id/id/job/accounting-staff-3731744?token=0~8ba43ea2-69b2-4144-b95d-0bf4a2472476&sectionRank=889&jobId=jobstreet-id-job-3731744,Jakarta Selatan,13 hours ago,2021-12-24T04:03:35Z,,,,monthly,,
standout,"503,203","Penjualan / Pemasaran,Digital Marketing",519488,PT Audy Mandiri Indonesia,false,Candidate must possess at least Diploma in Marketing or equivalent. At least 1 Year(s) of working experience in the related field is required for this...,full_time,3731743,false,true,Social Media Officer,https://www.jobstreet.co.id/id/job/social-media-officer-3731743?token=0~8ba43ea2-69b2-4144-b95d-0bf4a2472476&sectionRank=890&jobId=jobstreet-id-job-3731743,Jakarta Raya,13 hours ago,2021-12-24T04:03:31Z,IDR,5000000,6500000,monthly,,"fun and easy going work culture,health and dental insurance"
standout,"505,138","Pelayanan,Pengacara / Asisten Legal",438434,PT Usaha Kreatif Indonesia,false,Tugas &amp; Tanggung Jawab: Bertanggung jawab pada perizinan internal dan eksternal perusahaan termasuk OSS atau di K/L terkait. Bertanggung jawab...,full_time,3731742,false,true,HR Legal,https://www.jobstreet.co.id/id/job/hr-legal-3731742?token=0~8ba43ea2-69b2-4144-b95d-0bf4a2472476&sectionRank=891&jobId=jobstreet-id-job-3731742,Surabaya,13 hours ago,2021-12-24T04:01:59Z,IDR,5000000,7000000,monthly,,
