adType,categoriesCode,categoriesName,companyId,companyName,companyPrivate,description,employment,id,isClassified,isStandout,jobTitle,jobUrl,locations,postingDuration,postedAt,salarycurrency,salaryMin,salaryMax,salaryPeriod,salaryTerm,sellingPoints
standout,"503,145","Penjualan / Pemasaran,Penjualan Ritel",jobstreet-id-294247,Politeknik Bentara Citra Bangsa,false,Kualifikasi: S1 Jurusan Manajemen (Marketing) / Komunikasi Pengalaman 2-3 tahun dalam bidang pemasaran dan penjualan (diutamakan di bidang Pendidikan)...,full_time,3717479,false,true,Sales & Marketing Staff,https://www.jobstreet.co.id/id/job/sales-marketing-staff-3717479?token=0~d4b55409-44c9-4d5f-ba0a-fe2fcbc5eb30&sectionRank=375&jobId=jobstreet-id-job-3717479,Jakarta Raya,21 hours ago,2021-12-25T20:01:00Z,,,,monthly,,
standard,"503,144","Penjualan / Pemasaran,Penjualan - Jasa Keuangan",413733,"PT Asuransi Bintang, Tbk",false,Memastikan tercapainya target penjualan individu sesuai segmen pasar dan/atau Sumber Bisnis yang ditugaskan dan disepakati bersama sesuai dengan...,full_time,3717480,false,false,(JV2112001) Account Officer - Sales - Cirebon,https://www.jobstreet.co.id/id/job/jv2112001-account-officer-sales-cirebon-3717480?token=0~d4b55409-44c9-4d5f-ba0a-fe2fcbc5eb30&sectionRank=376&jobId=jobstreet-id-job-3717480,Cirebon,21 hours ago,2021-12-25T20:01:00Z,,,,monthly,,
standard,"508,191","Komputer/Teknologi Informasi,IT-Perangkat Lunak",jobstreet-id-299029,PT. Ruang Dagang Internasional,false,"Responsibilities: Identify, design, and implement internal process improvements: automating manual processes, optimizing data delivery, maintaining...",full_time,3717481,false,false,Data Engineer,https://www.jobstreet.co.id/id/job/data-engineer-3717481?token=0~d4b55409-44c9-4d5f-ba0a-fe2fcbc5eb30&sectionRank=377&jobId=jobstreet-id-job-3717481,Jakarta Raya,21 hours ago,2021-12-25T20:00:59Z,,,,monthly,,
standard,"508,191","Komputer/Teknologi Informasi,IT-Perangkat Lunak",435780,PT Pandurasa Kharisma,false,Job Descriptions: Code and test programming for in-house software programs Debug code for existing programs based on immediate need Conduct code...,contract,3717486,false,false,IT PROGRAMMER,https://www.jobstreet.co.id/id/job/it-programmer-3717486?token=0~d4b55409-44c9-4d5f-ba0a-fe2fcbc5eb30&sectionRank=378&jobId=jobstreet-id-job-3717486,Jakarta Utara,21 hours ago,2021-12-25T20:00:59Z,,,,monthly,,
standard,"503,142","Penjualan / Pemasaran,Penjualan - Korporasi",1882,PT Veda Praxis,false,"Requirements: Minimal Bachelor Degree in any field Minimal 2-4 years in a similiar position Having good communication skill, organizing, presentation...",full_time,3717487,false,false,Presales (Advisory & Assurance Services),https://www.jobstreet.co.id/id/job/presales-advisory-assurance-services-3717487?token=0~d4b55409-44c9-4d5f-ba0a-fe2fcbc5eb30&sectionRank=379&jobId=jobstreet-id-job-3717487,Jakarta Selatan,21 hours ago,2021-12-25T20:00:59Z,,,,monthly,,
standout,"508,191","Komputer/Teknologi Informasi,IT-Perangkat Lunak",jobstreet-id-211350,PT. KOSMETIKA CANTIK INDONESIA,false,Job Description  Creating test plan and execution of test to identify issues with software. Identifying and analyzing any bug and error found during...,full_time,3717490,false,true,SOFTWARE QA ENGINEER,https://www.jobstreet.co.id/id/job/software-qa-engineer-3717490?token=0~d4b55409-44c9-4d5f-ba0a-fe2fcbc5eb30&sectionRank=380&jobId=jobstreet-id-job-3717490,Malang,21 hours ago,2021-12-25T20:00:59Z,,,,monthly,,
standard,"508,191","Komputer/Teknologi Informasi,IT-Perangkat Lunak",434365,Kompas Gramedia - KG Media,false,"Qualifications Bachelor degree in Computer Science, Information Engineering or a related Proven working experience in software development and strong...",full_time,3717492,false,false,IOS Engineer - Kompas.com,https://www.jobstreet.co.id/id/job/ios-engineer-kompas-com-3717492?token=0~d4b55409-44c9-4d5f-ba0a-fe2fcbc5eb30&sectionRank=381&jobId=jobstreet-id-job-3717492,Jakarta Barat,21 hours ago,2021-12-25T20:00:59Z,,,,monthly,,
standard,"508,191","Komputer/Teknologi Informasi,IT-Perangkat Lunak",jobstreet-id-6927,Goodwill Consulting,false,"Main Responsibilities :  Play a significant role in all aspects of solution implementation such as design, configuration, development, deployment,...",full_time,3717510,false,false,ERP Technical Consultant,https://www.jobstreet.co.id/id/job/erp-technical-consultant-3717510?token=0~d4b55409-44c9-4d5f-ba0a-fe2fcbc5eb30&sectionRank=382&jobId=jobstreet-id-job-3717510,Jakarta Raya,21 hours ago,2021-12-25T20:00:59Z,IDR,5500000,9000000,monthly,,
standard,"507,105","Pendidikan/Pelatihan,Pendidikan",438407,Universitas Bunda Mulia (Yayasan Pendidikan Bunda Mulia ),false,"Kualifikasi Umum : Usia maksimal 40 tahun Mampu bekerja secara multi tasking dan bekerja dalam tim (team player) Menguasai Microsoft Office, internet,...",full_time,3717516,false,false,Dosen Prodi Hospitality dan Pariwisata (UBM Kampus Serpong),https://www.jobstreet.co.id/id/job/dosen-prodi-hospitality-dan-pariwisata-ubm-kampus-serpong-3717516?token=0~d4b55409-44c9-4d5f-ba0a-fe2fcbc5eb30&sectionRank=383&jobId=jobstreet-id-job-3717516,Tangerang,21 hours ago,2021-12-25T20:00:59Z,,,,monthly,,
standard,"501,131","Akuntansi / Keuangan,Akuntansi Umum / Pembiayaan",438337,PT Wook Global Technology,false,"Pelamar dimohon keseriusannya dalam melamar dan membaca JobDesk serta Kualifikasi sebelum melamar, khususnya daerah penempatan, hanya pelamar yang...",full_time,3717522,false,false,FINANCE AP & ACCOUNTING STAFF MANDARIN SPEAKER,https://www.jobstreet.co.id/id/job/finance-ap-accounting-staff-mandarin-speaker-3717522?token=0~d4b55409-44c9-4d5f-ba0a-fe2fcbc5eb30&sectionRank=384&jobId=jobstreet-id-job-3717522,Jakarta Utara,21 hours ago,2021-12-25T20:00:59Z,,,,monthly,,
standard,"508,191","Komputer/Teknologi Informasi,IT-Perangkat Lunak",1408,Deloitte,false,Work individually or with teams to deliver risk services which include but are not limited to: Involve in the projects related to SAP S/4...,full_time,3717533,false,false,SAP Supply Chain Functional Senior Associate,https://www.jobstreet.co.id/id/job/sap-supply-chain-functional-senior-associate-3717533?token=0~d4b55409-44c9-4d5f-ba0a-fe2fcbc5eb30&sectionRank=385&jobId=jobstreet-id-job-3717533,Jakarta Raya,21 hours ago,2021-12-25T20:00:58Z,,,,monthly,,
standard,"501,135","Akuntansi / Keuangan,Perbankan / Jasa Finansial ",436462,PT. Rezeki Bersama Teknologi,false,"Job Descriptions: Become liaison between department, and make a better communication between team and the leader. Become a support in department. Push...",full_time,3717543,false,false,Operational Mandarin Translator,https://www.jobstreet.co.id/id/job/operational-mandarin-translator-3717543?token=0~d4b55409-44c9-4d5f-ba0a-fe2fcbc5eb30&sectionRank=386&jobId=jobstreet-id-job-3717543,Jakarta Selatan,21 hours ago,2021-12-25T20:00:58Z,IDR,10000000,13000000,monthly,,
standout,"503,139","Penjualan / Pemasaran,Pemasaran/Pengembangan Bisnis",jobstreet-id-25466,PT Grahanindo Mecanitron,false,Requirements: Candidate must possess at least a Bachelor Degree in Technique Required Skills : Can speak English written and spoken Have driver's...,full_time,3717544,false,true,Sales Marketing,https://www.jobstreet.co.id/id/job/sales-marketing-3717544?token=0~d4b55409-44c9-4d5f-ba0a-fe2fcbc5eb30&sectionRank=387&jobId=jobstreet-id-job-3717544,Jakarta Raya,21 hours ago,2021-12-25T20:00:58Z,,,,monthly,,
standout,"503,143","Penjualan / Pemasaran,Penjualan - Teknik/Teknikal/IT",jobstreet-id-188736,PT Arupa Cloud Nusantara,false,PS: Do not apply if you do not have experience in Sales/Channel of CCTV/Surveillance Products. The job title on your business card will be Channel...,full_time,3717559,false,true,Sales for CCTV Services,https://www.jobstreet.co.id/id/job/sales-for-cctv-services-3717559?token=0~d4b55409-44c9-4d5f-ba0a-fe2fcbc5eb30&sectionRank=388&jobId=jobstreet-id-job-3717559,Jakarta Raya,21 hours ago,2021-12-25T20:00:58Z,IDR,8000000,12000000,monthly,,"Opportunity to Bring New Product to Market,Flexible Working Hour"
standard,"503,143","Penjualan / Pemasaran,Penjualan - Teknik/Teknikal/IT",426430,PT Biometrik Citra Solusi,false,KUALIFIKASI: PENDIDIKAN MINIMAL S1 IT / SISTEM INFORMASI / BIDANG KOMPUTER MINIMAL MEMILIKI PENGALAMAN KERJA SELAMA 1 TAHUN DI BIDANG YANG SAMA  USIA...,full_time,3717571,false,false,CARE OFFICER - SOLO,https://www.jobstreet.co.id/id/job/care-officer-solo-3717571?token=0~d4b55409-44c9-4d5f-ba0a-fe2fcbc5eb30&sectionRank=389&jobId=jobstreet-id-job-3717571,Jawa Tengah,21 hours ago,2021-12-25T20:00:58Z,IDR,1800000,2000000,monthly,,
standard,"502,146","Sumber Daya Manusia/Personalia,Sekretaris",432732,PT Global Bintang Timur Ekspress,false,Requirements : Age 18 - 32 Years Old +1 years of relevant experience Excellent verbal and written skills in Mandarin Excellent knowledge in Microsoft...,full_time,3717590,false,false,Assistant Manager - Mandarin Speaker,https://www.jobstreet.co.id/id/job/assistant-manager-mandarin-speaker-3717590?token=0~d4b55409-44c9-4d5f-ba0a-fe2fcbc5eb30&sectionRank=390&jobId=jobstreet-id-job-3717590,Jakarta Utara,21 hours ago,2021-12-25T20:00:57Z,,,,monthly,,
standard,"503,144","Penjualan / Pemasaran,Penjualan - Jasa Keuangan",208,PT AXA Mandiri Financial Services,false,"Deskripsi PekerjaanFinancial Advisor (FA) adalah perencana keuangan nasabah. Sebagai Senior Financial Advisor, Anda memiliki peran penting sebagai...",full_time,3717610,false,false,Senior Financial Advisor (Bancassurance) - Samarinda,https://www.jobstreet.co.id/id/job/senior-financial-advisor-bancassurance-samarinda-3717610?token=0~b6b6aa89-22ca-4d7b-8b6c-98332d6cf354&sectionRank=391&jobId=jobstreet-id-job-3717610,Samarinda,21 hours ago,2021-12-25T20:00:57Z,IDR,4000000,5600000,monthly,,
standout,"503,143","Penjualan / Pemasaran,Penjualan - Teknik/Teknikal/IT",397182,PT Sunway Trek Masindo,false,"Job Description : Marketing/Sales, looking for new customers, daily &amp; sales reports Achievement on target, timely reports, customer database Make...",full_time,3717616,false,true,SALES EXECUTIVE HEAVY EQUIPMENT,https://www.jobstreet.co.id/id/job/sales-executive-heavy-equipment-3717616?token=0~b6b6aa89-22ca-4d7b-8b6c-98332d6cf354&sectionRank=392&jobId=jobstreet-id-job-3717616,Jakarta Raya,21 hours ago,2021-12-25T20:00:57Z,,,,monthly,,"Insurance and medical claim,Commission and Bonus,Transportation allowance"
standout,"503,151","Penjualan / Pemasaran,Telesales/Telemarketing",jobstreet-id-18567,PT Megasari Makmur (Godrej Indonesia),false,Meningkatkan Omset &amp; Coverage area Bekerja sama dengan Regional distributor dalam Strategi dan peningkatan Penjualan Memastikan harga sesuai di...,contract,3717628,false,true,SUPERVISOR  SALES (BATU LICIN),https://www.jobstreet.co.id/id/job/supervisor-sales-batu-licin-3717628?token=0~b6b6aa89-22ca-4d7b-8b6c-98332d6cf354&sectionRank=393&jobId=jobstreet-id-job-3717628,Kalimantan Selatan,21 hours ago,2021-12-25T20:00:57Z,IDR,4100000,5330000,monthly,,
standout,"508,191","Komputer/Teknologi Informasi,IT-Perangkat Lunak",435507,PT Nieve Aplikasi Mandiri,false,"General Programming Skills, Analyzing Information, and Problem Solving. Software Algorithm Design, Software Performance Tuning, Attention to Detail,...",full_time,3717649,false,true,IT Programmer,https://www.jobstreet.co.id/id/job/it-programmer-3717649?token=0~b6b6aa89-22ca-4d7b-8b6c-98332d6cf354&sectionRank=394&jobId=jobstreet-id-job-3717649,Tangerang,21 hours ago,2021-12-25T20:00:56Z,,,,monthly,,
standout,"508,191","Komputer/Teknologi Informasi,IT-Perangkat Lunak",428353,PT Sofco Graha,false,Persyaratan:- Berdomisili di Surabaya- Memahami framework Java Spring Boot dan Angular 7++- Mempunyai pengalaman menggunakan framework Java Spring...,full_time,3717663,false,true,R&D Developer,https://www.jobstreet.co.id/id/job/r-d-developer-3717663?token=0~b6b6aa89-22ca-4d7b-8b6c-98332d6cf354&sectionRank=395&jobId=jobstreet-id-job-3717663,Surabaya,21 hours ago,2021-12-25T20:00:56Z,,,,monthly,,
standout,"503,142","Penjualan / Pemasaran,Penjualan - Korporasi",433773,Integrasi Megakanal Agensi,false,Kandidat harus memiliki pendidikan mininal Diploma di bidang apapun.Minimal 1 Tahun pengalaman kerja di bidang terkait diperlukan untuk posisi...,full_time,3717667,false,true,Sales,https://www.jobstreet.co.id/id/job/sales-3717667?token=0~b6b6aa89-22ca-4d7b-8b6c-98332d6cf354&sectionRank=396&jobId=jobstreet-id-job-3717667,Jakarta Raya,21 hours ago,2021-12-25T20:00:56Z,IDR,4000000,7000000,monthly,,"Attractive commission and bonuses,BPJS Ketenagakerjaan and BPJS Kesehatan"
standout,"511,150","Bangunan/Konstruksi,Properti/Real Estate",jobstreet-id-183311,PT Indo Megah Abadi,false,Kandidat harus memiliki setidaknya Gelar Sarjana/Diploma di bidang apapun Pengembangan Properti/Manajemen Real Estate atau setara Setidaknya memiliki...,full_time,3717675,false,true,Sales Supervisor (SPV) Property,https://www.jobstreet.co.id/id/job/sales-supervisor-spv-property-3717675?token=0~b6b6aa89-22ca-4d7b-8b6c-98332d6cf354&sectionRank=397&jobId=jobstreet-id-job-3717675,Cileungsi,21 hours ago,2021-12-25T20:00:56Z,IDR,5000000,10000000,monthly,,Komisi atau Bonus
standout,"503,143","Penjualan / Pemasaran,Penjualan - Teknik/Teknikal/IT",jobstreet-id-188736,PT Arupa Cloud Nusantara,false,It's rewarding to work at a company where YOU make a difference!If you're passionate about the ever-changing IT industry and enjoy working in a...,full_time,3717678,false,true,Technology Sales,https://www.jobstreet.co.id/id/job/technology-sales-3717678?token=0~b6b6aa89-22ca-4d7b-8b6c-98332d6cf354&sectionRank=398&jobId=jobstreet-id-job-3717678,Jakarta Raya,21 hours ago,2021-12-25T20:00:56Z,IDR,8000000,15000000,monthly,,
standard,"510,140","Manufaktur,Pembelian/Manajemen Material",,,true,Requirements: Candidate must possess at least Bachelor's Degree/Post Graduate Degree in any field Age maximum 43 years old Required language(s):...,full_time,3717684,false,false,International Purchase (Mandarin),https://www.jobstreet.co.id/id/job/international-purchase-mandarin-3717684?token=0~b6b6aa89-22ca-4d7b-8b6c-98332d6cf354&sectionRank=399&jobId=jobstreet-id-job-3717684,Tangerang,21 hours ago,2021-12-25T20:00:55Z,,,,monthly,,
standout,"514,104","Lainnya,Jurnalis/Editor",jobstreet-id-202081,PT Green Source Indonesia,false,"Kualifikasi- Usia Maksimal 25 thn- Pendidikan minimal Diploma/S1 komunikasi, diutamakan sastra mandarin - Pengalaman min 1 thn sebagai translator...",contract,3717690,false,true,Translator Mandarin,https://www.jobstreet.co.id/id/job/translator-mandarin-3717690?token=0~b6b6aa89-22ca-4d7b-8b6c-98332d6cf354&sectionRank=400&jobId=jobstreet-id-job-3717690,Tangerang,21 hours ago,2021-12-25T20:00:55Z,,,,monthly,,
standout,"501,135","Akuntansi / Keuangan,Perbankan / Jasa Finansial ",506844,PT. Kredit Utama Fintech Indonesia,false,"Responsibilities: Manage verification team and report to Head Of Operation / Management. Manage, assist and guide the daily work of verification team...",full_time,3717697,false,true,Credit Analyst Manager (Mandarin Speaking),https://www.jobstreet.co.id/id/job/credit-analyst-manager-mandarin-speaking-3717697?token=0~b6b6aa89-22ca-4d7b-8b6c-98332d6cf354&sectionRank=401&jobId=jobstreet-id-job-3717697,Jakarta Raya,21 hours ago,2021-12-25T20:00:55Z,,,,monthly,,"Food (2x/days),Monthly Bonus,Fun Environment"
standard,"507,105","Pendidikan/Pelatihan,Pendidikan",426402,Bina Bahasa Mandarin,false,"Minimal lulusan S1/ D3 Mandarin Memiliki pengalaman kerja minimal 1 tahun  Mempunyai managerial skill, kompetensi bahasa yang baik Menguasai komputer...",full_time,3717696,false,false,Mandarin School Teacher ( Guru Mandarin),https://www.jobstreet.co.id/id/job/mandarin-school-teacher-guru-mandarin-3717696?token=0~b6b6aa89-22ca-4d7b-8b6c-98332d6cf354&sectionRank=402&jobId=jobstreet-id-job-3717696,Jakarta Raya,21 hours ago,2021-12-25T20:00:55Z,IDR,3500000,5000000,monthly,,
standout,"505,120","Pelayanan,Layanan Sosial/Konseling",jobstreet-id-262048,PT. IBU ANAK SUKSES,false,Jobdesc : Membantu para pejuang asi lulus mengASIhi selama 2 tahun Melakukan konseling laktasi secara online maupun offline dengan sepenuh hati...,full_time,3717715,false,true,Konsultan Laktasi,https://www.jobstreet.co.id/id/job/konsultan-laktasi-3717715?token=0~b6b6aa89-22ca-4d7b-8b6c-98332d6cf354&sectionRank=403&jobId=jobstreet-id-job-3717715,Surabaya,21 hours ago,2021-12-25T20:00:55Z,IDR,2500000,3000000,monthly,,"Kesempatan untuk berkembang,Budaya kerja yang positif"
standard,"511,150","Bangunan/Konstruksi,Properti/Real Estate",433889,"PT Jababeka, Tbk",false,"Uraian Pekerjaan: Memasarkan Property Inhouse, mempelajari Property Market terutama dibidang Resort Mencari Client, Bertemu Client jika perlu, Follow...",full_time,3717713,false,false,Sales Associate / Mitra Property - Tanjung Lesung,https://www.jobstreet.co.id/id/job/sales-associate-mitra-property-tanjung-lesung-3717713?token=0~b6b6aa89-22ca-4d7b-8b6c-98332d6cf354&sectionRank=404&jobId=jobstreet-id-job-3717713,Banten,21 hours ago,2021-12-25T20:00:55Z,,,,monthly,,
standout,"503,143","Penjualan / Pemasaran,Penjualan - Teknik/Teknikal/IT",jobstreet-id-46514,PT Multi Mortar,false,Kualifikasi: Berusia maksimal 35 tahun Memiliki pengalaman sebagai sales produk Mampu mengendarai dan memiliki motor Pribadi Berdomisili di Jakarta...,full_time,3717733,false,true,MARKETING,https://www.jobstreet.co.id/id/job/marketing-3717733?token=0~b6b6aa89-22ca-4d7b-8b6c-98332d6cf354&sectionRank=405&jobId=jobstreet-id-job-3717733,Jakarta Utara,21 hours ago,2021-12-25T20:00:55Z,,,,monthly,,
standard,"508,191","Komputer/Teknologi Informasi,IT-Perangkat Lunak",413954,"PT Gunung Raja Paksi,Tbk",false,"Job Description:Design, develop and support apps with focus on SAP ABAPRequirements: Minimum 3 years experience in SAP ABAP developer Knowledge and...",full_time,3717734,false,false,SAP ABAP,https://www.jobstreet.co.id/id/job/sap-abap-3717734?token=0~b6b6aa89-22ca-4d7b-8b6c-98332d6cf354&sectionRank=406&jobId=jobstreet-id-job-3717734,Cikarang,21 hours ago,2021-12-25T20:00:55Z,,,,monthly,,
standard,"509,186","Teknik,Teknik Elektronika",428384,PT Star Cosmos,false,"Tugas dan Tanggung Jawab:  Melakukan kunjungan dan monitor aktivitas layanan purna jual yang berada di areanya, untuk memastikan dilakukan sesuai...",full_time,3717750,false,false,Supervisor Teknisi Service Samarinda,https://www.jobstreet.co.id/id/job/supervisor-teknisi-service-samarinda-3717750?token=0~b6b6aa89-22ca-4d7b-8b6c-98332d6cf354&sectionRank=407&jobId=jobstreet-id-job-3717750,Samarinda,21 hours ago,2021-12-25T20:00:54Z,,,,monthly,,
standard,"503,139","Penjualan / Pemasaran,Pemasaran/Pengembangan Bisnis",438481,Yayasan Adikara Niat,false,"Job Description: Generate, Monitor, &amp; Follow Up Leads Database Create the markerting event concept (Analyzing, Goal Setting, Budgeting) Create...",full_time,3717753,false,false,"Business Development Regina Pacis School, Jakarta",https://www.jobstreet.co.id/id/job/business-development-regina-pacis-school-jakarta-3717753?token=0~b6b6aa89-22ca-4d7b-8b6c-98332d6cf354&sectionRank=408&jobId=jobstreet-id-job-3717753,Jakarta Barat,21 hours ago,2021-12-25T20:00:54Z,,,,monthly,,
standard,"514,104","Lainnya,Jurnalis/Editor",jobstreet-id-302641,PT. BAJA PERKASA SENTOSA,false,"Persyaratan Pendidikan minimal S1 dari segala jurusan Bisa membaca, menulis dan berbicara dalam Bahasa Mandarin dengan baik Keterampilan komunikasi...",full_time,3717759,false,false,Mandarin Translator,https://www.jobstreet.co.id/id/job/mandarin-translator-3717759?token=0~b6b6aa89-22ca-4d7b-8b6c-98332d6cf354&sectionRank=409&jobId=jobstreet-id-job-3717759,Serang,21 hours ago,2021-12-25T20:00:54Z,IDR,6000000,12000000,monthly,,
standout,"503,145","Penjualan / Pemasaran,Penjualan Ritel",433381,PT Home Center Indonesia ( Informa Furnishings ),false,Usia maksimal 30 tahun Pendidikan minimal D3 / S1 Seni Rupa / Desain Grafis / Desain Interior / Multimedia / Fashion / Arsitektur / Design Komunikasi...,full_time,3717765,false,true,Visual Merchandising Retail Staff Cabang Magelang,https://www.jobstreet.co.id/id/job/visual-merchandising-retail-staff-cabang-magelang-3717765?token=0~b6b6aa89-22ca-4d7b-8b6c-98332d6cf354&sectionRank=410&jobId=jobstreet-id-job-3717765,Magelang,21 hours ago,2021-12-25T20:00:54Z,,,,monthly,,
standard,"508,193","Komputer/Teknologi Informasi,IT-Admin Jaringan/Sistem/Database",414113,"PT. Metrodata Electronics, Tbk",false,Personal Qualification: Minimum of Diplome-3 Degree in computer science or related field Minimum 3 (three) years relevant experience will be required...,contract,3717783,false,false,Network and System Administrator,https://www.jobstreet.co.id/id/job/network-and-system-administrator-3717783?token=0~b6b6aa89-22ca-4d7b-8b6c-98332d6cf354&sectionRank=411&jobId=jobstreet-id-job-3717783,Jakarta Barat,21 hours ago,2021-12-25T20:00:53Z,,,,monthly,,
standard,"501,135","Akuntansi / Keuangan,Perbankan / Jasa Finansial ",437910,PT Trihamas Finance,false,Kualifikasi: Penempatan di cabang Jawa Timur dan Sekitarnya Diutamakan kandidat berdomisili setempat Usia Maksimum 30 tahun atau 32 tahun untuk yang...,full_time,3717784,false,false,Problem Account Officer (PAO) Jawa Timur,https://www.jobstreet.co.id/id/job/problem-account-officer-pao-jawa-timur-3717784?token=0~b6b6aa89-22ca-4d7b-8b6c-98332d6cf354&sectionRank=412&jobId=jobstreet-id-job-3717784,Jawa Timur,21 hours ago,2021-12-25T20:00:53Z,IDR,2500000,3500000,monthly,,
standout,"507,105","Pendidikan/Pelatihan,Pendidikan",451395,BTB School Pluit,false,"Criteria: Degree in Secondary Education Major in Accounting/ Economic/ Business Studies (or similar background) Bachelor degree, preferably with...",full_time,3717796,false,true,Full Time Accounting/ Economic/ Business Studies Teacher,https://www.jobstreet.co.id/id/job/full-time-accounting-economic-business-studies-teacher-3717796?token=0~b6b6aa89-22ca-4d7b-8b6c-98332d6cf354&sectionRank=413&jobId=jobstreet-id-job-3717796,Jakarta Utara,21 hours ago,2021-12-25T20:00:53Z,,,,monthly,,
standard,"508,193","Komputer/Teknologi Informasi,IT-Admin Jaringan/Sistem/Database",432846,PT Graha Karya Informasi,false,Bachelor’s degree in Computer science or Information System or related field. Experience 1 year experienced in related field Experienced in...,full_time,3717812,false,false,System Engineer,https://www.jobstreet.co.id/id/job/system-engineer-3717812?token=0~b6b6aa89-22ca-4d7b-8b6c-98332d6cf354&sectionRank=414&jobId=jobstreet-id-job-3717812,Jakarta Raya,21 hours ago,2021-12-25T20:00:53Z,,,,monthly,,
standout,"503,145","Penjualan / Pemasaran,Penjualan Ritel",427583,PT Mata Air Persada,false,DIBUTUHKAN REGIONAL SALES(Jakarta dan Bandung) Anda ingin sukses dalam karier Pemasaran di bidang Arsitektur dan Konstruksi?Anda senang berkomunikasi...,contract,3717821,false,true,Regional Sales (Jakarta dan Bandung),https://www.jobstreet.co.id/id/job/regional-sales-jakarta-dan-bandung-3717821?token=0~b6b6aa89-22ca-4d7b-8b6c-98332d6cf354&sectionRank=415&jobId=jobstreet-id-job-3717821,Jakarta Pusat,21 hours ago,2021-12-25T20:00:53Z,,,,monthly,,
standout,"508,191","Komputer/Teknologi Informasi,IT-Perangkat Lunak",519681,PT Sharing Vision Indonesia,false,Bertugas untuk melakukan pemograman Back-end dan Front-endPENEMPATAN WFO JAKARTAPersyaratan: Mempunyai pengalaman minimal 1 tahun sebagai software...,full_time,3717828,false,true,Programmer Golang dan ReactJS,https://www.jobstreet.co.id/id/job/programmer-golang-dan-reactjs-3717828?token=0~b6b6aa89-22ca-4d7b-8b6c-98332d6cf354&sectionRank=416&jobId=jobstreet-id-job-3717828,Jakarta Pusat,21 hours ago,2021-12-25T20:00:52Z,IDR,8000000,12000000,monthly,,
standard,"508,191","Komputer/Teknologi Informasi,IT-Perangkat Lunak",433821,PT Intersolusi Teknologi Asia,false,"Responsibilities:Your duties will include (but will not be limited to): Performing or directing website updates. Developing, maintaining and...",full_time,3717839,false,false,Javascript Developer,https://www.jobstreet.co.id/id/job/javascript-developer-3717839?token=0~b6b6aa89-22ca-4d7b-8b6c-98332d6cf354&sectionRank=417&jobId=jobstreet-id-job-3717839,"Jakarta Raya,Bandung",21 hours ago,2021-12-25T20:00:52Z,IDR,4000000,7000000,monthly,,
standout,"508,191","Komputer/Teknologi Informasi,IT-Perangkat Lunak",427140,PT Imani Prima,false,"Uraian Tugas : Mengembangkan solusi software berdasarkan spesifikasi kebutuhan Merawat, memperbaiki, meningkatkan dan membperbaharui software yang ada...",contract,3717842,false,true,Software Engineer,https://www.jobstreet.co.id/id/job/software-engineer-3717842?token=0~b6b6aa89-22ca-4d7b-8b6c-98332d6cf354&sectionRank=418&jobId=jobstreet-id-job-3717842,Jawa Barat,21 hours ago,2021-12-25T20:00:52Z,,,,monthly,,
standard,"507,105","Pendidikan/Pelatihan,Pendidikan",438407,Universitas Bunda Mulia (Yayasan Pendidikan Bunda Mulia ),false,Provide the best learning experience to improve Faculty competitive advantage Be enthusiastic and passionate to carry out research and produce a...,full_time,3717847,false,false,Dosen Prodi Akuntansi (UBM Kampus Ancol),https://www.jobstreet.co.id/id/job/dosen-prodi-akuntansi-ubm-kampus-ancol-3717847?token=0~b6b6aa89-22ca-4d7b-8b6c-98332d6cf354&sectionRank=419&jobId=jobstreet-id-job-3717847,Jakarta Utara,21 hours ago,2021-12-25T20:00:52Z,,,,monthly,,
standard,"503,145","Penjualan / Pemasaran,Penjualan Ritel",451616,CV. Lancar Jaya Food,false,"Kriteria : Lulusan S1 jurusan manajemen/manajemen pemasaran Memiliki kemampuan analisis yang baik, kreatif dan inovatif Memiliki setidaknya 1 tahun...",full_time,3717848,false,false,Sales Marketing Executive,https://www.jobstreet.co.id/id/job/sales-marketing-executive-3717848?token=0~b6b6aa89-22ca-4d7b-8b6c-98332d6cf354&sectionRank=420&jobId=jobstreet-id-job-3717848,Jawa Tengah,21 hours ago,2021-12-25T20:00:52Z,,,,monthly,,
