adType,categoriesCode,categoriesName,companyId,companyName,companyPrivate,description,employment,id,isClassified,isStandout,jobTitle,jobUrl,locations,postingDuration,postedAt,salarycurrency,salaryMin,salaryMax,salaryPeriod,salaryTerm,sellingPoints
standout,"503,151","Penjualan / Pemasaran,Telesales/Telemarketing",435658,PT Organik Sehat Alami,false,Kualifikasi : 1. Umur Maksimal 40 tahun 2. Pendidikan D3 / S1 berbagai jurusan 3. Memiliki Pengalaman minimal 3 tahun sebagai Key Account Supervisor...,full_time,3723391,false,true,Key Account Supervisor,https://www.jobstreet.co.id/id/job/key-account-supervisor-3723391?token=0~d39dce57-d6b8-40eb-acb2-999378e1243b&sectionRank=514&jobId=jobstreet-id-job-3723391,Bandung,22 hours ago,2021-12-25T20:00:45Z,,,,monthly,,
standout,"502,137","Sumber Daya Manusia/Personalia,Sumber Daya Manusia / HR",433894,PT JACCS Mitra Pinasthika Mustika Finance Indonesia,false,"Job Description :  Maintains data in HRIS systems and databases Input and updating database of employee Performs data updates, exports, imports,...",full_time,3723368,false,true,HRIS Specialist,https://www.jobstreet.co.id/id/job/hris-specialist-3723368?token=0~d39dce57-d6b8-40eb-acb2-999378e1243b&sectionRank=515&jobId=jobstreet-id-job-3723368,Jakarta Raya,22 hours ago,2021-12-25T20:00:45Z,,,,monthly,,"Rapidly Growth Company,Opportunities For Enhanced learning,Career Development"
standout,"503,202","Penjualan / Pemasaran,E-commerce",451860,PT Suriatama,false,DESKRIPSI PEKERJAAN Menyusun strategi penjualan produk marketplace untuk rencana jangka pendek dan panjang Evaluasi sales dan promosi di platform...,full_time,3723355,false,true,Manager Retail Marketplace,https://www.jobstreet.co.id/id/job/manager-retail-marketplace-3723355?token=0~d39dce57-d6b8-40eb-acb2-999378e1243b&sectionRank=516&jobId=jobstreet-id-job-3723355,Jakarta Pusat,22 hours ago,2021-12-25T20:00:45Z,,,,monthly,,
standout,"503,203","Penjualan / Pemasaran,Digital Marketing",jobstreet-id-252148,PT Anugerah Papera Jaya,false,Pendidikan Minimal D3 semua jurusan Mampu membuat Laporan Data Mingguan / Bulanan Dapat menggunakan applikasi Video dan Gambar Suka membuat konten...,full_time,3723396,false,true,Digital Marketing,https://www.jobstreet.co.id/id/job/digital-marketing-3723396?token=0~d39dce57-d6b8-40eb-acb2-999378e1243b&sectionRank=517&jobId=jobstreet-id-job-3723396,Jakarta Utara,22 hours ago,2021-12-25T20:00:45Z,,,,monthly,,
standard,"510,197","Manufaktur,Penjaminan Kualitas / QA",451353,Arkademi,false,Arkademi is educational technology startup company mentioned by Tech in Asia as 1 of 50 rising startups in South East Asia and become the next big...,full_time,3723384,false,false,Quality Control,https://www.jobstreet.co.id/id/job/quality-control-3723384?token=0~d39dce57-d6b8-40eb-acb2-999378e1243b&sectionRank=518&jobId=jobstreet-id-job-3723384,Sleman,22 hours ago,2021-12-25T20:00:45Z,,,,monthly,,
standout,"503,203","Penjualan / Pemasaran,Digital Marketing",451425,PT Citra Lestari Sempurna,false,Responsibilities : Responsibility to Marketing Manager. Managing Media Social Team &amp; Understand Monthly Report Planning support Ads Strategy and...,full_time,3723418,false,true,Digital Marketing Supervisor,https://www.jobstreet.co.id/id/job/digital-marketing-supervisor-3723418?token=0~d39dce57-d6b8-40eb-acb2-999378e1243b&sectionRank=519&jobId=jobstreet-id-job-3723418,Jakarta Raya,22 hours ago,2021-12-25T20:00:45Z,,,,monthly,,
standard,"508,191","Komputer/Teknologi Informasi,IT-Perangkat Lunak",439944,PT. Mustika Citra Rasa,false,Bachelor's Degree in Computer Science or related field. Experience and involved in hybrid application. At least 4 years experience in Hybrid...,full_time,3723406,false,false,Hybrid Developer Supervisor,https://www.jobstreet.co.id/id/job/hybrid-developer-supervisor-3723406?token=0~d39dce57-d6b8-40eb-acb2-999378e1243b&sectionRank=520&jobId=jobstreet-id-job-3723406,Jakarta Utara,22 hours ago,2021-12-25T20:00:45Z,IDR,10000000,20000000,monthly,,
standout,"503,145","Penjualan / Pemasaran,Penjualan Ritel",427581,PT Masuya Graha Trikencana (Jakarta),false,Kami salah satu perusahaan yang bergerak di bidang Distribusi Makanan dan Minuman dengan Head Office di daerah Jakarta membutuhkan : SALES...,full_time,3723430,false,true,SALES EXECUTIVE,https://www.jobstreet.co.id/id/job/sales-executive-3723430?token=0~d39dce57-d6b8-40eb-acb2-999378e1243b&sectionRank=521&jobId=jobstreet-id-job-3723430,Jakarta Utara,22 hours ago,2021-12-25T20:00:44Z,,,,monthly,,"MEAL,BPJS,THR"
standard,"504,100","Seni/Media/Komunikasi,Periklanan",437553,PT Syncore Indonesia,false,"Deskripsi Pekerjaan : Berperan sebagai Videographer / Fotographer dalam pembuatan Video Promosi, Pengambilan Konten, dan Pengeditan Melakukan Research...",full_time,3723431,false,false,Videographer,https://www.jobstreet.co.id/id/job/videographer-3723431?token=0~d39dce57-d6b8-40eb-acb2-999378e1243b&sectionRank=522&jobId=jobstreet-id-job-3723431,Yogyakarta,22 hours ago,2021-12-25T20:00:44Z,,,,monthly,,
standard,"503,145","Penjualan / Pemasaran,Penjualan Ritel",432799,PT Golden Brilliant Sanitaryware,false,Tanggung Jawab: Membantu SPV Project untuk melakukan seluruh kegiatan divisi project untuk mencapai target yang diberikan. Meningkatkan penjualan...,full_time,3723419,false,false,Sales Project,https://www.jobstreet.co.id/id/job/sales-project-3723419?token=0~d39dce57-d6b8-40eb-acb2-999378e1243b&sectionRank=523&jobId=jobstreet-id-job-3723419,Bekasi,22 hours ago,2021-12-25T20:00:44Z,IDR,3700000,4810000,monthly,,
standard,"508,191","Komputer/Teknologi Informasi,IT-Perangkat Lunak",394614,PT Global Jet Express,false,"Deskripsi Pekerjaan Membuat kode yang dapat digunakan kembali, efisien, dan dapat dijalankan. Berkolaborasi dengan tim desain &amp; tim produk UX UI....",full_time,3723423,false,false,IOS Developer,https://www.jobstreet.co.id/id/job/ios-developer-3723423?token=0~d39dce57-d6b8-40eb-acb2-999378e1243b&sectionRank=524&jobId=jobstreet-id-job-3723423,Jakarta Utara,22 hours ago,2021-12-25T20:00:44Z,,,,monthly,,
standard,"513,112","Layanan Kesehatan,Farmasi",435837,PT Parit Padang Global,false,"Tentang Perusahaan :Bisnis Distribusi dan Logistik SOHO Global Health, Tbk dijalankan melalui unit bisnisnya yang bernama PT Parit Padang Global...",full_time,3723495,false,false,Apoteker Penanggung Jawab,https://www.jobstreet.co.id/id/job/apoteker-penanggung-jawab-3723495?token=0~d39dce57-d6b8-40eb-acb2-999378e1243b&sectionRank=525&jobId=jobstreet-id-job-3723495,Pontianak,22 hours ago,2021-12-25T20:00:44Z,,,,monthly,,
standout,"503,149","Penjualan / Pemasaran,Merchandising",439374,Margaria Group,false,"Requirement : Minimum Bachelor degree from reputable university, majoring, in fashion Merchandising / Management / Bussiness / Finance / Accounting....",full_time,3723484,false,true,Fashion Merchandise,https://www.jobstreet.co.id/id/job/fashion-merchandise-3723484?token=0~d39dce57-d6b8-40eb-acb2-999378e1243b&sectionRank=526&jobId=jobstreet-id-job-3723484,Yogyakarta,22 hours ago,2021-12-25T20:00:44Z,,,,monthly,,"BPJS TK,BPJS Kesehatan,Tunjangan-Tunjangan"
standout,"505,118","Pelayanan,Perawatan Pribadi",jobstreet-id-328471,Artha Inti Mentari,false,"Translate business goals into efficient digital marketing strategies across SEM, SEO, social media ads, programmatic and performance marketing...",full_time,3723449,false,true,DIGITAL MARKETING MANAGER,https://www.jobstreet.co.id/id/job/digital-marketing-manager-3723449?token=0~d39dce57-d6b8-40eb-acb2-999378e1243b&sectionRank=527&jobId=jobstreet-id-job-3723449,Tangerang,22 hours ago,2021-12-25T20:00:44Z,,,,monthly,,
standard,"504,100","Seni/Media/Komunikasi,Periklanan",432262,Elshe Global Care,false,Memahami perkembangan komunikasi di industri kecantikan Beauty Enthusiast dan pernah handle Beauty Brand Memahami strategi komunikasi pemasaran 360...,full_time,3723440,false,false,Art Director,https://www.jobstreet.co.id/id/job/art-director-3723440?token=0~d39dce57-d6b8-40eb-acb2-999378e1243b&sectionRank=528&jobId=jobstreet-id-job-3723440,"Jakarta Raya,Yogyakarta",22 hours ago,2021-12-25T20:00:44Z,,,,monthly,,
standard,"509,195","Teknik,Mekanikal",414127,PT Mitra Pinasthika Mustika Rent (MPM Rent),false,"Mengelola kegiatan operasional pengurusan, perawatan dan memonitor penggunaan unit untuk memperlancar kegiatan bisnis perusahaan dan peningkatan...",contract,3723472,false,false,Service Representative (Ambon),https://www.jobstreet.co.id/id/job/service-representative-ambon-3723472?token=0~d39dce57-d6b8-40eb-acb2-999378e1243b&sectionRank=529&jobId=jobstreet-id-job-3723472,"Ambon,Makassar,Surabaya",22 hours ago,2021-12-25T20:00:44Z,,,,monthly,,
standout,"501,130","Akuntansi / Keuangan,Audit & Pajak",437134,PT Smart Business Solution,false,Mampu memahami UU perpajakan dan bertanggung jawab untuk menyampaikan laporan pajak serta mengontrol transaksi perusahaan sesuai dengan peraturan...,contract,3723465,false,true,Supervisor Accounting & Pajak,https://www.jobstreet.co.id/id/job/supervisor-accounting-pajak-3723465?token=0~d39dce57-d6b8-40eb-acb2-999378e1243b&sectionRank=530&jobId=jobstreet-id-job-3723465,Surabaya,22 hours ago,2021-12-25T20:00:44Z,,,,monthly,,
standard,"503,143","Penjualan / Pemasaran,Penjualan - Teknik/Teknikal/IT",438880,PT Bernadi Utama,false,"Kualifikasi : Usia, maksimal 35 tahun. Minimal S1 Engineering atau Teknik Elektro. Pengalaman minimal 2 tahun di sales project. Bersedia melakukan...",full_time,3723487,false,false,Sales Project Photovoltaic / Solar Cell,https://www.jobstreet.co.id/id/job/sales-project-photovoltaic-solar-cell-3723487?token=0~d39dce57-d6b8-40eb-acb2-999378e1243b&sectionRank=531&jobId=jobstreet-id-job-3723487,Jakarta Raya,22 hours ago,2021-12-25T20:00:44Z,,,,monthly,,
standard,"508,191","Komputer/Teknologi Informasi,IT-Perangkat Lunak",433821,PT Intersolusi Teknologi Asia,false,"Responsibilities: Design and build applications for mobile platform. Ensure the performance, quality, and responsiveness of applications. Collaborate...",full_time,3723473,false,false,Mobile Developer,https://www.jobstreet.co.id/id/job/mobile-developer-3723473?token=0~d39dce57-d6b8-40eb-acb2-999378e1243b&sectionRank=532&jobId=jobstreet-id-job-3723473,Bandung,22 hours ago,2021-12-25T20:00:44Z,IDR,4000000,7000000,monthly,,
standard,"508,191","Komputer/Teknologi Informasi,IT-Perangkat Lunak",431846,PT Dutapalma Nusantara (Darmex Agro Group),false,"Job Descriptions : Support module FI (Financial) and CO (Controlling) Experience in SAP FICO module (minimum 2 - 5 years) - General Ledger (GL), Debt...",full_time,3723458,false,false,SAP FICO,https://www.jobstreet.co.id/id/job/sap-fico-3723458?token=0~d39dce57-d6b8-40eb-acb2-999378e1243b&sectionRank=533&jobId=jobstreet-id-job-3723458,Jakarta Selatan,22 hours ago,2021-12-25T20:00:44Z,,,,monthly,,
standard,"508,191","Komputer/Teknologi Informasi,IT-Perangkat Lunak",436772,PT SAS Kreasindo Utama,false,Responsibilities Running regular checks on network and data security Identifying and acting on opportunities to improve and update software and...,full_time,3723488,false,false,IT Project Manager,https://www.jobstreet.co.id/id/job/it-project-manager-3723488?token=0~d39dce57-d6b8-40eb-acb2-999378e1243b&sectionRank=534&jobId=jobstreet-id-job-3723488,Tegal,22 hours ago,2021-12-25T20:00:44Z,,,,monthly,,
standout,"508,191","Komputer/Teknologi Informasi,IT-Perangkat Lunak",jobstreet-id-281996,Digital Sekuriti Indonesia,false,Jadilah bagian dari perusahaan kami PT. Digital Sekuriti Indonesia. Jika Anda adalah orang yang ingin terus menerus belajar dan mengembangkan diri...,full_time,3723451,false,true,Mobile React / Flutter Developer,https://www.jobstreet.co.id/id/job/mobile-react-flutter-developer-3723451?token=0~d39dce57-d6b8-40eb-acb2-999378e1243b&sectionRank=535&jobId=jobstreet-id-job-3723451,Sleman,22 hours ago,2021-12-25T20:00:44Z,,,,monthly,,
standout,"502,137","Sumber Daya Manusia/Personalia,Sumber Daya Manusia / HR",436843,Sekolah Ciputra Surabaya,false,"Yayasan Ciputra Pendidikan membuka lowongan untuk posisi ""Manager Program Pengembangan Kesehatan Mental"" untuk sekolah-sekolah di Indonesia, yang...",full_time,3723436,false,true,Manager Program Pengembangan Kesehatan Mental,https://www.jobstreet.co.id/id/job/manager-program-pengembangan-kesehatan-mental-3723436?token=0~d39dce57-d6b8-40eb-acb2-999378e1243b&sectionRank=536&jobId=jobstreet-id-job-3723436,Jakarta Barat,22 hours ago,2021-12-25T20:00:44Z,,,,monthly,,
standard,"513,113","Layanan Kesehatan,Diagnosa/Lainnya",430302,Alodokter,false,ALODOKTER is looking for veterinarian to participate in our community and support our product. Our objective is to provide the right information to...,full_time,3723575,false,false,Veterinarian,https://www.jobstreet.co.id/id/job/veterinarian-3723575?token=0~d39dce57-d6b8-40eb-acb2-999378e1243b&sectionRank=537&jobId=jobstreet-id-job-3723575,Jakarta Selatan,22 hours ago,2021-12-25T20:00:43Z,,,,monthly,,
standout,"503,142","Penjualan / Pemasaran,Penjualan - Korporasi",jobstreet-id-197315,PT. Senjaya Gobel Solusindo,false,SALES PROJECTKualifikasi :•	Pendidikan S1 segala jurusan•	Usia min 23 max 33 tahun•	Berpengalaman sebagai Sales Proyek minimal 3 tahun•	Memiliki...,full_time,3723572,false,true,Sales Project,https://www.jobstreet.co.id/id/job/sales-project-3723572?token=0~d39dce57-d6b8-40eb-acb2-999378e1243b&sectionRank=538&jobId=jobstreet-id-job-3723572,Jakarta Pusat,22 hours ago,2021-12-25T20:00:43Z,,,,monthly,,"Tunjangan, Uang makan, Transport,BPJS kesehatan,BPJS ketenagakerjaan"
standout,"508,191","Komputer/Teknologi Informasi,IT-Perangkat Lunak",432548,PT Forest Indo Niaga,false,Job SummaryWe are looking for an experienced NodeJS Back End developer with sufficient knowledge in building and maintaining high traffic services...,full_time,3723571,false,true,Senior Back-End Developer,https://www.jobstreet.co.id/id/job/senior-back-end-developer-3723571?token=0~d39dce57-d6b8-40eb-acb2-999378e1243b&sectionRank=539&jobId=jobstreet-id-job-3723571,Bandung,22 hours ago,2021-12-25T20:00:43Z,IDR,10000000,20000000,monthly,,"Free Lunch (Work from Office),Medical Insurance,Dental and Vision coverage"
standout,"501,131","Akuntansi / Keuangan,Akuntansi Umum / Pembiayaan",428883,PT VIC Indonesia,false,PT Vista Inspirasi Pendidikan known as (VPRO Corporate Training) is a corporate training provider in Professional English and Management Skills...,full_time,3723549,false,true,Accounts Executive,https://www.jobstreet.co.id/id/job/accounts-executive-3723549?token=0~d39dce57-d6b8-40eb-acb2-999378e1243b&sectionRank=540&jobId=jobstreet-id-job-3723549,Surabaya,22 hours ago,2021-12-25T20:00:43Z,,,,monthly,,Benefit
standout,"503,203","Penjualan / Pemasaran,Digital Marketing",451606,Koding Next,false,"Koding Next, the leading coding and technology school in South-East Asia, is pleased to announce a new job opening - Digital Marketing Manager. You...",full_time,3723559,false,true,Digital Marketing Manager,https://www.jobstreet.co.id/id/job/digital-marketing-manager-3723559?token=0~032eca9a-c9f7-45db-96b8-732f50597211&sectionRank=541&jobId=jobstreet-id-job-3723559,Jakarta Utara,22 hours ago,2021-12-25T20:00:43Z,IDR,8000000,12000000,monthly,,"Attractive salary + performance bonus from converted leads,International working environment & Opportunity to grow,Paid trainings"
standard,"503,142","Penjualan / Pemasaran,Penjualan - Korporasi",430530,PT Arisma Data Setia,false,Merencanakan dan melaksanakan aktifitas penjualan dan melakukan kunjungan ke pelanggan yang berpotensial Mencari customer baru yang dapat bekerjasama...,full_time,3723546,false,false,Sales Engineer,https://www.jobstreet.co.id/id/job/sales-engineer-3723546?token=0~032eca9a-c9f7-45db-96b8-732f50597211&sectionRank=542&jobId=jobstreet-id-job-3723546,Jakarta Barat,22 hours ago,2021-12-25T20:00:43Z,,,,monthly,,
standard,"505,147","Pelayanan,Logistik/Rantai Pasokan",390146,Shopee Internasional Indonesia,false,"Persyaratan: Kandidat setidaknya mempunyai ijazah SMA / SMK, Diploma, atau Gelar Sarjana di bidang apapun Setidaknya memiliki 2-3 tahun pengalaman...",full_time,3723540,false,false,Hub Lead Shopee Express (Way Kanan),https://www.jobstreet.co.id/id/job/hub-lead-shopee-express-way-kanan-3723540?token=0~032eca9a-c9f7-45db-96b8-732f50597211&sectionRank=543&jobId=jobstreet-id-job-3723540,Lampung,22 hours ago,2021-12-25T20:00:43Z,,,,monthly,,
standard,"503,142","Penjualan / Pemasaran,Penjualan - Korporasi",274146,MEDIATEK SOLUSINDO,false,"Job Requirements : Minimum S1 degree in Information Technology, Telecommunication Engineering, Electrical or Electronic Engineering with...",full_time,3723538,false,false,Account Manager Telco,https://www.jobstreet.co.id/id/job/account-manager-telco-3723538?token=0~032eca9a-c9f7-45db-96b8-732f50597211&sectionRank=544&jobId=jobstreet-id-job-3723538,Jakarta Raya,22 hours ago,2021-12-25T20:00:43Z,,,,monthly,,
standout,"503,145","Penjualan / Pemasaran,Penjualan Ritel",jobstreet-id-45845,PT Banoli Motor,false,"Kualifikasi Jujur, disiplin, aktif dan bertanggung jawab. Pendidikan minimal D3 atau sederajat Memiliki pengalaman minimal 1 tahun di bidang sales...",full_time,3723547,false,true,Distributor Salesman (Automotive),https://www.jobstreet.co.id/id/job/distributor-salesman-automotive-3723547?token=0~032eca9a-c9f7-45db-96b8-732f50597211&sectionRank=545&jobId=jobstreet-id-job-3723547,Bali,22 hours ago,2021-12-25T20:00:43Z,,,,monthly,,"Monthly Incentive,BPJS Kesehatan dan Ketenagakerjaan,Uang makan dan biaya perjalanan"
standout,"511,150","Bangunan/Konstruksi,Properti/Real Estate",431823,Damai Putra Group,false,"Maximum 30 years old Have Bachelor or Master Degree in Architecture, Civil Engineering, Town Planning, Real Estate, Business and Economics Minimum IPK...",full_time,3723555,false,true,Senior Property Analyst,https://www.jobstreet.co.id/id/job/senior-property-analyst-3723555?token=0~032eca9a-c9f7-45db-96b8-732f50597211&sectionRank=546&jobId=jobstreet-id-job-3723555,Bekasi,22 hours ago,2021-12-25T20:00:43Z,,,,monthly,,
standard,"508,193","Komputer/Teknologi Informasi,IT-Admin Jaringan/Sistem/Database",,,true,Melakukan pembangunan dan pengembangan data serta melakukan pemeliharaan terhadap data yang digunakan sebagai sumber data. Memonitoring dan memastikan...,full_time,3723545,false,false,IT MIS & Data Engineer,https://www.jobstreet.co.id/id/job/it-mis-data-engineer-3723545?token=0~032eca9a-c9f7-45db-96b8-732f50597211&sectionRank=547&jobId=jobstreet-id-job-3723545,Tangerang,22 hours ago,2021-12-25T20:00:43Z,,,,monthly,,
standard,"508,191","Komputer/Teknologi Informasi,IT-Perangkat Lunak",432296,PT Enseval Putera Megatrading Tbk,false,Requirements: Bachelor's' degree in Computer science or equivalent degree. Maximum 28 years old Minimum 1 year experience in same position Outstanding...,full_time,3723561,false,false,IOS Developer,https://www.jobstreet.co.id/id/job/ios-developer-3723561?token=0~032eca9a-c9f7-45db-96b8-732f50597211&sectionRank=548&jobId=jobstreet-id-job-3723561,Jakarta Timur,22 hours ago,2021-12-25T20:00:43Z,,,,monthly,,
standard,"503,143","Penjualan / Pemasaran,Penjualan - Teknik/Teknikal/IT",274146,MEDIATEK SOLUSINDO,false,Job Qualification: Bachelor's Degree in any field Min. 1 year succesful sales track record experience in services and system solution in Enterprise...,full_time,3723523,false,false,Account Manager Enterprise,https://www.jobstreet.co.id/id/job/account-manager-enterprise-3723523?token=0~032eca9a-c9f7-45db-96b8-732f50597211&sectionRank=549&jobId=jobstreet-id-job-3723523,Jakarta Raya,22 hours ago,2021-12-25T20:00:43Z,,,,monthly,,
standout,"503,151","Penjualan / Pemasaran,Telesales/Telemarketing",jobstreet-id-64648,PT. Mutiara Gemilang Indonesia,false,KUALIFIKASI : Berpengalaman minimal 1 tahun menjadi Sales/Marketing di bidang Food &amp; Beverages (Disukai mempunyai relasi dengan Perusahaan...,full_time,3723505,false,true,Sales Marketing Semarang,https://www.jobstreet.co.id/id/job/sales-marketing-semarang-3723505?token=0~032eca9a-c9f7-45db-96b8-732f50597211&sectionRank=550&jobId=jobstreet-id-job-3723505,Semarang,22 hours ago,2021-12-25T20:00:43Z,,,,monthly,,Komisi
standout,"508,191","Komputer/Teknologi Informasi,IT-Perangkat Lunak",434212,PT Kazee Digital Indonesia,false,"Deskripsi Pekerjaan: Mengintegrasikan, mengelola, dan optimasi database Bekerja dengan framework back end (Laravel, Nodejs, Flask dll) Menggunakan...",full_time,3723520,false,true,Backend Developer,https://www.jobstreet.co.id/id/job/backend-developer-3723520?token=0~032eca9a-c9f7-45db-96b8-732f50597211&sectionRank=551&jobId=jobstreet-id-job-3723520,Bandung,22 hours ago,2021-12-25T20:00:43Z,IDR,4500000,8000000,monthly,,
standard,"504,100","Seni/Media/Komunikasi,Periklanan",274146,MEDIATEK SOLUSINDO,false,Job Qualification : Minimum education S1 1+ year experience and proven sales record in advertising agency/media would be an advantage Desire to...,full_time,3723508,false,false,Account Manager Digital Advertising,https://www.jobstreet.co.id/id/job/account-manager-digital-advertising-3723508?token=0~032eca9a-c9f7-45db-96b8-732f50597211&sectionRank=552&jobId=jobstreet-id-job-3723508,Jakarta Raya,22 hours ago,2021-12-25T20:00:43Z,,,,monthly,,
standard,"503,139","Penjualan / Pemasaran,Pemasaran/Pengembangan Bisnis",434534,PT Laris Manis Utama,false,Tugas &amp; Tanggung Jawab : Melakukan dan Meningkatkan penjualan sesuai target yang telah di tentukan. Memonitor dan mengontrol aktifitas penjualan...,full_time,3723519,false,false,Marketing (Ambon),https://www.jobstreet.co.id/id/job/marketing-ambon-3723519?token=0~032eca9a-c9f7-45db-96b8-732f50597211&sectionRank=553&jobId=jobstreet-id-job-3723519,"Ambon,Makassar",22 hours ago,2021-12-25T20:00:43Z,,,,monthly,,
standout,"509,187","Teknik,Teknik Elektro",jobstreet-id-327856,Planet Hollywood Cell,false,Kualifikasi-       Kandidat dengan pendidikan SLTA / setara jurusan Tekhnik menjadi nilai tambah-       Memiliki Pengalaman di bidang perbaikan...,full_time,3723527,false,true,Teknisi Handphone Apple,https://www.jobstreet.co.id/id/job/teknisi-handphone-apple-3723527?token=0~032eca9a-c9f7-45db-96b8-732f50597211&sectionRank=554&jobId=jobstreet-id-job-3723527,Jakarta Pusat,22 hours ago,2021-12-25T20:00:43Z,IDR,3500000,5000000,monthly,,"Bonus,Jenjang Karir"
standout,"502,137","Sumber Daya Manusia/Personalia,Sumber Daya Manusia / HR",451617,PT Latrade Batam Indonesia,false,"A new established foreign investment manufacturing Company producing Bedding Products, seeking for qualified candidates with good interpersonal skill...",full_time,3723517,false,true,HR MANAGER – FLUENT IN MANDARIN (BOTH ORAL AND WRITTEN),https://www.jobstreet.co.id/id/job/hr-manager-fluent-in-mandarin-both-oral-and-written-3723517?token=0~032eca9a-c9f7-45db-96b8-732f50597211&sectionRank=555&jobId=jobstreet-id-job-3723517,Batam,22 hours ago,2021-12-25T20:00:43Z,IDR,15000000,18000000,monthly,,Career development and opportunities
standout,"503,203","Penjualan / Pemasaran,Digital Marketing",451872,PT Tiga Berlian Mandiri,false,Kualifikasi : D-III/S-1 Semua Jurusan Minimal memiliki pengalaman kerja selama 3 tahun di bidang yang sama  Usia maksimal 35 tahun Mengerti tentang...,full_time,3723584,false,true,Digital Marketing,https://www.jobstreet.co.id/id/job/digital-marketing-3723584?token=0~032eca9a-c9f7-45db-96b8-732f50597211&sectionRank=556&jobId=jobstreet-id-job-3723584,Surabaya,22 hours ago,2021-12-25T20:00:42Z,,,,monthly,,
standout,"511,180","Bangunan/Konstruksi,Arsitek/Desain Interior",jobstreet-id-322229,PT. Matahari Mandiri Sejati,false,PT. Matahari Mandiri Sejati (Better Home) merupakan Supermarket Bahan Bangunan terbesar dan pertama di Bengkulu dengan konsep Modern Outlet.Keuntungan...,full_time,3723602,false,true,ARSITEK,https://www.jobstreet.co.id/id/job/arsitek-3723602?token=0~032eca9a-c9f7-45db-96b8-732f50597211&sectionRank=557&jobId=jobstreet-id-job-3723602,Bengkulu,22 hours ago,2021-12-25T20:00:42Z,,,,monthly,,
standard,"503,145","Penjualan / Pemasaran,Penjualan Ritel",439899,PT Multi Mayaka,false,Uraian Tugas: Mencari dealer baru Melakukan analisa pasar Menjual produk Menjaga kestabilan omset Melakukan perencanaan produk Menyusun strategi...,full_time,3723626,false,false,Sales Pekanbaru,https://www.jobstreet.co.id/id/job/sales-pekanbaru-3723626?token=0~032eca9a-c9f7-45db-96b8-732f50597211&sectionRank=558&jobId=jobstreet-id-job-3723626,Pekanbaru,22 hours ago,2021-12-25T20:00:42Z,IDR,2200000,3080000,monthly,,
standard,"503,144","Penjualan / Pemasaran,Penjualan - Jasa Keuangan",451484,PT. FWD Insurance Indonesia,false,This position is incumbent to: Providing the best financial solution for our customer through our product and investment protection Helping customers...,full_time,3723631,false,false,Insurance Consultant (Pematang Siantar),https://www.jobstreet.co.id/id/job/insurance-consultant-pematang-siantar-3723631?token=0~032eca9a-c9f7-45db-96b8-732f50597211&sectionRank=559&jobId=jobstreet-id-job-3723631,Pematangsiantar,22 hours ago,2021-12-25T20:00:42Z,,,,monthly,,
standout,"503,145","Penjualan / Pemasaran,Penjualan Ritel",438343,PT Wuerth Indonesia,false,Persyaratan: Usia maksimal 35 Tahun. Pendidikan D3/S1 sederajat segala jurusan. Memiliki kendaraan bermotor dan SIM C/A. Pengalaman kerja di dunia...,full_time,3723636,false,true,SALES REPRESENTATIVE - RANTAUPRAPAT,https://www.jobstreet.co.id/id/job/sales-representative-rantauprapat-3723636?token=0~032eca9a-c9f7-45db-96b8-732f50597211&sectionRank=560&jobId=jobstreet-id-job-3723636,Asahan Kisaran,22 hours ago,2021-12-25T20:00:42Z,,,,monthly,,
