adType,categoriesCode,categoriesName,companyId,companyName,companyPrivate,description,employment,id,isClassified,isStandout,jobTitle,jobUrl,locations,postingDuration,postedAt,salarycurrency,salaryMin,salaryMax,salaryPeriod,salaryTerm,sellingPoints
standout,"510,194","Manufaktur,Manufaktur",jobstreet-id-278602,UD Cipta Mandiri Perkasa,false,"Kami pabrik plastik injection di surabayaMencari seorang manajer produksi yg mempunyai pengalaman dalam bidang produksi, mempunyai skill manajerial...",full_time,3732551,false,true,Manager produksi,https://www.jobstreet.co.id/id/job/manager-produksi-3732551?token=0~9cb8847e-db53-4d5f-9965-1ea79d295328&sectionRank=1&jobId=jobstreet-id-job-3732551,Surabaya,36 minutes ago,2021-12-25T17:23:46Z,IDR,4000000,6600000,monthly,,
standout,"503,145","Penjualan / Pemasaran,Penjualan Ritel",jobstreet-id-299824,The Dimsum Company,false,Syarat : Usia Maksimal 35 tahun Pengalaman Sales minimal 1 tahun (diutamakan produk F&amp;B) dengan Surat Pengalaman Kerja Memiliki pengalaman bidang...,full_time,3732480,false,true,Sales Canvas F&B,https://www.jobstreet.co.id/id/job/sales-canvas-f-b-3732480?token=0~9cb8847e-db53-4d5f-9965-1ea79d295328&sectionRank=2&jobId=jobstreet-id-job-3732480,Jakarta Utara,an hour ago,2021-12-25T17:00:00Z,IDR,3500000,4500000,monthly,,"Potensi utk Expansi,Bonus"
standard,"503,145","Penjualan / Pemasaran,Penjualan Ritel",jobstreet-id-220942,PT New Inti Furnindo (Jakarta),false,Kualifikasi: Usia maksimal 35 tahun Memiliki SIM C atau SIM A Pendidikan akhir SLTA / SMU / sederajat Memiliki pengalaman minimal 2 tahun di bidang...,full_time,3731671,false,false,Sales (Furniture),https://www.jobstreet.co.id/id/job/sales-furniture-3731671?token=0~9cb8847e-db53-4d5f-9965-1ea79d295328&sectionRank=3&jobId=jobstreet-id-job-3731671,Jakarta Barat,an hour ago,2021-12-25T17:00:00Z,,,,monthly,,
standout,"503,139","Penjualan / Pemasaran,Pemasaran/Pengembangan Bisnis",451350,PT Archontas,false,Job DescriptionBerani menjadi seorang Marketing Executive dengan Take Home Pay 5X Salary?Jadilah Marketing Executive [ME] di Alpha Omega Properti...,full_time,3732288,false,true,Marketing Executive,https://www.jobstreet.co.id/id/job/marketing-executive-3732288?token=0~9cb8847e-db53-4d5f-9965-1ea79d295328&sectionRank=4&jobId=jobstreet-id-job-3732288,Batu,an hour ago,2021-12-25T17:00:00Z,,,,monthly,,
standard,"503,145","Penjualan / Pemasaran,Penjualan Ritel",jobstreet-id-320174,Double Espresso,false,We are multimedia production company with a domestic &amp; international market focus.The workplace is a media studio &amp; offices in Kuta. Our team...,full_time,3732442,false,false,Sales Executive,https://www.jobstreet.co.id/id/job/sales-executive-3732442?token=0~9cb8847e-db53-4d5f-9965-1ea79d295328&sectionRank=5&jobId=jobstreet-id-job-3732442,Badung,an hour ago,2021-12-25T17:00:00Z,,,,monthly,,
standard,"509,189","Teknik,Teknik Lingkungan",429461,PT Relindo Mitra Sukses,false,Kualifikasi: Usia maksimal 35 tahun Pendidikan minimal S1 semua Disiplin Ilmu Pengalaman minimal 2 tahun sebagai HSE Officer di perusahaan kimia atau...,full_time,3732550,false,false,HSE Officer,https://www.jobstreet.co.id/id/job/hse-officer-3732550?token=0~9cb8847e-db53-4d5f-9965-1ea79d295328&sectionRank=6&jobId=jobstreet-id-job-3732550,Cikupa,an hour ago,2021-12-25T16:52:10Z,IDR,5000000,7000000,monthly,,
standard,"504,101","Seni/Media/Komunikasi,Seni / Desain Kreatif",380780,PT Daikin Airconditioning Indonesia,false,Job Qualification : Bachelor’s degree in Visual Communication Design or equivalent Minimum has 5 years experience Creative and good in English...,full_time,3732549,false,false,Graphic Designer,https://www.jobstreet.co.id/id/job/graphic-designer-3732549?token=0~9cb8847e-db53-4d5f-9965-1ea79d295328&sectionRank=7&jobId=jobstreet-id-job-3732549,Jakarta Pusat,an hour ago,2021-12-25T16:19:02Z,,,,monthly,,
standard,"509,195","Teknik,Mekanikal",380780,PT Daikin Airconditioning Indonesia,false,"Kualfikasi Jabatan: Pendidikan Minimal SMK Mampu mengoperasikan software arsitektur seperti Autocad, (Menguasai Revit menjadi nilai tambah) Mengerti...",full_time,3732548,false,false,Drafter,https://www.jobstreet.co.id/id/job/drafter-3732548?token=0~9cb8847e-db53-4d5f-9965-1ea79d295328&sectionRank=8&jobId=jobstreet-id-job-3732548,Jakarta Pusat,an hour ago,2021-12-25T16:14:51Z,,,,monthly,,
standard,"502,133","Sumber Daya Manusia/Personalia,Staf / Administrasi umum",380780,PT Daikin Airconditioning Indonesia,false,Job Qualification: Bachelor Degree From Any Major Have good communication skill Excellent personality with good attitude and integrity Can work...,full_time,3732547,false,false,Sales Assistant,https://www.jobstreet.co.id/id/job/sales-assistant-3732547?token=0~9cb8847e-db53-4d5f-9965-1ea79d295328&sectionRank=9&jobId=jobstreet-id-job-3732547,Jakarta Raya,an hour ago,2021-12-25T16:13:58Z,,,,monthly,,
standard,"503,145","Penjualan / Pemasaran,Penjualan Ritel",380780,PT Daikin Airconditioning Indonesia,false,Detail Position : Pro ShopJob Qualification: Bachelor Degree From Any Major Good communication &amp; negotiation skills are needed and have a target...,full_time,3732546,false,false,Sales,https://www.jobstreet.co.id/id/job/sales-3732546?token=0~9cb8847e-db53-4d5f-9965-1ea79d295328&sectionRank=10&jobId=jobstreet-id-job-3732546,"Yogyakarta,Bandung",2 hours ago,2021-12-25T15:59:06Z,,,,monthly,,
auto_inclusion,"505,138","Pelayanan,Pengacara / Asisten Legal",jobstreet-id-12684,DEUTSCHE GESELLSCHAFT FUR INTERNATIONALE ZUSAMMENARBEIT,false,"Job descriptionWe are looking for an advisor in the context of two projects in the ASEAN region: The regional project ""Reduce, Reuse, Recycle to...",,1030026456,false,false,Advisor (m/f/d) Solid Waste Management and Circular Economy,https://www.jobstreet.co.id/id/job/advisor-m-f-d-solid-waste-management-and-circular-economy-1030026456?token=0~9cb8847e-db53-4d5f-9965-1ea79d295328&sectionRank=11&jobId=jobstreet-id-job-1030026456,Jakarta Raya,2 hours ago,2021-12-25T15:57:23Z,,,,monthly,,
auto_inclusion,"502,133","Sumber Daya Manusia/Personalia,Staf / Administrasi umum",436915,PT Sentra Usahatama Jaya,false,"Requirements: Candidate must possess at least a Diploma, Bachelor's Degree, Economics, Logistic/Transportation, Business...",,1030026434,false,false,Sugar Trade Administration Staff,https://www.jobstreet.co.id/id/job/sugar-trade-administration-staff-1030026434?token=0~9cb8847e-db53-4d5f-9965-1ea79d295328&sectionRank=12&jobId=jobstreet-id-job-1030026434,Jakarta Pusat,2 hours ago,2021-12-25T15:57:01Z,,,,monthly,,
auto_inclusion,"503,139","Penjualan / Pemasaran,Pemasaran/Pengembangan Bisnis",jobstreet-id-241669,Tassta GMBH,false,JOB DESCRIPTIONWe are looking for an SEO/SEM to manage all search engine optimization and marketing activities.*Note: The candidate will be base in...,,1030000960,false,false,SEO/SEM,https://www.jobstreet.co.id/id/job/seo-sem-1030000960?token=0~9cb8847e-db53-4d5f-9965-1ea79d295328&sectionRank=13&jobId=jobstreet-id-job-1030000960,Banten,2 hours ago,2021-12-25T15:57:00Z,,,,monthly,,
auto_inclusion,"502,137","Sumber Daya Manusia/Personalia,Sumber Daya Manusia / HR",jobstreet-id-44720,PT Livit International Indonesia,false,"About Livit:Over the past 10 years, Livit has enabled and supported 1000+ entrepreneurs, startups, remote workers and companies in building disruptive...",,1030026454,false,false,Talent Management Coordinator - Fully Remote,https://www.jobstreet.co.id/id/job/talent-management-coordinator-fully-remote-1030026454?token=0~9cb8847e-db53-4d5f-9965-1ea79d295328&sectionRank=14&jobId=jobstreet-id-job-1030026454,Denpasar,2 hours ago,2021-12-25T15:56:57Z,,,,monthly,,
auto_inclusion,"507,105","Pendidikan/Pelatihan,Pendidikan",jobstreet-id-44720,PT Livit International Indonesia,false,"About RSA:Remote Skills Academy is an impact-focused education program for those who want to learn to work online, build successful careers and...",,1030026450,false,false,Expansion Manager - Remote Skills Academy (RSA) International,https://www.jobstreet.co.id/id/job/expansion-manager-remote-skills-academy-rsa-international-1030026450?token=0~9cb8847e-db53-4d5f-9965-1ea79d295328&sectionRank=15&jobId=jobstreet-id-job-1030026450,Denpasar,2 hours ago,2021-12-25T15:53:58Z,,,,monthly,,
auto_inclusion,"512,102","Sains,Pertanian",346108,CBI-electric,false,"Provide an overall interface across all Projects in terms of manpower, materials, skills/ grades spread.Provide guidance and support to existing local...",,1029962162,false,false,Senior E&I Superintendent,https://www.jobstreet.co.id/id/job/senior-e-i-superintendent-1029962162?token=0~9cb8847e-db53-4d5f-9965-1ea79d295328&sectionRank=16&jobId=jobstreet-id-job-1029962162,"Batam,Riau",2 hours ago,2021-12-25T15:52:57Z,,,,monthly,,
auto_inclusion,"508,191","Komputer/Teknologi Informasi,IT-Perangkat Lunak",508601,Xendit,false,"Xendit provides payment infrastructure across Southeast Asia, with a focus on Indonesia and the Philippines. We process payments, power marketplaces,...",,1029962182,false,false,Senior Software Engineer - Store Channels,https://www.jobstreet.co.id/id/job/senior-software-engineer-store-channels-1029962182?token=0~9cb8847e-db53-4d5f-9965-1ea79d295328&sectionRank=17&jobId=jobstreet-id-job-1029962182,Jakarta Raya,2 hours ago,2021-12-25T15:52:50Z,,,,monthly,,
auto_inclusion,"502,133","Sumber Daya Manusia/Personalia,Staf / Administrasi umum",346108,CBI-electric,false,Job Overview:Hiring for collect and input data Scaffolding Request FormKey Responsibility/Accountability: Collect and organize scaffolding Request...,,1029962124,false,false,Administrative Assistant,https://www.jobstreet.co.id/id/job/administrative-assistant-1029962124?token=0~9cb8847e-db53-4d5f-9965-1ea79d295328&sectionRank=18&jobId=jobstreet-id-job-1029962124,"Batam,Riau",2 hours ago,2021-12-25T15:52:50Z,,,,monthly,,
auto_inclusion,"502,137","Sumber Daya Manusia/Personalia,Sumber Daya Manusia / HR",1040,Phillip Morris Latinoamérica,false,MAKE HISTORY WITH US! We’ve chosen to do something incredible. We’re totally transforming our business and building our future on smoke-free products...,,1029962129,false,false,Talent Acquisition Executive - Employer Branding,https://www.jobstreet.co.id/id/job/talent-acquisition-executive-employer-branding-1029962129?token=0~9cb8847e-db53-4d5f-9965-1ea79d295328&sectionRank=19&jobId=jobstreet-id-job-1029962129,Indonesia,2 hours ago,2021-12-25T15:51:59Z,,,,monthly,,
auto_inclusion,"510,194","Manufaktur,Manufaktur",2795,Nestlé,false,"Position SnapshotLocation: Batang, Central JavaPermanent EmploymentPosition SummaryJoining Nestlé means you are joining the largest food and Beverage...",,1029962147,false,false,"First Line Manager, Bandaraya Factory",https://www.jobstreet.co.id/id/job/first-line-manager-bandaraya-factory-1029962147?token=0~9cb8847e-db53-4d5f-9965-1ea79d295328&sectionRank=20&jobId=jobstreet-id-job-1029962147,Jawa Tengah,2 hours ago,2021-12-25T15:51:52Z,,,,monthly,,
auto_inclusion,"508,193","Komputer/Teknologi Informasi,IT-Admin Jaringan/Sistem/Database",22479,F5 Networks,false,Come work at a place where innovation and teamwork come together to support the most exciting missions in the world!F5 technologies are at the heart...,,1029962136,false,false,"Manager, Solutions Engineering - Indonesia",https://www.jobstreet.co.id/id/job/manager-solutions-engineering-indonesia-1029962136?token=0~9cb8847e-db53-4d5f-9965-1ea79d295328&sectionRank=21&jobId=jobstreet-id-job-1029962136,Jakarta Raya,2 hours ago,2021-12-25T15:51:31Z,,,,monthly,,
auto_inclusion,"508,191","Komputer/Teknologi Informasi,IT-Perangkat Lunak",17756,The World Bank,false,"Organization:The World BankCountry:IndonesiaCity:JakartaOffice:World Bank Jakarta, IndonesiaE T Consultant- Digital DevelopmentJob #:...",,1029962127,false,false,"Extended Term Consultant- Digital Development, Jakarta, Indonesia",https://www.jobstreet.co.id/id/job/extended-term-consultant-digital-development-jakarta-indonesia-1029962127?token=0~9cb8847e-db53-4d5f-9965-1ea79d295328&sectionRank=22&jobId=jobstreet-id-job-1029962127,Jakarta Raya,2 hours ago,2021-12-25T15:51:01Z,,,,monthly,,
auto_inclusion,"508,193","Komputer/Teknologi Informasi,IT-Admin Jaringan/Sistem/Database",jobstreet-id-1000034212,Exis,false,Industry: IT ServicesWork Experience: 1-3 yearsSalary: USD 300/MonthCity: pandaanState/Province: East javaZip/Postal Code: 67156Job Description•...,,1029962166,false,false,Full time,https://www.jobstreet.co.id/id/job/full-time-1029962166?token=0~9cb8847e-db53-4d5f-9965-1ea79d295328&sectionRank=23&jobId=jobstreet-id-job-1029962166,Pasuruan,2 hours ago,2021-12-25T15:50:57Z,,,,monthly,,
auto_inclusion,"508,191","Komputer/Teknologi Informasi,IT-Perangkat Lunak",508285,Kantar Added Value,false,"We go beyond the obvious, using intelligence, passion and creativity to inspire new thinking and shape the world we live in.To start a career that is...",,1029942903,false,false,DP Executive,https://www.jobstreet.co.id/id/job/dp-executive-1029942903?token=0~9cb8847e-db53-4d5f-9965-1ea79d295328&sectionRank=24&jobId=jobstreet-id-job-1029942903,Jakarta Raya,2 hours ago,2021-12-25T15:50:57Z,,,,monthly,,
auto_inclusion,"510,140","Manufaktur,Pembelian/Manajemen Material",5291,KONE,false,"At KONE, we’re people on the move.Just like our escalators, elevators and doors, every day our people move in different directions. We employ over...",,1029962155,false,false,Sourcing Specialist,https://www.jobstreet.co.id/id/job/sourcing-specialist-1029962155?token=0~9cb8847e-db53-4d5f-9965-1ea79d295328&sectionRank=25&jobId=jobstreet-id-job-1029962155,Jakarta Raya,2 hours ago,2021-12-25T15:50:43Z,,,,monthly,,
auto_inclusion,"501,131","Akuntansi / Keuangan,Akuntansi Umum / Pembiayaan",820,Citigroup Inc.,false,"A. New DMT Development1. Understanding of business, data requirement, prioritization2.New Code Development using SAS (190+ DMTs reports)3.Delivering...",,1029962137,false,false,Compl Bus Control Intmd Anlyst - Data Analytics,https://www.jobstreet.co.id/id/job/compl-bus-control-intmd-anlyst-data-analytics-1029962137?token=0~9cb8847e-db53-4d5f-9965-1ea79d295328&sectionRank=26&jobId=jobstreet-id-job-1029962137,Jakarta Raya,2 hours ago,2021-12-25T15:50:40Z,,,,monthly,,
auto_inclusion,"502,137","Sumber Daya Manusia/Personalia,Sumber Daya Manusia / HR",391629,TMF Group,false,Job no: 545303Work type: InternLocation: Indonesia - JakartaCategories: Client PayrollOffice Location: JakartaAdvertised: 15 Dec 2021 SE Asia Standard...,,1029942913,false,false,Intern - HR & Payroll Services,https://www.jobstreet.co.id/id/job/intern-hr-payroll-services-1029942913?token=0~9cb8847e-db53-4d5f-9965-1ea79d295328&sectionRank=27&jobId=jobstreet-id-job-1029942913,Jakarta Raya,2 hours ago,2021-12-25T15:50:32Z,,,,monthly,,
standout,"503,139","Penjualan / Pemasaran,Pemasaran/Pengembangan Bisnis",jobstreet-id-253795,babies glow aesthetic CLINIC,false,Product Development untuk 4 produk yang akan dibuat baru di tahun 2022. Dan rebranding produk 10 SKU Babies Glow. Pengalaman min 1 tahun di bidang...,full_time,3732545,false,true,Product Development,https://www.jobstreet.co.id/id/job/product-development-3732545?token=0~9cb8847e-db53-4d5f-9965-1ea79d295328&sectionRank=28&jobId=jobstreet-id-job-3732545,Bantul,2 hours ago,2021-12-25T15:50:22Z,IDR,2500000,3500000,monthly,,
auto_inclusion,"502,137","Sumber Daya Manusia/Personalia,Sumber Daya Manusia / HR",508601,Xendit,false,"Xendit provides payment infrastructure across Southeast Asia, with a focus on Indonesia and the Philippines. We process payments, power marketplaces,...",,1029942946,false,false,Head of People,https://www.jobstreet.co.id/id/job/head-of-people-1029942946?token=0~9cb8847e-db53-4d5f-9965-1ea79d295328&sectionRank=29&jobId=jobstreet-id-job-1029942946,Jakarta Raya,2 hours ago,2021-12-25T15:49:50Z,,,,monthly,,
auto_inclusion,"503,151","Penjualan / Pemasaran,Telesales/Telemarketing",427464,Kitabisa.com,false,"Kitabisa.com is Indonesia's most popular fundraising and donation platform for social causes. Since 2013 we've facilitated more than 14.000 campaigns,...",contract,1029956165,false,false,Admin Campaign Optimization,https://www.jobstreet.co.id/id/job/admin-campaign-optimization-1029956165?token=0~9cb8847e-db53-4d5f-9965-1ea79d295328&sectionRank=30&jobId=jobstreet-id-job-1029956165,Jakarta Raya,2 hours ago,2021-12-25T15:49:21Z,,,,monthly,,
auto_inclusion,"505,147","Pelayanan,Logistik/Rantai Pasokan",820,Citigroup Inc.,false,How does your role/department impact the larger organization?My department is responsible for governance of the Managers Control Assessment process...,,1029768133,false,false,Compliance AML Risk Management (Manager),https://www.jobstreet.co.id/id/job/compliance-aml-risk-management-manager-1029768133?token=0~51b5f5c5-88d8-4ee8-8155-ec696ecc9dbc&sectionRank=31&jobId=jobstreet-id-job-1029768133,Jakarta Raya,2 hours ago,2021-12-25T15:49:21Z,,,,monthly,,
auto_inclusion,"508,191","Komputer/Teknologi Informasi,IT-Perangkat Lunak",508285,Kantar Added Value,false,"We go beyond the obvious, using intelligence, passion and creativity to inspire new thinking and shape the world we live in.To start a career that is...",,1029942912,false,false,Senior DP Executive,https://www.jobstreet.co.id/id/job/senior-dp-executive-1029942912?token=0~51b5f5c5-88d8-4ee8-8155-ec696ecc9dbc&sectionRank=32&jobId=jobstreet-id-job-1029942912,Jakarta Raya,2 hours ago,2021-12-25T15:49:17Z,,,,monthly,,
auto_inclusion,"508,191","Komputer/Teknologi Informasi,IT-Perangkat Lunak",508601,Xendit,false,"Xendit provides payment infrastructure across Southeast Asia, with a focus on Indonesia and the Philippines. We process payments, power marketplaces,...",,1029768049,false,false,Government Relations Senior Analyst,https://www.jobstreet.co.id/id/job/government-relations-senior-analyst-1029768049?token=0~51b5f5c5-88d8-4ee8-8155-ec696ecc9dbc&sectionRank=33&jobId=jobstreet-id-job-1029768049,Jakarta Raya,2 hours ago,2021-12-25T15:49:13Z,,,,monthly,,
auto_inclusion,"502,146","Sumber Daya Manusia/Personalia,Sekretaris",379851,British Embassy Jakarta,false,Main purpose of job:Support BE Jakarta during Indonesia’s G20 Presidency on G20 VIP visit planning.They will facilitate coordination and compilation...,contract,1029942865,false,false,JKT - G20 Visits Support Officer B3(L),https://www.jobstreet.co.id/id/job/jkt-g20-visits-support-officer-b3-l-1029942865?token=0~51b5f5c5-88d8-4ee8-8155-ec696ecc9dbc&sectionRank=34&jobId=jobstreet-id-job-1029942865,Jakarta Raya,2 hours ago,2021-12-25T15:49:05Z,,,,monthly,,
auto_inclusion,"506,107","Hotel/Restoran,Makanan/Minuman/Pelayanan Restoran",630,Grand Hyatt Jakarta,false,Return to SearchGrand HyattGrand Hyatt JakartaJW - JakartaBars/Restaurants/OutletsEntry Level ManagerFull-timeReq ID: JAK000406LocalShare Outlet...,,1029768069,false,false,Outlet Manager,https://www.jobstreet.co.id/id/job/outlet-manager-1029768069?token=0~51b5f5c5-88d8-4ee8-8155-ec696ecc9dbc&sectionRank=35&jobId=jobstreet-id-job-1029768069,Jakarta Raya,2 hours ago,2021-12-25T15:49:05Z,,,,monthly,,
auto_inclusion,"501,131","Akuntansi / Keuangan,Akuntansi Umum / Pembiayaan",427464,Kitabisa.com,false,Responsibilities:1. Supporting accounting team for checking and maintaining donation transactions in bank2. Coordinate with teams across the...,internship,1029975590,false,false,Accounting Intern,https://www.jobstreet.co.id/id/job/accounting-intern-1029975590?token=0~51b5f5c5-88d8-4ee8-8155-ec696ecc9dbc&sectionRank=36&jobId=jobstreet-id-job-1029975590,Jakarta Raya,2 hours ago,2021-12-25T15:48:52Z,,,,monthly,,
auto_inclusion,"501,131","Akuntansi / Keuangan,Akuntansi Umum / Pembiayaan",508601,Xendit,false,"Xendit provides payment infrastructure across Southeast Asia, with a focus on Indonesia and the Philippines. We process payments, power marketplaces,...",,1029942928,false,false,Chief Financial Officer,https://www.jobstreet.co.id/id/job/chief-financial-officer-1029942928?token=0~51b5f5c5-88d8-4ee8-8155-ec696ecc9dbc&sectionRank=37&jobId=jobstreet-id-job-1029942928,Jakarta Raya,2 hours ago,2021-12-25T15:48:37Z,,,,monthly,,
auto_inclusion,"503,139","Penjualan / Pemasaran,Pemasaran/Pengembangan Bisnis",509439,Fortive,false,"This position is located in Jakarta, Indonesia.Primary Responsibilities: Providing support to internal stakeholders and the wider team to deliver...",full_time,1029987745,false,false,Senior Marketing Executive (Indonesia),https://www.jobstreet.co.id/id/job/senior-marketing-executive-indonesia-1029987745?token=0~51b5f5c5-88d8-4ee8-8155-ec696ecc9dbc&sectionRank=38&jobId=jobstreet-id-job-1029987745,Jawa Tengah,2 hours ago,2021-12-25T15:48:28Z,,,,monthly,,
auto_inclusion,"511,184","Bangunan/Konstruksi,Teknik Sipil/Konstruksi Bangunan",346108,CBI-electric,false,Job Overview: Over-all responsibility is project execution hands on Electrical - Commissioning test procedures activities.Key Tasks and...,,1029875422,false,false,Associate Hookup & Commission Tech,https://www.jobstreet.co.id/id/job/associate-hookup-commission-tech-1029875422?token=0~51b5f5c5-88d8-4ee8-8155-ec696ecc9dbc&sectionRank=39&jobId=jobstreet-id-job-1029875422,"Batam,Riau",2 hours ago,2021-12-25T15:48:28Z,,,,monthly,,
auto_inclusion,"501,135","Akuntansi / Keuangan,Perbankan / Jasa Finansial ",820,Citigroup Inc.,false,"The Risk Collection Analyst is an intermediate-level position responsible for conducting credit reviews on collection strategy, segmentation, and...",,1029942931,false,false,Risk Collection Analyst,https://www.jobstreet.co.id/id/job/risk-collection-analyst-1029942931?token=0~51b5f5c5-88d8-4ee8-8155-ec696ecc9dbc&sectionRank=40&jobId=jobstreet-id-job-1029942931,Jakarta Raya,2 hours ago,2021-12-25T15:48:24Z,,,,monthly,,
auto_inclusion,"508,191","Komputer/Teknologi Informasi,IT-Perangkat Lunak",jobstreet-id-1000008649,PT Oracle Electronical Indonesia,false,"Applicants are required to read, write, and speak the following languages: English Job SummaryOracle is at the forefront of the digital revolution. We...",,1029942916,false,false,Cloud Engineering – Strategy Accelerator Lead,https://www.jobstreet.co.id/id/job/cloud-engineering-strategy-accelerator-lead-1029942916?token=0~51b5f5c5-88d8-4ee8-8155-ec696ecc9dbc&sectionRank=41&jobId=jobstreet-id-job-1029942916,Jakarta Raya,2 hours ago,2021-12-25T15:48:24Z,,,,monthly,,
auto_inclusion,"508,193","Komputer/Teknologi Informasi,IT-Admin Jaringan/Sistem/Database",jobstreet-id-1000008649,PT Oracle Electronical Indonesia,false,"Applicants are required to read, write, and speak the following languages: English In this role, you will be guiding prospective clients and customers...",,1029768098,false,false,Senior Technology Solution & Cloud Architect,https://www.jobstreet.co.id/id/job/senior-technology-solution-cloud-architect-1029768098?token=0~51b5f5c5-88d8-4ee8-8155-ec696ecc9dbc&sectionRank=42&jobId=jobstreet-id-job-1029768098,Indonesia,2 hours ago,2021-12-25T15:48:20Z,,,,monthly,,
auto_inclusion,"505,138","Pelayanan,Pengacara / Asisten Legal",402526,Dutch Lady Milk Industries,false,"To ensure company has fulfill all it license, and comply to legal requirement to conduct it business activities Bachelor of Law degree, Master of Law...",full_time,1029875470,false,false,Legal Manager,https://www.jobstreet.co.id/id/job/legal-manager-1029875470?token=0~51b5f5c5-88d8-4ee8-8155-ec696ecc9dbc&sectionRank=43&jobId=jobstreet-id-job-1029875470,Jakarta Timur,2 hours ago,2021-12-25T15:47:58Z,,,,monthly,,
auto_inclusion,"508,191","Komputer/Teknologi Informasi,IT-Perangkat Lunak",508285,Kantar Added Value,false,"We go beyond the obvious, using intelligence, passion and creativity to inspire new thinking and shape the world we live in.To start a career that is...",,1029768060,false,false,Senior Research Executive,https://www.jobstreet.co.id/id/job/senior-research-executive-1029768060?token=0~51b5f5c5-88d8-4ee8-8155-ec696ecc9dbc&sectionRank=44&jobId=jobstreet-id-job-1029768060,Jakarta Raya,2 hours ago,2021-12-25T15:47:58Z,,,,monthly,,
auto_inclusion,"506,107","Hotel/Restoran,Makanan/Minuman/Pelayanan Restoran",630,Grand Hyatt Jakarta,false,Return to SearchGrand HyattGrand Hyatt JakartaJW - JakartaBars/Restaurants/OutletsEntry Level ManagerFull-timeReq ID: JAK000407LocalShare F&amp;B Team...,,1029768134,false,false,F&B Team Leader - Outlet (Bar),https://www.jobstreet.co.id/id/job/f-b-team-leader-outlet-bar-1029768134?token=0~51b5f5c5-88d8-4ee8-8155-ec696ecc9dbc&sectionRank=45&jobId=jobstreet-id-job-1029768134,Jakarta Raya,2 hours ago,2021-12-25T15:47:52Z,,,,monthly,,
auto_inclusion,"508,191","Komputer/Teknologi Informasi,IT-Perangkat Lunak",1040,Phillip Morris Latinoamérica,false,MAKE HISTORY WITH US! We’ve chosen to do something incredible. We’re totally transforming our business and building our future on smoke-free products...,,1029768125,false,false,Solution Architect IT Finance (FI CO) S/4HANA,https://www.jobstreet.co.id/id/job/solution-architect-it-finance-fi-co-s-4hana-1029768125?token=0~51b5f5c5-88d8-4ee8-8155-ec696ecc9dbc&sectionRank=46&jobId=jobstreet-id-job-1029768125,Indonesia,2 hours ago,2021-12-25T15:47:48Z,,,,monthly,,
auto_inclusion,"503,139","Penjualan / Pemasaran,Pemasaran/Pengembangan Bisnis",445764,Involve Asia,false,"Job Descriptions Build and manage a large pipeline of publisher leads Pitch InvolveAsia platform, make proposals and negotiate contracts Close new...",,1029875466,false,false,"Executive, Partner Development (ID)",https://www.jobstreet.co.id/id/job/executive-partner-development-id-1029875466?token=0~51b5f5c5-88d8-4ee8-8155-ec696ecc9dbc&sectionRank=47&jobId=jobstreet-id-job-1029875466,Jakarta Raya,2 hours ago,2021-12-25T15:47:48Z,,,,monthly,,
