adType,categoriesCode,categoriesName,companyId,companyName,companyPrivate,description,employment,id,isClassified,isStandout,jobTitle,jobUrl,locations,postingDuration,postedAt,salarycurrency,salaryMin,salaryMax,salaryPeriod,salaryTerm,sellingPoints
auto_inclusion,"505,138","Pelayanan,Pengacara / Asisten Legal",519561,Jakarta Consulting,false,"Maximum 35 years old Bachelor degree from reputable university, preferably from Law Min. 10 years’ experience Had been working at reputable Law Firm...",,1029797368,false,false,LEGAL SECTION HEAD,https://www.jobstreet.co.id/id/job/legal-section-head-1029797368?token=0~9a83cac4-c742-4710-aaa2-0622920c35df&sectionRank=139&jobId=jobstreet-id-job-1029797368,Jakarta Raya,an hour ago,2021-12-20T15:39:08Z,,,,monthly,,
auto_inclusion,"504,101","Seni/Media/Komunikasi,Seni / Desain Kreatif",427288,PT Jakarta Land Management,false,"Tanggung Jawab Create visual aspect of marketing material, website, and other media Brainstorm design system to create a more efficient workflow...",,1029966195,false,false,Creative Designer,https://www.jobstreet.co.id/id/job/creative-designer-1029966195?token=0~9a83cac4-c742-4710-aaa2-0622920c35df&sectionRank=140&jobId=jobstreet-id-job-1029966195,Jakarta Barat,an hour ago,2021-12-20T15:38:59Z,,,,monthly,,
auto_inclusion,"504,101","Seni/Media/Komunikasi,Seni / Desain Kreatif",jobstreet-id-1000030480,PT Dua Belas Dua Belas,false,"Role and Responsibilities:– Proficient: Must have rock-solid experience and understanding on how to build, maintain, and enhance client relationship.–...",,1029803429,false,false,Whiteboard Journal: Senior Marketing and Partnership Associate,https://www.jobstreet.co.id/id/job/whiteboard-journal%3A-senior-marketing-and-partnership-associate-1029803429?token=0~9a83cac4-c742-4710-aaa2-0622920c35df&sectionRank=141&jobId=jobstreet-id-job-1029803429,Jakarta Raya,an hour ago,2021-12-20T15:38:44Z,,,,monthly,,
auto_inclusion,"503,139","Penjualan / Pemasaran,Pemasaran/Pengembangan Bisnis",238055,Ematic Solutions,false,"WHO WE AREReady for your next career move in Marketing Technology? Believe in working smart, and want to have fun doing it? Ematic Solutions might...",,1029860709,false,false,Management Trainee,https://www.jobstreet.co.id/id/job/management-trainee-1029860709?token=0~9a83cac4-c742-4710-aaa2-0622920c35df&sectionRank=142&jobId=jobstreet-id-job-1029860709,Jakarta Raya,an hour ago,2021-12-20T15:38:42Z,,,,monthly,,
auto_inclusion,"511,184","Bangunan/Konstruksi,Teknik Sipil/Konstruksi Bangunan",346108,CBI-electric,false,Job Overview:Required for Marjan Project Key Responsibility/Accountability: Review / perform the following surveys: - Lead Post-weld surveys as...,,1029803393,false,false,Dimension Control Tech Supervisor,https://www.jobstreet.co.id/id/job/dimension-control-tech-supervisor-1029803393?token=0~9a83cac4-c742-4710-aaa2-0622920c35df&sectionRank=143&jobId=jobstreet-id-job-1029803393,"Batam,Riau",an hour ago,2021-12-20T15:38:32Z,,,,monthly,,
auto_inclusion,"502,146","Sumber Daya Manusia/Personalia,Sekretaris",jobstreet-id-1000033754,ERIA,false,"Responsibilities Devising and maintaining office systems, including data and contact management and filing Supporting event organization including...",,1029860699,false,false,"Assistant, Research Activities",https://www.jobstreet.co.id/id/job/assistant-research-activities-1029860699?token=0~9a83cac4-c742-4710-aaa2-0622920c35df&sectionRank=144&jobId=jobstreet-id-job-1029860699,Jakarta Raya,an hour ago,2021-12-20T15:38:27Z,,,,monthly,,
auto_inclusion,"508,191","Komputer/Teknologi Informasi,IT-Perangkat Lunak",jobstreet-id-1000000913,PT Cisco Systems Indonesia,false,You will work on leading-edge technology with a keen focus on enabling Cisco's global customers to achieve successful business outcomes. You will...,,1029803365,false,false,Senior Technical Consulting Engineer,https://www.jobstreet.co.id/id/job/senior-technical-consulting-engineer-1029803365?token=0~9a83cac4-c742-4710-aaa2-0622920c35df&sectionRank=145&jobId=jobstreet-id-job-1029803365,Jakarta Raya,an hour ago,2021-12-20T15:38:26Z,,,,monthly,,
auto_inclusion,"503,139","Penjualan / Pemasaran,Pemasaran/Pengembangan Bisnis",jobstreet-id-76301,PT Lalamove Logistik Indonesia,false,"Job Descriptions Market research: Area potential business cluster mapping, potential SMEs, competitor activity, market researched or surveyed both...",,1029860794,false,false,Business Development Associate - Surabaya,https://www.jobstreet.co.id/id/job/business-development-associate-surabaya-1029860794?token=0~9a83cac4-c742-4710-aaa2-0622920c35df&sectionRank=146&jobId=jobstreet-id-job-1029860794,Surabaya,an hour ago,2021-12-20T15:37:57Z,,,,monthly,,
auto_inclusion,"503,142","Penjualan / Pemasaran,Penjualan - Korporasi",jobstreet-id-1000008649,PT Oracle Electronical Indonesia,false,"Applicants are required to read, write, and speak the following languages: English Sells Technology solutions (Data and Middleware solution) via...",,1029860803,false,false,Technology Sales Representative IV,https://www.jobstreet.co.id/id/job/technology-sales-representative-iv-1029860803?token=0~9a83cac4-c742-4710-aaa2-0622920c35df&sectionRank=147&jobId=jobstreet-id-job-1029860803,Jakarta Raya,an hour ago,2021-12-20T15:37:40Z,,,,monthly,,
auto_inclusion,"508,193","Komputer/Teknologi Informasi,IT-Admin Jaringan/Sistem/Database",jobstreet-id-1000028508,APP Indonesia Headquarter,false,"Nama Perusahaan:APP Indonesia HeadquarterLokasi:Serpong - WIK, IndonesiaFungsi Pekerjaan:AuditingStatus Pekerjaan:PermanentTanggal...",,1029803383,false,false,Expert IIPS,https://www.jobstreet.co.id/id/job/expert-iips-1029803383?token=0~9a83cac4-c742-4710-aaa2-0622920c35df&sectionRank=148&jobId=jobstreet-id-job-1029803383,Tangerang,an hour ago,2021-12-20T15:37:40Z,,,,monthly,,
auto_inclusion,"503,143","Penjualan / Pemasaran,Penjualan - Teknik/Teknikal/IT",22479,F5 Networks,false,Come work at a place where innovation and teamwork come together to support the most exciting missions in the world!F5 technologies are at the heart...,,1029803332,false,false,Solutions Engineer - Banking and Financial Services,https://www.jobstreet.co.id/id/job/solutions-engineer-banking-and-financial-services-1029803332?token=0~9a83cac4-c742-4710-aaa2-0622920c35df&sectionRank=149&jobId=jobstreet-id-job-1029803332,Jakarta Raya,an hour ago,2021-12-20T15:37:37Z,,,,monthly,,
auto_inclusion,"501,131","Akuntansi / Keuangan,Akuntansi Umum / Pembiayaan",238055,Ematic Solutions,false,"WHO WE ARE As a Digital Marketing Solutions provider across SEA, we are built to steadily innovate and deliver Digital Solutions through our...",,1029911525,false,false,Junior Operations Manager,https://www.jobstreet.co.id/id/job/junior-operations-manager-1029911525?token=0~9a83cac4-c742-4710-aaa2-0622920c35df&sectionRank=150&jobId=jobstreet-id-job-1029911525,Jakarta Raya,an hour ago,2021-12-20T15:37:28Z,,,,monthly,,
auto_inclusion,"508,191","Komputer/Teknologi Informasi,IT-Perangkat Lunak",jobstreet-id-1000013182,Kitameraki Limited,false,Kitameraki LimitedKitameraki is a  Technology &amp; Operations consulting firm for companies across Southeast Asia.We are Passionate Consultants &amp;...,,1029860758,false,false,Full Stack Engineer (1 years exp.),https://www.jobstreet.co.id/id/job/full-stack-engineer-1-years-exp-1029860758?token=0~7e6f8e20-b4c6-4d88-955a-49fe2d88967a&sectionRank=151&jobId=jobstreet-id-job-1029860758,Jakarta Selatan,an hour ago,2021-12-20T15:37:27Z,,,,monthly,,
auto_inclusion,"508,191","Komputer/Teknologi Informasi,IT-Perangkat Lunak",508601,Xendit,false,"Xendit provides payment infrastructure across Southeast Asia, with a focus on Indonesia and the Philippines. We process payments, power marketplaces,...",,1029860723,false,false,Software Engineer - Billing,https://www.jobstreet.co.id/id/job/software-engineer-billing-1029860723?token=0~7e6f8e20-b4c6-4d88-955a-49fe2d88967a&sectionRank=152&jobId=jobstreet-id-job-1029860723,Jakarta Raya,an hour ago,2021-12-20T15:37:23Z,,,,monthly,,
auto_inclusion,"508,193","Komputer/Teknologi Informasi,IT-Admin Jaringan/Sistem/Database",519465,8x8 Inc,false,"Jakarta, Indonesia /Engineering – Engineering (CPaaS) /Full-TimeAs an industry leader and Software-as-a-Service provider our mission at 8x8, Inc....",,1029860734,false,false,DevOps Engineer - Jakarta,https://www.jobstreet.co.id/id/job/devops-engineer-jakarta-1029860734?token=0~7e6f8e20-b4c6-4d88-955a-49fe2d88967a&sectionRank=153&jobId=jobstreet-id-job-1029860734,Jakarta Raya,an hour ago,2021-12-20T15:37:23Z,,,,monthly,,
auto_inclusion,"508,191","Komputer/Teknologi Informasi,IT-Perangkat Lunak",jobstreet-id-1000013182,Kitameraki Limited,false,Kitameraki LimitedKitameraki is a  Technology &amp; Operations consulting firm for companies across Southeast Asia.We are Passionate Consultants &amp;...,,1029860767,false,false,Senior Back End Developer (3 years exp.),https://www.jobstreet.co.id/id/job/senior-back-end-developer-3-years-exp-1029860767?token=0~7e6f8e20-b4c6-4d88-955a-49fe2d88967a&sectionRank=154&jobId=jobstreet-id-job-1029860767,Jakarta Selatan,an hour ago,2021-12-20T15:37:23Z,,,,monthly,,
auto_inclusion,"510,194","Manufaktur,Manufaktur",1040,Phillip Morris Latinoamérica,false,MAKE HISTORY WITH US! We’ve chosen to do something incredible. We’re totally transforming our business and building our future on smoke-free products...,,1029783302,false,false,Manufacturing Quality Technician,https://www.jobstreet.co.id/id/job/manufacturing-quality-technician-1029783302?token=0~7e6f8e20-b4c6-4d88-955a-49fe2d88967a&sectionRank=155&jobId=jobstreet-id-job-1029783302,Indonesia,an hour ago,2021-12-20T15:37:22Z,,,,monthly,,
auto_inclusion,"503,145","Penjualan / Pemasaran,Penjualan Ritel",1040,Phillip Morris Latinoamérica,false,MAKE HISTORY WITH US! We’ve chosen to do something incredible. We’re totally transforming our business and building our future on smoke-free products...,,1029956190,false,false,Supervisor Retail Engagement (Central Java),https://www.jobstreet.co.id/id/job/supervisor-retail-engagement-central-java-1029956190?token=0~7e6f8e20-b4c6-4d88-955a-49fe2d88967a&sectionRank=156&jobId=jobstreet-id-job-1029956190,Indonesia,an hour ago,2021-12-20T15:37:21Z,,,,monthly,,
auto_inclusion,"508,191","Komputer/Teknologi Informasi,IT-Perangkat Lunak",436449,PT Repex Wahana,false,"Company: FedEx Express APACJob Title: Clearance RepJob Requisition Number: RC449122Locations:Jakarta, IndonesiaJob Category: OperationsTime Type: Full...",full_time,1029860795,false,false,Clearance Rep,https://www.jobstreet.co.id/id/job/clearance-rep-1029860795?token=0~7e6f8e20-b4c6-4d88-955a-49fe2d88967a&sectionRank=157&jobId=jobstreet-id-job-1029860795,Jakarta Raya,an hour ago,2021-12-20T15:37:21Z,,,,monthly,,
auto_inclusion,"505,147","Pelayanan,Logistik/Rantai Pasokan",346108,CBI-electric,false,Job Overview: Shipment coordination Shipping Documentation Record Keeping  Key Responsibility/Accountability: Shipment arrangement and follow-up...,,1029860784,false,false,Senior Purchasing Administrator,https://www.jobstreet.co.id/id/job/senior-purchasing-administrator-1029860784?token=0~7e6f8e20-b4c6-4d88-955a-49fe2d88967a&sectionRank=158&jobId=jobstreet-id-job-1029860784,"Batam,Riau",an hour ago,2021-12-20T15:37:20Z,,,,monthly,,
auto_inclusion,"508,191","Komputer/Teknologi Informasi,IT-Perangkat Lunak",396930,Quipper,false,Appeal of the workAppeal of the work Become a distributor of Wisdom Be involved and contribute to the future of Global Education! Be part of the team...,,1029783213,false,false,Senior Software Engineer – iOS,https://www.jobstreet.co.id/id/job/senior-software-engineer-ios-1029783213?token=0~7e6f8e20-b4c6-4d88-955a-49fe2d88967a&sectionRank=159&jobId=jobstreet-id-job-1029783213,Jakarta Raya,an hour ago,2021-12-20T15:37:20Z,,,,monthly,,
auto_inclusion,"508,191","Komputer/Teknologi Informasi,IT-Perangkat Lunak",396930,Quipper,false,Appeal of the work Become a distributor of Wisdom Be involved and contribute to the future of Global Education! Be part of the team that wants to...,,1029783216,false,false,Software Engineer – iOS,https://www.jobstreet.co.id/id/job/software-engineer-ios-1029783216?token=0~7e6f8e20-b4c6-4d88-955a-49fe2d88967a&sectionRank=160&jobId=jobstreet-id-job-1029783216,Jakarta Raya,an hour ago,2021-12-20T15:37:17Z,,,,monthly,,
auto_inclusion,"503,139","Penjualan / Pemasaran,Pemasaran/Pengembangan Bisnis",23513,International Data Corporation IDC,false,"OverviewIDC is the premier global provider of market intelligence, advisory services, and events for the information technology, telecommunications,...",,1029783232,false,false,External Title Associate Research Director,https://www.jobstreet.co.id/id/job/external-title-associate-research-director-1029783232?token=0~7e6f8e20-b4c6-4d88-955a-49fe2d88967a&sectionRank=161&jobId=jobstreet-id-job-1029783232,Jakarta Raya,an hour ago,2021-12-20T15:36:17Z,,,,monthly,,
auto_inclusion,"504,101","Seni/Media/Komunikasi,Seni / Desain Kreatif",289980,Prudential Corporation Asia,false,"At Prudential, we understand that success comes from the talent and commitment of our people. Together, we have a shared vision in securing the future...",,1029956228,false,false,Apprenticeship - Digital Marketing,https://www.jobstreet.co.id/id/job/apprenticeship-digital-marketing-1029956228?token=0~7e6f8e20-b4c6-4d88-955a-49fe2d88967a&sectionRank=162&jobId=jobstreet-id-job-1029956228,Jakarta Raya,an hour ago,2021-12-20T15:36:15Z,,,,monthly,,
auto_inclusion,"508,191","Komputer/Teknologi Informasi,IT-Perangkat Lunak",368,Experian,false,Company DescriptionAbout ExperianExperian is the world’s leading global information services company. During life’s big moments — from buying a home...,,1029875434,false,false,Technical Solutions Consultant,https://www.jobstreet.co.id/id/job/technical-solutions-consultant-1029875434?token=0~7e6f8e20-b4c6-4d88-955a-49fe2d88967a&sectionRank=163&jobId=jobstreet-id-job-1029875434,Jakarta Pusat,an hour ago,2021-12-20T15:36:15Z,,,,monthly,,
auto_inclusion,"508,191","Komputer/Teknologi Informasi,IT-Perangkat Lunak",jobstreet-id-1000004508,The World Bank Jakarta,false,"Required Language(s):English, Bahasa IndonesiaDescriptionDo you want to build a career that is truly worthwhile? Working at the World Bank Group...",,1029956179,false,false,E T Consultant- Digital Development,https://www.jobstreet.co.id/id/job/e-t-consultant-digital-development-1029956179?token=0~7e6f8e20-b4c6-4d88-955a-49fe2d88967a&sectionRank=164&jobId=jobstreet-id-job-1029956179,Jakarta Raya,an hour ago,2021-12-20T15:36:12Z,,,,monthly,,
auto_inclusion,"508,191","Komputer/Teknologi Informasi,IT-Perangkat Lunak",jobstreet-id-1000008649,PT Oracle Electronical Indonesia,false,"Applicants are required to read, write, and speak the following languages: English Justification: the resources in ID are being looked at a central...",,1029860727,false,false,Consultant,https://www.jobstreet.co.id/id/job/consultant-1029860727?token=0~7e6f8e20-b4c6-4d88-955a-49fe2d88967a&sectionRank=165&jobId=jobstreet-id-job-1029860727,Jakarta Raya,an hour ago,2021-12-20T15:35:45Z,,,,monthly,,
auto_inclusion,"506,114","Hotel/Restoran,Hotel/Pariwisata",373114,Alila Solo,false,Return to SearchAlilaAlila SoloCentral Java - SurakartaAdministrativeDepartment Head/ManagerFull-timeReq ID: SUR000101Share Learning &amp; Development...,,1029783309,false,false,Learning & Development Manager,https://www.jobstreet.co.id/id/job/learning-development-manager-1029783309?token=0~7e6f8e20-b4c6-4d88-955a-49fe2d88967a&sectionRank=166&jobId=jobstreet-id-job-1029783309,Jawa Tengah,an hour ago,2021-12-20T15:35:41Z,,,,monthly,,
auto_inclusion,"510,197","Manufaktur,Penjaminan Kualitas / QA",1040,Phillip Morris Latinoamérica,false,Are you a team player and ready to make a meaningful impact? Do you have the thirst of knowledge? Do you look for ways in your role and build an...,,1029783233,false,false,Lab Analyst,https://www.jobstreet.co.id/id/job/lab-analyst-1029783233?token=0~7e6f8e20-b4c6-4d88-955a-49fe2d88967a&sectionRank=167&jobId=jobstreet-id-job-1029783233,Indonesia,an hour ago,2021-12-20T15:35:33Z,,,,monthly,,
auto_inclusion,"508,193","Komputer/Teknologi Informasi,IT-Admin Jaringan/Sistem/Database",390146,PT Shopee International Indonesia,false,"The Regional Product Management team at Shopee is the key focal point between the business, engineering and design teams. The team is responsible for...",,1029956178,false,false,Product Management - Product Support,https://www.jobstreet.co.id/id/job/product-management-product-support-1029956178?token=0~7e6f8e20-b4c6-4d88-955a-49fe2d88967a&sectionRank=168&jobId=jobstreet-id-job-1029956178,Jakarta Raya,an hour ago,2021-12-20T15:35:33Z,,,,monthly,,
auto_inclusion,"502,137","Sumber Daya Manusia/Personalia,Sumber Daya Manusia / HR",289980,Prudential Corporation Asia,false,"At Prudential, we understand that success comes from the talent and commitment of our people. Together, we have a shared vision in securing the future...",,1029956232,false,false,SM - Talent Acquisition,https://www.jobstreet.co.id/id/job/sm-talent-acquisition-1029956232?token=0~7e6f8e20-b4c6-4d88-955a-49fe2d88967a&sectionRank=169&jobId=jobstreet-id-job-1029956232,Jakarta Raya,an hour ago,2021-12-20T15:35:10Z,,,,monthly,,
auto_inclusion,"510,194","Manufaktur,Manufaktur",1040,Phillip Morris Latinoamérica,false,MAKE HISTORY WITH US! We’ve chosen to do something incredible. We’re totally transforming our business and building our future on smoke-free products...,,1029783290,false,false,Line Coordinator,https://www.jobstreet.co.id/id/job/line-coordinator-1029783290?token=0~7e6f8e20-b4c6-4d88-955a-49fe2d88967a&sectionRank=170&jobId=jobstreet-id-job-1029783290,Indonesia,an hour ago,2021-12-20T15:35:10Z,,,,monthly,,
auto_inclusion,"503,139","Penjualan / Pemasaran,Pemasaran/Pengembangan Bisnis",289980,Prudential Corporation Asia,false,"At Prudential, we understand that success comes from the talent and commitment of our people. Together, we have a shared vision in securing the future...",,1029956166,false,false,SE - Agency Development Specialist,https://www.jobstreet.co.id/id/job/se-agency-development-specialist-1029956166?token=0~7e6f8e20-b4c6-4d88-955a-49fe2d88967a&sectionRank=171&jobId=jobstreet-id-job-1029956166,Jakarta Raya,an hour ago,2021-12-20T15:34:49Z,,,,monthly,,
auto_inclusion,"508,191","Komputer/Teknologi Informasi,IT-Perangkat Lunak",1848,The Boston Consulting Group,false,"16-Dec-2021Workflow Associate15075BRBusiness Management &amp; OperationsWHAT YOU'LL DOAs a Workflow Associate, you will coordinate DRS research...",,1029956242,false,false,Workflow Associate,https://www.jobstreet.co.id/id/job/workflow-associate-1029956242?token=0~7e6f8e20-b4c6-4d88-955a-49fe2d88967a&sectionRank=172&jobId=jobstreet-id-job-1029956242,Jakarta Raya,an hour ago,2021-12-20T15:34:42Z,,,,monthly,,
auto_inclusion,"505,134","Pelayanan,Layanan Pelanggan",508601,Xendit,false,"Xendit provides payment infrastructure across Southeast Asia, with a focus on Indonesia and the Philippines. We process payments, power marketplaces,...",,1029735016,false,false,Executive Operations for Experiments,https://www.jobstreet.co.id/id/job/executive-operations-for-experiments-1029735016?token=0~7e6f8e20-b4c6-4d88-955a-49fe2d88967a&sectionRank=173&jobId=jobstreet-id-job-1029735016,Jakarta Raya,an hour ago,2021-12-20T15:34:41Z,,,,monthly,,
auto_inclusion,"509,186","Teknik,Teknik Elektronika",519434,34P33R Climate Control ASIA,false,Job Description - Customer resident engineer (21000DRC) Highlight the main responsibilities  MISSION Enhance awareness of customer expectations by:...,full_time,1029956238,false,false,Customer resident engineer,https://www.jobstreet.co.id/id/job/customer-resident-engineer-1029956238?token=0~7e6f8e20-b4c6-4d88-955a-49fe2d88967a&sectionRank=174&jobId=jobstreet-id-job-1029956238,Purwakarta,an hour ago,2021-12-20T15:34:41Z,,,,monthly,,
auto_inclusion,"504,100","Seni/Media/Komunikasi,Periklanan",jobstreet-id-1000030480,PT Dua Belas Dua Belas,false,Requirements:– Have a minimum of 1-year experience in editorial writing or fresh graduate in Mass Communications– Excellent interpersonal skills and...,,1029735006,false,false,Whiteboard Journal: Content Writer,https://www.jobstreet.co.id/id/job/whiteboard-journal%3A-content-writer-1029735006?token=0~7e6f8e20-b4c6-4d88-955a-49fe2d88967a&sectionRank=175&jobId=jobstreet-id-job-1029735006,Jakarta Raya,an hour ago,2021-12-20T15:34:16Z,,,,monthly,,
auto_inclusion,"503,139","Penjualan / Pemasaran,Pemasaran/Pengembangan Bisnis",jobstreet-id-1000028754,Insider Indonesia,false,"Insider is a B2B SaaS company with a unique approach to multichannel experience orchestration. Recently, Insider announced its $32 Million Series C...",,1029735018,false,false,Marketing Manager - Indonesia,https://www.jobstreet.co.id/id/job/marketing-manager-indonesia-1029735018?token=0~7e6f8e20-b4c6-4d88-955a-49fe2d88967a&sectionRank=176&jobId=jobstreet-id-job-1029735018,Jakarta Raya,an hour ago,2021-12-20T15:34:15Z,,,,monthly,,
auto_inclusion,"503,139","Penjualan / Pemasaran,Pemasaran/Pengembangan Bisnis",jobstreet-id-1000028754,Insider Indonesia,false,"Insider is a B2B SaaS company with a unique approach to multichannel experience orchestration. Recently, Insider announced its $32 Million Series C...",,1029735022,false,false,Sales Manager - Indonesia,https://www.jobstreet.co.id/id/job/sales-manager-indonesia-1029735022?token=0~7e6f8e20-b4c6-4d88-955a-49fe2d88967a&sectionRank=177&jobId=jobstreet-id-job-1029735022,Jakarta Raya,an hour ago,2021-12-20T15:34:14Z,,,,monthly,,
auto_inclusion,"504,100","Seni/Media/Komunikasi,Periklanan",jobstreet-id-1000030480,PT Dua Belas Dua Belas,false,Role and Responsibilities:– Scheduling and publishing content– Responding to comments and queries– Gathering and reporting performance data &amp;...,,1029735020,false,false,Studio 1212: Digital Community Manager,https://www.jobstreet.co.id/id/job/studio-1212%3A-digital-community-manager-1029735020?token=0~7e6f8e20-b4c6-4d88-955a-49fe2d88967a&sectionRank=178&jobId=jobstreet-id-job-1029735020,Jakarta Raya,an hour ago,2021-12-20T15:34:14Z,,,,monthly,,
auto_inclusion,"503,145","Penjualan / Pemasaran,Penjualan Ritel",396930,Quipper,false,"Responsibilities: Managing organizational sales by developing a business plan that covers sales, revenue, and expense controls. Achieve growth and hit...",,1029735019,false,false,B2C Sales Manager for Quipper Video,https://www.jobstreet.co.id/id/job/b2c-sales-manager-for-quipper-video-1029735019?token=0~7e6f8e20-b4c6-4d88-955a-49fe2d88967a&sectionRank=179&jobId=jobstreet-id-job-1029735019,Jakarta Raya,an hour ago,2021-12-20T15:34:14Z,,,,monthly,,
auto_inclusion,"504,100","Seni/Media/Komunikasi,Periklanan",jobstreet-id-1000030480,PT Dua Belas Dua Belas,false,Role and Responsibilities:– Developing &amp; produce content for multiple clients– Develop copywriting– Create content reports &amp; analysis–...,,1029735027,false,false,Studio 1212: Social Media Specialists,https://www.jobstreet.co.id/id/job/studio-1212%3A-social-media-specialists-1029735027?token=0~7e6f8e20-b4c6-4d88-955a-49fe2d88967a&sectionRank=180&jobId=jobstreet-id-job-1029735027,Jakarta Raya,an hour ago,2021-12-20T15:34:13Z,,,,monthly,,
auto_inclusion,"509,187","Teknik,Teknik Elektro",5291,KONE,false,What will be your main function and you will collaboration with:A Field Engineer is the first point of contact in technical queries and provides...,,1029732186,false,false,Field Engineer,https://www.jobstreet.co.id/id/job/field-engineer-1029732186?token=0~7b9f6f6c-4649-4984-8bf6-a4eb4b99e0e3&sectionRank=181&jobId=jobstreet-id-job-1029732186,Jakarta Raya,an hour ago,2021-12-20T15:34:13Z,,,,monthly,,
auto_inclusion,"508,191","Komputer/Teknologi Informasi,IT-Perangkat Lunak",390146,PT Shopee International Indonesia,false,The Engineering and Technology team is at the core of the Shopee platform development. The team is made up of a group of passionate engineers from all...,,1029884976,false,false,Engineering and Technology - Front End Web Engineer,https://www.jobstreet.co.id/id/job/engineering-and-technology-front-end-web-engineer-1029884976?token=0~7b9f6f6c-4649-4984-8bf6-a4eb4b99e0e3&sectionRank=182&jobId=jobstreet-id-job-1029884976,Jakarta Raya,an hour ago,2021-12-20T15:34:03Z,,,,monthly,,
auto_inclusion,"503,139","Penjualan / Pemasaran,Pemasaran/Pengembangan Bisnis",jobstreet-id-1000028754,Insider Indonesia,false,"Insider is a B2B SaaS company with a unique approach to multichannel experience orchestration. Recently, Insider announced its $32 Million Series C...",,1029735025,false,false,Partnership Manager - Indonesia,https://www.jobstreet.co.id/id/job/partnership-manager-indonesia-1029735025?token=0~7b9f6f6c-4649-4984-8bf6-a4eb4b99e0e3&sectionRank=183&jobId=jobstreet-id-job-1029735025,Jakarta Raya,an hour ago,2021-12-20T15:34:02Z,,,,monthly,,
auto_inclusion,"503,142","Penjualan / Pemasaran,Penjualan - Korporasi",379037,Appier,false,About the roleThe Sales Expert is responsible for selling and up-selling to new and existing clients and providing excellent service in support of...,,1029735015,false,false,"Sales Expert, Digital Marketing Solution",https://www.jobstreet.co.id/id/job/sales-expert-digital-marketing-solution-1029735015?token=0~7b9f6f6c-4649-4984-8bf6-a4eb4b99e0e3&sectionRank=184&jobId=jobstreet-id-job-1029735015,Jakarta Raya,an hour ago,2021-12-20T15:34:00Z,,,,monthly,,
