adType,categoriesCode,categoriesName,companyId,companyName,companyPrivate,description,employment,id,isClassified,isStandout,jobTitle,jobUrl,locations,postingDuration,postedAt,salarycurrency,salaryMin,salaryMax,salaryPeriod,salaryTerm,sellingPoints
standard,"513,113","Layanan Kesehatan,Diagnosa/Lainnya",432389,PT Evans Indonesia,false,Kandidat harus memiliki setidaknya Gelar Sarjana di Kedokteran atau setara. Setidaknya memiliki 3 tahun pengalaman dalam bidang yang sesuai untuk...,full_time,3732668,false,false,Dokter Perusahaan,https://www.jobstreet.co.id/id/job/dokter-perusahaan-3732668?token=0~16b9f02e-aeb2-4303-ad44-6eb89eee2984&sectionRank=1&jobId=jobstreet-id-job-3732668,"Kutai Kartanegara,Bangka",2 minutes ago,2021-12-26T17:57:39Z,,,,monthly,,
standard,"504,106","Seni/Media/Komunikasi,Hiburan",434422,PT Kreasi Indah Alam,false,"Qualifications Candidate must possess at least Bachelor’s Degree in Communications, Advertising, Marketing or related field on reputable university....",full_time,3732667,false,false,Live Streaming Coordinator,https://www.jobstreet.co.id/id/job/live-streaming-coordinator-3732667?token=0~16b9f02e-aeb2-4303-ad44-6eb89eee2984&sectionRank=2&jobId=jobstreet-id-job-3732667,Tangerang,33 minutes ago,2021-12-26T17:26:39Z,,,,monthly,,
standard,"503,145","Penjualan / Pemasaran,Penjualan Ritel",434422,PT Kreasi Indah Alam,false,Qualifications Candidate must possess at least Bachelor’s Degree in Marketing or any related fields. At least 2 years experience in related field and...,full_time,3732666,false,false,Retail Operations Assistant Manager,https://www.jobstreet.co.id/id/job/retail-operations-assistant-manager-3732666?token=0~16b9f02e-aeb2-4303-ad44-6eb89eee2984&sectionRank=3&jobId=jobstreet-id-job-3732666,"Jakarta Raya,Tangerang",38 minutes ago,2021-12-26T17:21:28Z,,,,monthly,,
standard,"508,193","Komputer/Teknologi Informasi,IT-Admin Jaringan/Sistem/Database",437190,PT Solusi Pembayaran Elektronik,false,"Hi SPEcial People!We're looking for Database Engineer who passionate in Fintech Industry, update with technologies and able to work with the team. If...",full_time,3732665,false,false,Database Engineer,https://www.jobstreet.co.id/id/job/database-engineer-3732665?token=0~16b9f02e-aeb2-4303-ad44-6eb89eee2984&sectionRank=4&jobId=jobstreet-id-job-3732665,Jakarta Barat,47 minutes ago,2021-12-26T17:12:06Z,,,,monthly,,
standard,"508,191","Komputer/Teknologi Informasi,IT-Perangkat Lunak",437190,PT Solusi Pembayaran Elektronik,false,"Hi SPEcial People!We're looking for PHP Programmer who passionate in Fintech Industry, update with technologies and able to work with the team. If you...",full_time,3732664,false,false,PHP Programmer,https://www.jobstreet.co.id/id/job/php-programmer-3732664?token=0~16b9f02e-aeb2-4303-ad44-6eb89eee2984&sectionRank=5&jobId=jobstreet-id-job-3732664,Jakarta Barat,56 minutes ago,2021-12-26T17:03:33Z,,,,monthly,,
standout,"514,116","Lainnya,Lainnya/Kategori tidak tersedia",413855,PT Citatah Tbk,false,"Sr. Import Officer Manage accurate import documentation including materials in transit, monitoring, controlling, and documenting the movement of all...",full_time,3732663,false,true,Spv /Sr.Import Officer,https://www.jobstreet.co.id/id/job/spv-sr-import-officer-3732663?token=0~16b9f02e-aeb2-4303-ad44-6eb89eee2984&sectionRank=6&jobId=jobstreet-id-job-3732663,Karawang,59 minutes ago,2021-12-26T17:00:31Z,,,,monthly,,
standout,"502,133","Sumber Daya Manusia/Personalia,Staf / Administrasi umum",jobstreet-id-19120,PT YUTAMA KREASINDO,false,"Age Max. 30 years old Minimum D3, graduates majoring in Business Administration/ Commercial Administration/ Secretarial  is preferable Having work...",full_time,3732350,false,true,SALES & MARKETING ADMIN STAFF  (Code : ADM),https://www.jobstreet.co.id/id/job/sales-marketing-admin-staff-code-%3A-adm-3732350?token=0~16b9f02e-aeb2-4303-ad44-6eb89eee2984&sectionRank=7&jobId=jobstreet-id-job-3732350,Jakarta Barat,an hour ago,2021-12-26T17:00:00Z,,,,monthly,,
standout,"502,137","Sumber Daya Manusia/Personalia,Sumber Daya Manusia / HR",5296,PT. Berca Schindler Lifts,false,HR Operation areaA. Recruitmenta.1 Interviewing and scoring activitiesa.2 Loa Preparationa.3 New Employee InductionB. Industrial Relationb.1 Data...,internship,3727778,false,true,Human Resource Strategic Internship,https://www.jobstreet.co.id/id/job/human-resource-strategic-internship-3727778?token=0~16b9f02e-aeb2-4303-ad44-6eb89eee2984&sectionRank=8&jobId=jobstreet-id-job-3727778,Jakarta Raya,an hour ago,2021-12-26T17:00:00Z,IDR,1000000,1400000,monthly,,"Safety and Quality,World class HR Strategic experiences,Remote work"
standout,"501,130","Akuntansi / Keuangan,Audit & Pajak",413855,PT Citatah Tbk,false,"Manage all aspects of cost accounting, including standard job order and engineering to order calculation Maintaining standard costs of raw materials,...",full_time,3732653,false,true,Cost/Tax Accountant  Supervisor / Sr. Officer,https://www.jobstreet.co.id/id/job/cost-tax-accountant-supervisor-sr-officer-3732653?token=0~16b9f02e-aeb2-4303-ad44-6eb89eee2984&sectionRank=9&jobId=jobstreet-id-job-3732653,"Jakarta Selatan,Karawang",an hour ago,2021-12-26T17:00:00Z,,,,monthly,,
standout,"507,105","Pendidikan/Pelatihan,Pendidikan",jobstreet-id-37225,Yayasan Kasih Kibar Kreasi Indonesia,false,"KIDEA PRESCHOOL &amp; KINDERGARTEN, with the spirit to Nurture Bright Children for a Brighter Tomorrow, is looking for highly motivated and qualified...",full_time,3726987,false,true,PRESCHOOL & KINDERGARTEN TEACHER,https://www.jobstreet.co.id/id/job/preschool-kindergarten-teacher-3726987?token=0~16b9f02e-aeb2-4303-ad44-6eb89eee2984&sectionRank=10&jobId=jobstreet-id-job-3726987,Jakarta Utara,an hour ago,2021-12-26T17:00:00Z,,,,monthly,,
standard,"502,137","Sumber Daya Manusia/Personalia,Sumber Daya Manusia / HR",jobstreet-id-288714,PT Sembrani Finance Indonesia,false,Responsibilities1.      Recruitment Handling Company’s recruitment from start to end (for Staff level and above) Handling and manage employee...,full_time,3730985,false,false,HRGA Staff,https://www.jobstreet.co.id/id/job/hrga-staff-3730985?token=0~16b9f02e-aeb2-4303-ad44-6eb89eee2984&sectionRank=11&jobId=jobstreet-id-job-3730985,Jakarta Selatan,an hour ago,2021-12-26T17:00:00Z,,,,monthly,,
standout,"505,147","Pelayanan,Logistik/Rantai Pasokan",2290,IKEA Indonesia,false,What you’ll be doing day to day: You influence and lead the goods flow team in order to contribute to the highest stock availability for customers at...,full_time,3732600,false,true,Goods Flow Team Leader (IKEA Alam Sutera),https://www.jobstreet.co.id/id/job/goods-flow-team-leader-ikea-alam-sutera-3732600?token=0~16b9f02e-aeb2-4303-ad44-6eb89eee2984&sectionRank=12&jobId=jobstreet-id-job-3732600,Tangerang,an hour ago,2021-12-26T17:00:00Z,,,,monthly,,
standard,"503,145","Penjualan / Pemasaran,Penjualan Ritel",439328,Malinda Furniture Gallery (PT Andreti International),false,Kualifikasi: Usia maksimum 35 tahun Pendidikan S1 segala jurusan  Pengalaman sebagai sales minimal 1 tahun di bidang marketing (Freshgraduate...,full_time,3729385,false,false,SALES COUNTER,https://www.jobstreet.co.id/id/job/sales-counter-3729385?token=0~16b9f02e-aeb2-4303-ad44-6eb89eee2984&sectionRank=13&jobId=jobstreet-id-job-3729385,Jakarta Raya,an hour ago,2021-12-26T17:00:00Z,,,,monthly,,
standard,"501,131","Akuntansi / Keuangan,Akuntansi Umum / Pembiayaan",413999,"PT Industri Jamu Dan Farmasi Sido Muncul, Tbk",false,Deskripsi Pekerjaan: Memastikan perusahaan menggunakan standar akuntansi yang tepat dan terkini Menganalisa tax treatment negara tujuan ekspor...,full_time,3732158,false,false,Financial Analyst,https://www.jobstreet.co.id/id/job/financial-analyst-3732158?token=0~16b9f02e-aeb2-4303-ad44-6eb89eee2984&sectionRank=14&jobId=jobstreet-id-job-3732158,Jakarta Barat,an hour ago,2021-12-26T17:00:00Z,,,,monthly,,
standout,"502,133","Sumber Daya Manusia/Personalia,Staf / Administrasi umum",jobstreet-id-275044,UD Usaha Jaya,false,Deskripsi Pekerjaan: Melakukan stock opname untuk validasi data sales Melakukan data entry untuk Sales Melakukan pengolahan data dengan Ms. Excel...,full_time,3721186,false,true,Sales Admin Toko,https://www.jobstreet.co.id/id/job/sales-admin-toko-3721186?token=0~16b9f02e-aeb2-4303-ad44-6eb89eee2984&sectionRank=15&jobId=jobstreet-id-job-3721186,Jakarta Barat,an hour ago,2021-12-26T17:00:00Z,,,,monthly,,
standout,"507,105","Pendidikan/Pelatihan,Pendidikan",jobstreet-id-307107,Open Flow Learning Centre,false,Seeking the 'BEST OF THE BEST' educators here in Indonesia! Only serious and competent applicants should read-on and apply The aesthetic quality of...,full_time,3732661,false,true,Incredible Educators,https://www.jobstreet.co.id/id/job/incredible-educators-3732661?token=0~16b9f02e-aeb2-4303-ad44-6eb89eee2984&sectionRank=16&jobId=jobstreet-id-job-3732661,Badung,an hour ago,2021-12-26T17:00:00Z,,,,monthly,,"Amazing team dynamic,Approachable leadership,Local & global impact"
standout,"510,194","Manufaktur,Manufaktur",413855,PT Citatah Tbk,false,"HR SupervisorTugas dan Tanggung Jawab: Mengelola karyawan di perusahaan agar memiliki kinerja yang terus meningkat, diantaranya: data pribadi...",full_time,3732654,false,true,HR Supervisor,https://www.jobstreet.co.id/id/job/hr-supervisor-3732654?token=0~16b9f02e-aeb2-4303-ad44-6eb89eee2984&sectionRank=17&jobId=jobstreet-id-job-3732654,Karawang,an hour ago,2021-12-26T17:00:00Z,,,,monthly,,
standout,"503,142","Penjualan / Pemasaran,Penjualan - Korporasi",413855,PT Citatah Tbk,false,"Acquire new overseas clients and generate order to achieve sales target, presentation of product to clients, coordinate with internal department to...",full_time,3732662,false,true,International Sales Associate,https://www.jobstreet.co.id/id/job/international-sales-associate-3732662?token=0~16b9f02e-aeb2-4303-ad44-6eb89eee2984&sectionRank=18&jobId=jobstreet-id-job-3732662,Jakarta Raya,an hour ago,2021-12-26T16:36:20Z,,,,monthly,,
auto_inclusion,"502,137","Sumber Daya Manusia/Personalia,Sumber Daya Manusia / HR",436449,PT Repex Wahana,false,"Company: FedEx Express APACJob Title: ID029C: Payroll SpecJob Requisition Number: RC453700Locations:Cilandak Bar., Kec. Cilandak,, IndonesiaJob...",full_time,1029745864,false,false,ID029C: Payroll Spec,https://www.jobstreet.co.id/id/job/id029c%3A-payroll-spec-1029745864?token=0~16b9f02e-aeb2-4303-ad44-6eb89eee2984&sectionRank=19&jobId=jobstreet-id-job-1029745864,Jakarta Selatan,an hour ago,2021-12-26T16:24:11Z,,,,monthly,,
auto_inclusion,"502,133","Sumber Daya Manusia/Personalia,Staf / Administrasi umum",346108,CBI-electric,false,Job Overview:Hiring for collect and input data Scaffolding Request FormKey Responsibility/Accountability: Collect and organize scaffolding Request...,,1029962124,false,false,Administrative Assistant,https://www.jobstreet.co.id/id/job/administrative-assistant-1029962124?token=0~16b9f02e-aeb2-4303-ad44-6eb89eee2984&sectionRank=20&jobId=jobstreet-id-job-1029962124,"Batam,Riau",an hour ago,2021-12-26T16:23:21Z,,,,monthly,,
auto_inclusion,"502,137","Sumber Daya Manusia/Personalia,Sumber Daya Manusia / HR",1040,Phillip Morris Latinoamérica,false,MAKE HISTORY WITH US! We’ve chosen to do something incredible. We’re totally transforming our business and building our future on smoke-free products...,,1029962129,false,false,Talent Acquisition Executive - Employer Branding,https://www.jobstreet.co.id/id/job/talent-acquisition-executive-employer-branding-1029962129?token=0~16b9f02e-aeb2-4303-ad44-6eb89eee2984&sectionRank=21&jobId=jobstreet-id-job-1029962129,Indonesia,an hour ago,2021-12-26T16:22:57Z,,,,monthly,,
auto_inclusion,"508,191","Komputer/Teknologi Informasi,IT-Perangkat Lunak",17756,The World Bank,false,"Organization:The World BankCountry:IndonesiaCity:JakartaOffice:World Bank Jakarta, IndonesiaE T Consultant- Digital DevelopmentJob #:...",,1029962127,false,false,"Extended Term Consultant- Digital Development, Jakarta, Indonesia",https://www.jobstreet.co.id/id/job/extended-term-consultant-digital-development-jakarta-indonesia-1029962127?token=0~16b9f02e-aeb2-4303-ad44-6eb89eee2984&sectionRank=22&jobId=jobstreet-id-job-1029962127,Jakarta Raya,an hour ago,2021-12-26T16:22:56Z,,,,monthly,,
auto_inclusion,"508,193","Komputer/Teknologi Informasi,IT-Admin Jaringan/Sistem/Database",jobstreet-id-1000034212,Exis,false,Industry: IT ServicesWork Experience: 1-3 yearsSalary: USD 300/MonthCity: pandaanState/Province: East javaZip/Postal Code: 67156Job Description•...,,1029962166,false,false,Full time,https://www.jobstreet.co.id/id/job/full-time-1029962166?token=0~16b9f02e-aeb2-4303-ad44-6eb89eee2984&sectionRank=23&jobId=jobstreet-id-job-1029962166,Pasuruan,an hour ago,2021-12-26T16:22:42Z,,,,monthly,,
auto_inclusion,"510,194","Manufaktur,Manufaktur",2795,Nestlé,false,"Position SnapshotLocation: Batang, Central JavaPermanent EmploymentPosition SummaryJoining Nestlé means you are joining the largest food and Beverage...",,1029962147,false,false,"First Line Manager, Bandaraya Factory",https://www.jobstreet.co.id/id/job/first-line-manager-bandaraya-factory-1029962147?token=0~16b9f02e-aeb2-4303-ad44-6eb89eee2984&sectionRank=24&jobId=jobstreet-id-job-1029962147,Jawa Tengah,an hour ago,2021-12-26T16:22:39Z,,,,monthly,,
auto_inclusion,"501,131","Akuntansi / Keuangan,Akuntansi Umum / Pembiayaan",820,Citigroup Inc.,false,"A. New DMT Development1. Understanding of business, data requirement, prioritization2.New Code Development using SAS (190+ DMTs reports)3.Delivering...",,1029962137,false,false,Compl Bus Control Intmd Anlyst - Data Analytics,https://www.jobstreet.co.id/id/job/compl-bus-control-intmd-anlyst-data-analytics-1029962137?token=0~16b9f02e-aeb2-4303-ad44-6eb89eee2984&sectionRank=25&jobId=jobstreet-id-job-1029962137,Jakarta Raya,an hour ago,2021-12-26T16:22:37Z,,,,monthly,,
auto_inclusion,"508,193","Komputer/Teknologi Informasi,IT-Admin Jaringan/Sistem/Database",22479,F5 Networks,false,Come work at a place where innovation and teamwork come together to support the most exciting missions in the world!F5 technologies are at the heart...,,1029962136,false,false,"Manager, Solutions Engineering - Indonesia",https://www.jobstreet.co.id/id/job/manager-solutions-engineering-indonesia-1029962136?token=0~16b9f02e-aeb2-4303-ad44-6eb89eee2984&sectionRank=26&jobId=jobstreet-id-job-1029962136,Jakarta Raya,an hour ago,2021-12-26T16:22:37Z,,,,monthly,,
auto_inclusion,"510,140","Manufaktur,Pembelian/Manajemen Material",5291,KONE,false,"At KONE, we’re people on the move.Just like our escalators, elevators and doors, every day our people move in different directions. We employ over...",,1029962155,false,false,Sourcing Specialist,https://www.jobstreet.co.id/id/job/sourcing-specialist-1029962155?token=0~16b9f02e-aeb2-4303-ad44-6eb89eee2984&sectionRank=27&jobId=jobstreet-id-job-1029962155,Jakarta Raya,an hour ago,2021-12-26T16:22:33Z,,,,monthly,,
auto_inclusion,"508,191","Komputer/Teknologi Informasi,IT-Perangkat Lunak",508601,Xendit,false,"Xendit provides payment infrastructure across Southeast Asia, with a focus on Indonesia and the Philippines. We process payments, power marketplaces,...",,1029962182,false,false,Senior Software Engineer - Store Channels,https://www.jobstreet.co.id/id/job/senior-software-engineer-store-channels-1029962182?token=0~16b9f02e-aeb2-4303-ad44-6eb89eee2984&sectionRank=28&jobId=jobstreet-id-job-1029962182,Jakarta Raya,an hour ago,2021-12-26T16:22:20Z,,,,monthly,,
auto_inclusion,"502,137","Sumber Daya Manusia/Personalia,Sumber Daya Manusia / HR",391629,TMF Group,false,Job no: 545303Work type: InternLocation: Indonesia - JakartaCategories: Client PayrollOffice Location: JakartaAdvertised: 15 Dec 2021 SE Asia Standard...,,1029942913,false,false,Intern - HR & Payroll Services,https://www.jobstreet.co.id/id/job/intern-hr-payroll-services-1029942913?token=0~16b9f02e-aeb2-4303-ad44-6eb89eee2984&sectionRank=29&jobId=jobstreet-id-job-1029942913,Jakarta Raya,an hour ago,2021-12-26T16:22:19Z,,,,monthly,,
auto_inclusion,"512,102","Sains,Pertanian",346108,CBI-electric,false,"Provide an overall interface across all Projects in terms of manpower, materials, skills/ grades spread.Provide guidance and support to existing local...",,1029962162,false,false,Senior E&I Superintendent,https://www.jobstreet.co.id/id/job/senior-e-i-superintendent-1029962162?token=0~16b9f02e-aeb2-4303-ad44-6eb89eee2984&sectionRank=30&jobId=jobstreet-id-job-1029962162,"Batam,Riau",an hour ago,2021-12-26T16:22:18Z,,,,monthly,,
auto_inclusion,"508,191","Komputer/Teknologi Informasi,IT-Perangkat Lunak",jobstreet-id-1000008649,PT Oracle Electronical Indonesia,false,"Applicants are required to read, write, and speak the following languages: English Job SummaryOracle is at the forefront of the digital revolution. We...",,1029942916,false,false,Cloud Engineering – Strategy Accelerator Lead,https://www.jobstreet.co.id/id/job/cloud-engineering-strategy-accelerator-lead-1029942916?token=0~b2397d76-28bc-4533-8200-53929a1f32e6&sectionRank=31&jobId=jobstreet-id-job-1029942916,Jakarta Raya,an hour ago,2021-12-26T16:22:17Z,,,,monthly,,
auto_inclusion,"506,107","Hotel/Restoran,Makanan/Minuman/Pelayanan Restoran",630,Grand Hyatt Jakarta,false,Return to SearchGrand HyattGrand Hyatt JakartaJW - JakartaBars/Restaurants/OutletsEntry Level ManagerFull-timeReq ID: JAK000406LocalShare Outlet...,,1029768069,false,false,Outlet Manager,https://www.jobstreet.co.id/id/job/outlet-manager-1029768069?token=0~b2397d76-28bc-4533-8200-53929a1f32e6&sectionRank=32&jobId=jobstreet-id-job-1029768069,Jakarta Raya,an hour ago,2021-12-26T16:22:16Z,,,,monthly,,
auto_inclusion,"502,137","Sumber Daya Manusia/Personalia,Sumber Daya Manusia / HR",508601,Xendit,false,"Xendit provides payment infrastructure across Southeast Asia, with a focus on Indonesia and the Philippines. We process payments, power marketplaces,...",,1029942946,false,false,Head of People,https://www.jobstreet.co.id/id/job/head-of-people-1029942946?token=0~b2397d76-28bc-4533-8200-53929a1f32e6&sectionRank=33&jobId=jobstreet-id-job-1029942946,Jakarta Raya,an hour ago,2021-12-26T16:21:47Z,,,,monthly,,
auto_inclusion,"503,145","Penjualan / Pemasaran,Penjualan Ritel",1040,Phillip Morris Latinoamérica,false,MAKE HISTORY WITH US! We’ve chosen to do something incredible. We’re totally transforming our business and building our future on smoke-free products...,,1029768135,false,false,Supervisor Retail Engagement - Mataram,https://www.jobstreet.co.id/id/job/supervisor-retail-engagement-mataram-1029768135?token=0~b2397d76-28bc-4533-8200-53929a1f32e6&sectionRank=34&jobId=jobstreet-id-job-1029768135,Indonesia,an hour ago,2021-12-26T16:21:45Z,,,,monthly,,
auto_inclusion,"503,151","Penjualan / Pemasaran,Telesales/Telemarketing",427464,Kitabisa.com,false,"Kitabisa.com is Indonesia's most popular fundraising and donation platform for social causes. Since 2013 we've facilitated more than 14.000 campaigns,...",contract,1029956165,false,false,Admin Campaign Optimization,https://www.jobstreet.co.id/id/job/admin-campaign-optimization-1029956165?token=0~b2397d76-28bc-4533-8200-53929a1f32e6&sectionRank=35&jobId=jobstreet-id-job-1029956165,Jakarta Raya,an hour ago,2021-12-26T16:21:29Z,,,,monthly,,
auto_inclusion,"501,131","Akuntansi / Keuangan,Akuntansi Umum / Pembiayaan",427464,Kitabisa.com,false,Responsibilities:1. Supporting accounting team for checking and maintaining donation transactions in bank2. Coordinate with teams across the...,internship,1029975590,false,false,Accounting Intern,https://www.jobstreet.co.id/id/job/accounting-intern-1029975590?token=0~b2397d76-28bc-4533-8200-53929a1f32e6&sectionRank=36&jobId=jobstreet-id-job-1029975590,Jakarta Raya,an hour ago,2021-12-26T16:21:28Z,,,,monthly,,
auto_inclusion,"501,131","Akuntansi / Keuangan,Akuntansi Umum / Pembiayaan",508601,Xendit,false,"Xendit provides payment infrastructure across Southeast Asia, with a focus on Indonesia and the Philippines. We process payments, power marketplaces,...",,1029942928,false,false,Chief Financial Officer,https://www.jobstreet.co.id/id/job/chief-financial-officer-1029942928?token=0~b2397d76-28bc-4533-8200-53929a1f32e6&sectionRank=37&jobId=jobstreet-id-job-1029942928,Jakarta Raya,an hour ago,2021-12-26T16:21:28Z,,,,monthly,,
auto_inclusion,"502,146","Sumber Daya Manusia/Personalia,Sekretaris",379851,British Embassy Jakarta,false,Main purpose of job:Support BE Jakarta during Indonesia’s G20 Presidency on G20 VIP visit planning.They will facilitate coordination and compilation...,contract,1029942865,false,false,JKT - G20 Visits Support Officer B3(L),https://www.jobstreet.co.id/id/job/jkt-g20-visits-support-officer-b3-l-1029942865?token=0~b2397d76-28bc-4533-8200-53929a1f32e6&sectionRank=38&jobId=jobstreet-id-job-1029942865,Jakarta Raya,an hour ago,2021-12-26T16:21:27Z,,,,monthly,,
auto_inclusion,"508,191","Komputer/Teknologi Informasi,IT-Perangkat Lunak",508285,Kantar Added Value,false,"We go beyond the obvious, using intelligence, passion and creativity to inspire new thinking and shape the world we live in.To start a career that is...",,1029942912,false,false,Senior DP Executive,https://www.jobstreet.co.id/id/job/senior-dp-executive-1029942912?token=0~b2397d76-28bc-4533-8200-53929a1f32e6&sectionRank=39&jobId=jobstreet-id-job-1029942912,Jakarta Raya,an hour ago,2021-12-26T16:21:27Z,,,,monthly,,
auto_inclusion,"501,135","Akuntansi / Keuangan,Perbankan / Jasa Finansial ",820,Citigroup Inc.,false,"The Risk Collection Analyst is an intermediate-level position responsible for conducting credit reviews on collection strategy, segmentation, and...",,1029942931,false,false,Risk Collection Analyst,https://www.jobstreet.co.id/id/job/risk-collection-analyst-1029942931?token=0~b2397d76-28bc-4533-8200-53929a1f32e6&sectionRank=40&jobId=jobstreet-id-job-1029942931,Jakarta Raya,an hour ago,2021-12-26T16:21:26Z,,,,monthly,,
auto_inclusion,"501,131","Akuntansi / Keuangan,Akuntansi Umum / Pembiayaan",508601,Xendit,false,"Xendit provides payment infrastructure across Southeast Asia, with a focus on Indonesia and the Philippines. We process payments, power marketplaces,...",,1029768090,false,false,Regional Financial Operations Specialist,https://www.jobstreet.co.id/id/job/regional-financial-operations-specialist-1029768090?token=0~b2397d76-28bc-4533-8200-53929a1f32e6&sectionRank=41&jobId=jobstreet-id-job-1029768090,Jakarta Raya,an hour ago,2021-12-26T16:21:26Z,,,,monthly,,
auto_inclusion,"508,191","Komputer/Teknologi Informasi,IT-Perangkat Lunak",508601,Xendit,false,"Xendit provides payment infrastructure across Southeast Asia, with a focus on Indonesia and the Philippines. We process payments, power marketplaces,...",,1029768049,false,false,Government Relations Senior Analyst,https://www.jobstreet.co.id/id/job/government-relations-senior-analyst-1029768049?token=0~b2397d76-28bc-4533-8200-53929a1f32e6&sectionRank=42&jobId=jobstreet-id-job-1029768049,Jakarta Raya,an hour ago,2021-12-26T16:21:22Z,,,,monthly,,
auto_inclusion,"503,139","Penjualan / Pemasaran,Pemasaran/Pengembangan Bisnis",509439,Fortive,false,"This position is located in Jakarta, Indonesia.Primary Responsibilities: Providing support to internal stakeholders and the wider team to deliver...",full_time,1029987745,false,false,Senior Marketing Executive (Indonesia),https://www.jobstreet.co.id/id/job/senior-marketing-executive-indonesia-1029987745?token=0~b2397d76-28bc-4533-8200-53929a1f32e6&sectionRank=43&jobId=jobstreet-id-job-1029987745,Jawa Tengah,an hour ago,2021-12-26T16:21:21Z,,,,monthly,,
auto_inclusion,"512,108","Sains,Teknologi Makanan/Ahli Gizi",402526,Dutch Lady Milk Industries,false,"Initiate, design, develop, test, monitor, refine and implement new or improved products/processes/packages/applications and select, fine-tune and...",,1029875408,false,false,Product Development Specialist,https://www.jobstreet.co.id/id/job/product-development-specialist-1029875408?token=0~b2397d76-28bc-4533-8200-53929a1f32e6&sectionRank=44&jobId=jobstreet-id-job-1029875408,Jakarta Timur,an hour ago,2021-12-26T16:21:21Z,,,,monthly,,
auto_inclusion,"511,184","Bangunan/Konstruksi,Teknik Sipil/Konstruksi Bangunan",346108,CBI-electric,false,Job Overview: Over-all responsibility is project execution hands on Electrical - Commissioning test procedures activities.Key Tasks and...,,1029875422,false,false,Associate Hookup & Commission Tech,https://www.jobstreet.co.id/id/job/associate-hookup-commission-tech-1029875422?token=0~b2397d76-28bc-4533-8200-53929a1f32e6&sectionRank=45&jobId=jobstreet-id-job-1029875422,"Batam,Riau",an hour ago,2021-12-26T16:20:59Z,,,,monthly,,
auto_inclusion,"512,103","Sains,Aktuaria/Statistik",1730,Quintiles Asia Pacific,false,"Job Responsibilities Researches, analyzes data and support in business discussion. Takes responsibility for the quality of service delivered to...",,1029768054,false,false,Client Service Analyst,https://www.jobstreet.co.id/id/job/client-service-analyst-1029768054?token=0~b2397d76-28bc-4533-8200-53929a1f32e6&sectionRank=46&jobId=jobstreet-id-job-1029768054,Jakarta Raya,an hour ago,2021-12-26T16:20:58Z,,,,monthly,,
auto_inclusion,"506,107","Hotel/Restoran,Makanan/Minuman/Pelayanan Restoran",630,Grand Hyatt Jakarta,false,Return to SearchGrand HyattGrand Hyatt JakartaJW - JakartaBars/Restaurants/OutletsEntry Level ManagerFull-timeReq ID: JAK000407LocalShare F&amp;B Team...,,1029768134,false,false,F&B Team Leader - Outlet (Bar),https://www.jobstreet.co.id/id/job/f-b-team-leader-outlet-bar-1029768134?token=0~b2397d76-28bc-4533-8200-53929a1f32e6&sectionRank=47&jobId=jobstreet-id-job-1029768134,Jakarta Raya,an hour ago,2021-12-26T16:20:58Z,,,,monthly,,
