adType,categoriesCode,categoriesName,companyId,companyName,companyPrivate,description,employment,id,isClassified,isStandout,jobTitle,jobUrl,locations,postingDuration,postedAt,salarycurrency,salaryMin,salaryMax,salaryPeriod,salaryTerm,sellingPoints
standard,"508,193","Komputer/Teknologi Informasi,IT-Admin Jaringan/Sistem/Database",414113,"PT. Metrodata Electronics, Tbk",false,QUALIFICATION Bachelor Degree in Software Engineering/Information Technology/Computer Science /or equivalent relevant experience Minimum 2 year of...,contract,3714237,false,false,Technical Project Manager,https://www.jobstreet.co.id/id/job/technical-project-manager-3714237?token=0~4c72462d-eb37-4f45-a3ad-2fcb7da848b2&sectionRank=1216&jobId=jobstreet-id-job-3714237,Jakarta Selatan,21 hours ago,2021-12-23T20:31:04Z,,,,monthly,,
standard,"508,193","Komputer/Teknologi Informasi,IT-Admin Jaringan/Sistem/Database",414113,"PT. Metrodata Electronics, Tbk",false,"Kualifikasi: Pengalaman bekerja minimal 2 tahun Memiliki latar belakang pendidikan Minimal minimal S1 Jurusan Teknik Informatika, llmu Komputer,...",contract,3714240,false,false,System Engineer Office365,https://www.jobstreet.co.id/id/job/system-engineer-office365-3714240?token=0~4c72462d-eb37-4f45-a3ad-2fcb7da848b2&sectionRank=1217&jobId=jobstreet-id-job-3714240,Tangerang,21 hours ago,2021-12-23T20:31:04Z,,,,monthly,,
standout,"507,121","Pendidikan/Pelatihan,Pelatihan & Pengembangan",436490,Rimau Indonesia (Rimau Group),false,"Candidate must possess at least a SMU, Diploma, Bachelor's Degree, Engineering (Mining/Mineral) or equivalent. Required skill(s): supervising,...",full_time,3714258,false,true,SPV Trainer A2B (Coal Mining),https://www.jobstreet.co.id/id/job/spv-trainer-a2b-coal-mining-3714258?token=0~4c72462d-eb37-4f45-a3ad-2fcb7da848b2&sectionRank=1218&jobId=jobstreet-id-job-3714258,Kalimantan Tengah,21 hours ago,2021-12-23T20:31:03Z,,,,monthly,,
standout,"502,146","Sumber Daya Manusia/Personalia,Sekretaris",jobstreet-id-25297,PT TKG Taekwang Indonesia,false,Candidate Expected to be safety and healthy-minded. Diploma (D3) / Bachelor's Degree in any field. Fresh graduates are welcome to apply. Have the...,full_time,3714250,false,true,Korean Translator,https://www.jobstreet.co.id/id/job/korean-translator-3714250?token=0~4c72462d-eb37-4f45-a3ad-2fcb7da848b2&sectionRank=1219&jobId=jobstreet-id-job-3714250,Jawa Barat,21 hours ago,2021-12-23T20:31:03Z,,,,monthly,,"Permanent Employee,Salary rate higher than UMR,Career path and Development"
standard,"510,194","Manufaktur,Manufaktur",432662,PT Gaya Sukses Mandiri Kaseindo,false,Tugas dan Tanggung Jawab : Mencari daerah potensial sumber kayu Melakukan kunjungan ke supplier kayu untuk memilih kayu sesuai kualitas yang...,full_time,3714294,false,false,GRADER / HUNTER PLANT BOYOLALI,https://www.jobstreet.co.id/id/job/grader-hunter-plant-boyolali-3714294?token=0~4c72462d-eb37-4f45-a3ad-2fcb7da848b2&sectionRank=1220&jobId=jobstreet-id-job-3714294,Jawa Tengah,21 hours ago,2021-12-23T20:31:02Z,,,,monthly,,
standard,"508,191","Komputer/Teknologi Informasi,IT-Perangkat Lunak",434188,PT Karya Solusi Prima Sejahtera,false,KUALIFIKASI : Lulusan S1 Ilmu Komputer atau yang relevan Memiliki pengalaman minimal 1 tahun sebagai Software Developer/Data Engineer Berpengalaman...,full_time,3714299,false,false,Data Engineer,https://www.jobstreet.co.id/id/job/data-engineer-3714299?token=0~4c72462d-eb37-4f45-a3ad-2fcb7da848b2&sectionRank=1221&jobId=jobstreet-id-job-3714299,Jakarta Raya,21 hours ago,2021-12-23T20:31:02Z,,,,monthly,,
standard,"508,191","Komputer/Teknologi Informasi,IT-Perangkat Lunak",414035,PT Karsa Lintas Buwana (Kalbe E-Health),false,"Responsibilities: Make iOS coding with swift clean and efficient Identify and solve bugs, bottlenecks and improve the performance of apps Conduct unit...",full_time,3714285,false,false,IOS Engineer - Chakra,https://www.jobstreet.co.id/id/job/ios-engineer-chakra-3714285?token=0~4c72462d-eb37-4f45-a3ad-2fcb7da848b2&sectionRank=1222&jobId=jobstreet-id-job-3714285,Jakarta Utara,21 hours ago,2021-12-23T20:31:02Z,,,,monthly,,
standout,"508,191","Komputer/Teknologi Informasi,IT-Perangkat Lunak",436151,PT Prima Integrasi Solusindo,false,"Job Responsibility : Leads generation and new customer acquisition Performance will based on successfull qualified leads, and sales revenue closing...",full_time,3714292,false,true,Inside Sales - Enterprise Content Management Software,https://www.jobstreet.co.id/id/job/inside-sales-enterprise-content-management-software-3714292?token=0~4c72462d-eb37-4f45-a3ad-2fcb7da848b2&sectionRank=1223&jobId=jobstreet-id-job-3714292,Jakarta Pusat,21 hours ago,2021-12-23T20:31:02Z,IDR,6000000,9000000,monthly,,
standard,"503,143","Penjualan / Pemasaran,Penjualan - Teknik/Teknikal/IT",436297,PT. Putra Chandra Sentosa,false,PERUSAHAAN DISTRIBUSI MESIN PENGOLAHAN DAN PENGEMASAN MAKANAN YANG SEDANG BERKEMBANG membutuhkan segera : SALES ENGINEER JAKARTA Karakter : Optimis...,full_time,3714278,false,false,Sales Engineer,https://www.jobstreet.co.id/id/job/sales-engineer-3714278?token=0~4c72462d-eb37-4f45-a3ad-2fcb7da848b2&sectionRank=1224&jobId=jobstreet-id-job-3714278,Jakarta Raya,21 hours ago,2021-12-23T20:31:02Z,,,,monthly,,
standout,"508,191","Komputer/Teknologi Informasi,IT-Perangkat Lunak",jobstreet-id-273580,Yayasan AidHub Indonesia,false,Responsibilities: This role will report to the IT Manager. Maintain and upgrade the software following deployment. Develop individual functional...,full_time,3714313,false,true,Back-End Web Developer,https://www.jobstreet.co.id/id/job/back-end-web-developer-3714313?token=0~4c72462d-eb37-4f45-a3ad-2fcb7da848b2&sectionRank=1225&jobId=jobstreet-id-job-3714313,Badung,21 hours ago,2021-12-23T20:31:01Z,,,,monthly,,"International Yayasan based in Bali, Indonesia,Above standard job package with regular team bonding / outing,Dynamic working environment with regular skills development"
standout,"503,145","Penjualan / Pemasaran,Penjualan Ritel",439305,PT. Majoo Teknologi Indonesia,false,Tentang majoomajoo Teknologi Indonesia adalah salah satu perusahaan yang bergerak di bidang aplikasi wirausaha lengkap mulai dari pengelolaan...,full_time,3714320,false,true,Sales Executive,https://www.jobstreet.co.id/id/job/sales-executive-3714320?token=0~4c72462d-eb37-4f45-a3ad-2fcb7da848b2&sectionRank=1226&jobId=jobstreet-id-job-3714320,Palopo,21 hours ago,2021-12-23T20:31:01Z,IDR,3000000,5200000,monthly,,"BPJS Kesehatan dan Ketenagakerjaan,Bonus Kinerja (Insentif),Waktu kerja yang fleksibel"
standout,"503,145","Penjualan / Pemasaran,Penjualan Ritel",439305,PT. Majoo Teknologi Indonesia,false,Tentang majoomajoo Teknologi Indonesia adalah salah satu perusahaan yang bergerak di bidang aplikasi wirausaha lengkap mulai dari pengelolaan...,full_time,3714311,false,true,Sales Executive,https://www.jobstreet.co.id/id/job/sales-executive-3714311?token=0~4c72462d-eb37-4f45-a3ad-2fcb7da848b2&sectionRank=1227&jobId=jobstreet-id-job-3714311,Balikpapan,21 hours ago,2021-12-23T20:31:01Z,IDR,3000000,5200000,monthly,,"BPJS Kesehatan dan Ketenagakerjaan,Bonus Kinerja (Insentif),Waktu kerja yang fleksibel"
standard,"508,191","Komputer/Teknologi Informasi,IT-Perangkat Lunak",431955,Dharma Agung Wijaya Group,false,Responsibilities : Getting requirement to user/analyst system Training user all module Develop and modification ERP system based on requirement user...,full_time,3714307,false,false,IT Developer Officer,https://www.jobstreet.co.id/id/job/it-developer-officer-3714307?token=0~4c72462d-eb37-4f45-a3ad-2fcb7da848b2&sectionRank=1228&jobId=jobstreet-id-job-3714307,Jakarta Raya,21 hours ago,2021-12-23T20:31:01Z,,,,monthly,,
standard,"503,143","Penjualan / Pemasaran,Penjualan - Teknik/Teknikal/IT",437247,PT Stainless Steel Primavalve MajuBersama,false,Responsibilities: Having knowledge about Casting/Foundry process to be able as a company representative  Searching for new customers Traveling and...,full_time,3714314,false,false,Senior Sales Engineer Casting ( Foundry ),https://www.jobstreet.co.id/id/job/senior-sales-engineer-casting-foundry-3714314?token=0~4c72462d-eb37-4f45-a3ad-2fcb7da848b2&sectionRank=1229&jobId=jobstreet-id-job-3714314,Cikupa,21 hours ago,2021-12-23T20:31:01Z,,,,monthly,,
standard,"508,191","Komputer/Teknologi Informasi,IT-Perangkat Lunak",434188,PT Karya Solusi Prima Sejahtera,false,"KUALIFIKASI: Lulusan S1 Teknik Informatika/S1 Sistem Informasi Menguasai bahasa pemograman Java, HTML, CSS, Java Script Menguasai framework seperti...",full_time,3714322,false,false,Developer Engineer (Yogyakarta),https://www.jobstreet.co.id/id/job/developer-engineer-yogyakarta-3714322?token=0~4c72462d-eb37-4f45-a3ad-2fcb7da848b2&sectionRank=1230&jobId=jobstreet-id-job-3714322,Jakarta Raya,21 hours ago,2021-12-23T20:31:00Z,IDR,4000000,4500000,monthly,,
standard,"504,101","Seni/Media/Komunikasi,Seni / Desain Kreatif",jobstreet-id-209301,PT Fullmoon Jaya Abadi,false,"Requirement : Possess a strong graphic design portfolio, including social media design, print design, illustration and icon design Open to discussion...",full_time,3714365,false,false,Brand Designer,https://www.jobstreet.co.id/id/job/brand-designer-3714365?token=0~916255a4-270b-4461-835b-b5d737cefb1c&sectionRank=1231&jobId=jobstreet-id-job-3714365,Jakarta Utara,21 hours ago,2021-12-23T20:30:59Z,,,,monthly,,
standard,"503,139","Penjualan / Pemasaran,Pemasaran/Pengembangan Bisnis",428730,PT Tiens Indonesia Logistics Trading,false,Job of Scope: Responsible for developing business strategies and programs for whole Indonesia Maintain strong relationship with network leaders and...,full_time,3714367,false,false,"Deputy Branch Manager, Indonesia (MLM Industry - Mandarin Speaker)",https://www.jobstreet.co.id/id/job/deputy-branch-manager-indonesia-mlm-industry-mandarin-speaker-3714367?token=0~916255a4-270b-4461-835b-b5d737cefb1c&sectionRank=1232&jobId=jobstreet-id-job-3714367,Jakarta Raya,21 hours ago,2021-12-23T20:30:59Z,,,,monthly,,
standard,"508,191","Komputer/Teknologi Informasi,IT-Perangkat Lunak",434346,PT Knitto Tekstil Indonesia,false,Kami mencari Front End IT Programmer yang terampil dan bersemangat untuk bergabung dengan tim kami  Tugas dan Tanggung Jawab: Membuat program web...,full_time,3714372,false,false,FRONT END DEVELOPER IT PROGRAMMER,https://www.jobstreet.co.id/id/job/front-end-developer-it-programmer-3714372?token=0~916255a4-270b-4461-835b-b5d737cefb1c&sectionRank=1233&jobId=jobstreet-id-job-3714372,Bandung,21 hours ago,2021-12-23T20:30:59Z,,,,monthly,,
standard,"508,193","Komputer/Teknologi Informasi,IT-Admin Jaringan/Sistem/Database",435572,PT Nusantara Compnet Integrator,false,Job Responsibilities: Directing all sales activities to ensure the achievement of sales targets in accordance with the targets set by the company...,full_time,3714356,false,false,IT Sales Director,https://www.jobstreet.co.id/id/job/it-sales-director-3714356?token=0~916255a4-270b-4461-835b-b5d737cefb1c&sectionRank=1234&jobId=jobstreet-id-job-3714356,Jakarta Barat,21 hours ago,2021-12-23T20:30:59Z,,,,monthly,,
standout,"503,145","Penjualan / Pemasaran,Penjualan Ritel",439305,PT. Majoo Teknologi Indonesia,false,Tentang majoomajoo Teknologi Indonesia adalah salah satu perusahaan yang bergerak di bidang aplikasi wirausaha lengkap mulai dari pengelolaan...,full_time,3714355,false,true,Sales Executive,https://www.jobstreet.co.id/id/job/sales-executive-3714355?token=0~916255a4-270b-4461-835b-b5d737cefb1c&sectionRank=1235&jobId=jobstreet-id-job-3714355,Tarakan,21 hours ago,2021-12-23T20:30:59Z,IDR,3000000,5200000,monthly,,"BPJS Kesehatan dan Ketenagakerjaan,Bonus Kinerja (Insentif),Waktu kerja yang fleksibel"
standard,"501,135","Akuntansi / Keuangan,Perbankan / Jasa Finansial ",jobstreet-id-338665,PT PG Berjangka,false,"Job Requirements:- Are passionate about financial investing, and an avid investor yourself (either in gold, mutual funds, crypto, or other asset...",full_time,3714397,false,false,Sales Funding Manager (Reksadana),https://www.jobstreet.co.id/id/job/sales-funding-manager-reksadana-3714397?token=0~916255a4-270b-4461-835b-b5d737cefb1c&sectionRank=1236&jobId=jobstreet-id-job-3714397,Jakarta Raya,21 hours ago,2021-12-23T20:30:58Z,,,,monthly,,
standard,"503,142","Penjualan / Pemasaran,Penjualan - Korporasi",436449,PT Repex Wahana,false,Key Specific Responsibilities : Identify and develop existing customer Visit potential customers for new business Implement sales plan and communicate...,full_time,3714398,false,false,Account Manager Express Domestic & International (Denpasar Area),https://www.jobstreet.co.id/id/job/account-manager-express-domestic-international-denpasar-area-3714398?token=0~916255a4-270b-4461-835b-b5d737cefb1c&sectionRank=1237&jobId=jobstreet-id-job-3714398,Denpasar,21 hours ago,2021-12-23T20:30:58Z,,,,monthly,,
standard,"503,144","Penjualan / Pemasaran,Penjualan - Jasa Keuangan",367840,PT AIA FINANCIAL,false,"Jadilah Mitra AIA sebagai Bancassurance Consultant, dan maksimalkan potensi Anda untuk memperoleh penghasilan yang tidak terbatas. The only limitation...",full_time,3714383,false,false,"Bancassurance Consultant - (Penempatan MANOKWARI, SORONG, JAYAPURA)",https://www.jobstreet.co.id/id/job/bancassurance-consultant-penempatan-manokwari-sorong-jayapura-3714383?token=0~916255a4-270b-4461-835b-b5d737cefb1c&sectionRank=1238&jobId=jobstreet-id-job-3714383,Sorong,21 hours ago,2021-12-23T20:30:58Z,IDR,3000000,5000000,monthly,,
standout,"514,116","Lainnya,Lainnya/Kategori tidak tersedia",jobstreet-id-326870,The Langham Jakarta,false,"Primary responsibility is to deliver excellence in quality Spa services to guests/visitors/members in a timely, courteous and efficient...",full_time,3714387,false,true,SPA Therapist,https://www.jobstreet.co.id/id/job/spa-therapist-3714387?token=0~916255a4-270b-4461-835b-b5d737cefb1c&sectionRank=1239&jobId=jobstreet-id-job-3714387,Jakarta Raya,21 hours ago,2021-12-23T20:30:58Z,,,,monthly,,"Duty Meal,Service Charge,Career & Development Plan"
standard,"508,191","Komputer/Teknologi Informasi,IT-Perangkat Lunak",438846,PT. Berca Hardayaperkasa,false,"Job Description: Assessment for customer current pain point, business objective and IT requirement Design IT Infrastructure for Server, Storage,...",full_time,3714414,false,false,IT Solution Architect,https://www.jobstreet.co.id/id/job/it-solution-architect-3714414?token=0~916255a4-270b-4461-835b-b5d737cefb1c&sectionRank=1240&jobId=jobstreet-id-job-3714414,Jakarta Pusat,21 hours ago,2021-12-23T20:30:57Z,,,,monthly,,
standout,"508,191","Komputer/Teknologi Informasi,IT-Perangkat Lunak",jobstreet-id-28554,PT GED Lintas Indonesia,false,"Job Description :• Design and write with the cutting edge GO language to improve the availability, scalability, latency, and efficiency of GED...",full_time,3714421,false,true,Backend Engineer,https://www.jobstreet.co.id/id/job/backend-engineer-3714421?token=0~916255a4-270b-4461-835b-b5d737cefb1c&sectionRank=1241&jobId=jobstreet-id-job-3714421,Jakarta Raya,21 hours ago,2021-12-23T20:30:57Z,IDR,6000000,7000000,monthly,,
standard,"510,140","Manufaktur,Pembelian/Manajemen Material",433906,PT Jakarana Tama (Jakarta),false,Tugas dan tanggung jawab: Mengelola dan melaksanakan kegiatan pembelian bahan baku/ RM (food &amp; beverage) guna mendapatkan barang-barang yang di...,full_time,3714424,false,false,PURCHASING STAFF MANDARIN SPEAKER,https://www.jobstreet.co.id/id/job/purchasing-staff-mandarin-speaker-3714424?token=0~916255a4-270b-4461-835b-b5d737cefb1c&sectionRank=1242&jobId=jobstreet-id-job-3714424,Jakarta Selatan,21 hours ago,2021-12-23T20:30:57Z,,,,monthly,,
standout,"503,203","Penjualan / Pemasaran,Digital Marketing",433981,PT Jayanata,false,Create design for social media &amp; online platforms Manage social media Manage online stores Sharing content daily that builds meaningful...,full_time,3714425,false,true,SOCIAL MEDIA DESIGN & ONLINE COORDINATOR,https://www.jobstreet.co.id/id/job/social-media-design-online-coordinator-3714425?token=0~916255a4-270b-4461-835b-b5d737cefb1c&sectionRank=1243&jobId=jobstreet-id-job-3714425,Jakarta Utara,21 hours ago,2021-12-23T20:30:57Z,,,,monthly,,
standout,"503,142","Penjualan / Pemasaran,Penjualan - Korporasi",506861,PT SAGLOBAL INDONESIA OPERATIONS,false,"What are you looking for?If it’s a career that offers growth opportunities, an independent work environment, and a dynamic, supportive company with a...",full_time,3714429,false,true,Senior Enterprise Sales Manager (ERP),https://www.jobstreet.co.id/id/job/senior-enterprise-sales-manager-erp-3714429?token=0~916255a4-270b-4461-835b-b5d737cefb1c&sectionRank=1244&jobId=jobstreet-id-job-3714429,Jakarta Barat,21 hours ago,2021-12-23T20:30:57Z,,,,monthly,,"A leading global provider of Microsoft Dynamics 365 solutions,Highly experienced, collaborative, supportive, and fun team,Independent work environment with personal growth opportunities"
standout,"510,140","Manufaktur,Pembelian/Manajemen Material",426465,PT Brothersindo Saudara Sejati,false,STAFF PURCHASING - MANDARIN SPEAKINGRequirement : Maximum 30 years old. Working experience in the same field is a must and at least 1 years. Fluency...,full_time,3714402,false,true,STAFF PRCHASING - MANDARIN SPEAKING,https://www.jobstreet.co.id/id/job/staff-prchasing-mandarin-speaking-3714402?token=0~916255a4-270b-4461-835b-b5d737cefb1c&sectionRank=1245&jobId=jobstreet-id-job-3714402,Jakarta Raya,21 hours ago,2021-12-23T20:30:57Z,,,,monthly,,
standout,"513,113","Layanan Kesehatan,Diagnosa/Lainnya",506896,PT Bina Dinamika Raga,false,Kualifikasi Umur Maksimal 35 Tahun Minimal pendidikan kedokteran Memiliki STR Kedokteran yang masih berlaku Diutamakan memiliki pengalaman di bidang...,full_time,3714410,false,true,Dokter,https://www.jobstreet.co.id/id/job/dokter-3714410?token=0~916255a4-270b-4461-835b-b5d737cefb1c&sectionRank=1246&jobId=jobstreet-id-job-3714410,Jakarta Raya,21 hours ago,2021-12-23T20:30:57Z,IDR,4000000,5000000,monthly,,
standard,"508,191","Komputer/Teknologi Informasi,IT-Perangkat Lunak",432221,EKA HOSPITAL,false,"Job Description : Analyze user requirements Write and test code, refining and rewriting it as a necessary Research, design, and write new software...",full_time,3714454,false,false,Software Engineer Specialist,https://www.jobstreet.co.id/id/job/software-engineer-specialist-3714454?token=0~916255a4-270b-4461-835b-b5d737cefb1c&sectionRank=1247&jobId=jobstreet-id-job-3714454,Tangerang,21 hours ago,2021-12-23T20:30:56Z,,,,monthly,,
standard,"503,142","Penjualan / Pemasaran,Penjualan - Korporasi",439877,PT. MULTIFORTUNA SINARDELTA,false,Qualifications: Maximum 30 years old. Candidate must possess at least Bachelor's Degree in any field. At least 2 Years of working experience in Sales...,contract,3714457,false,false,Sales Specialist (Bali),https://www.jobstreet.co.id/id/job/sales-specialist-bali-3714457?token=0~916255a4-270b-4461-835b-b5d737cefb1c&sectionRank=1248&jobId=jobstreet-id-job-3714457,Bali,21 hours ago,2021-12-23T20:30:56Z,,,,monthly,,
standard,"503,139","Penjualan / Pemasaran,Pemasaran/Pengembangan Bisnis",432029,PT Dinasira Sembada,false,"Syarat Pekerjaan:  Minimal memiliki ijasah S1 Bachelor's Degree, atau S2 Master's Degree/ Post Graduate in Mass Communication, Public Relations,...",contract,3714464,false,false,Sales Marketing,https://www.jobstreet.co.id/id/job/sales-marketing-3714464?token=0~916255a4-270b-4461-835b-b5d737cefb1c&sectionRank=1249&jobId=jobstreet-id-job-3714464,Tangerang,21 hours ago,2021-12-23T20:30:56Z,,,,monthly,,
standout,"508,191","Komputer/Teknologi Informasi,IT-Perangkat Lunak",427970,PT Perdana Jatiputra,false,Pendidikan minimal S1 Manajemen Informatika/Teknik Informatika Pengalaman di pemograman minimal 5 tahun Menguasai : VB.NetSQL ServerDot Net (.Net)Web...,full_time,3714477,false,true,Programmer Senior,https://www.jobstreet.co.id/id/job/programmer-senior-3714477?token=0~916255a4-270b-4461-835b-b5d737cefb1c&sectionRank=1250&jobId=jobstreet-id-job-3714477,Jakarta Pusat,21 hours ago,2021-12-23T20:30:56Z,,,,monthly,,"Uang Makan,Uang Transport"
standout,"508,191","Komputer/Teknologi Informasi,IT-Perangkat Lunak",434649,PT Logique Digital Indonesia,false,"Minimum Qualifications:Graduated S1 or Diploma from University.Minimum 3 years of relevant experience with exposure to Typescript and ReactJS/Redux,...",full_time,3714478,false,true,Frontend Engineer (Full Remote),https://www.jobstreet.co.id/id/job/frontend-engineer-full-remote-3714478?token=0~916255a4-270b-4461-835b-b5d737cefb1c&sectionRank=1251&jobId=jobstreet-id-job-3714478,Jakarta Raya,21 hours ago,2021-12-23T20:30:56Z,,,,monthly,,
standard,"502,133","Sumber Daya Manusia/Personalia,Staf / Administrasi umum",jobstreet-id-324977,PT Flash Express Indonesia,false,We Flash Group Indonesia are looking for Mandarin Speaker Talent with the specifications as below:Responsibilities: Collaborating with China regional...,full_time,3714485,false,false,Mandarin Speaker Talent,https://www.jobstreet.co.id/id/job/mandarin-speaker-talent-3714485?token=0~916255a4-270b-4461-835b-b5d737cefb1c&sectionRank=1252&jobId=jobstreet-id-job-3714485,Jakarta Raya,21 hours ago,2021-12-23T20:30:56Z,,,,monthly,,
standout,"504,101","Seni/Media/Komunikasi,Seni / Desain Kreatif",jobstreet-id-8113,Sekolah Marie Joseph,false,"Candidate must possess at least Diploma, Bachelor's Degree in Art/Design/Creative Multimedia or equivalent, Required language(s): English, Bahasa...",contract,3714487,false,true,Multimedia & Graphic,https://www.jobstreet.co.id/id/job/multimedia-graphic-3714487?token=0~916255a4-270b-4461-835b-b5d737cefb1c&sectionRank=1253&jobId=jobstreet-id-job-3714487,Jakarta Utara,21 hours ago,2021-12-23T20:30:56Z,,,,monthly,,
standard,"508,191","Komputer/Teknologi Informasi,IT-Perangkat Lunak",431846,PT Dutapalma Nusantara (Darmex Agro Group),false,"Job Descriptions : Create and maintain all master data for plantation application system Gathering business requirements for new implementation, new...",full_time,3714489,false,false,SAP PAS,https://www.jobstreet.co.id/id/job/sap-pas-3714489?token=0~916255a4-270b-4461-835b-b5d737cefb1c&sectionRank=1254&jobId=jobstreet-id-job-3714489,Jakarta Selatan,21 hours ago,2021-12-23T20:30:56Z,,,,monthly,,
standard,"508,193","Komputer/Teknologi Informasi,IT-Admin Jaringan/Sistem/Database",431500,PT Cendana Teknika Utama,false,"Melakukan identifikasi, analisa dan memberikan usulan solusi teknis Bertindak sebagai First layer (Layer 1/L1) dalam menangani permasalahan terkait...",full_time,3714495,false,false,STORAGE & BACKUP ENGINEER,https://www.jobstreet.co.id/id/job/storage-backup-engineer-3714495?token=0~916255a4-270b-4461-835b-b5d737cefb1c&sectionRank=1255&jobId=jobstreet-id-job-3714495,Jakarta Selatan,21 hours ago,2021-12-23T20:30:56Z,,,,monthly,,
standard,"508,193","Komputer/Teknologi Informasi,IT-Admin Jaringan/Sistem/Database",431846,PT Dutapalma Nusantara (Darmex Agro Group),false,Job Descriptions: Support Functional to fullfill User Requirement Create abd change Subsript dan Smartforms Create abd change Function Module and RFC...,full_time,3714510,false,false,SAP ABAP Staff,https://www.jobstreet.co.id/id/job/sap-abap-staff-3714510?token=0~916255a4-270b-4461-835b-b5d737cefb1c&sectionRank=1256&jobId=jobstreet-id-job-3714510,Jakarta Selatan,21 hours ago,2021-12-23T20:30:56Z,,,,monthly,,
standout,"503,139","Penjualan / Pemasaran,Pemasaran/Pengembangan Bisnis",506861,PT SAGLOBAL INDONESIA OPERATIONS,false,"What are you looking for?If it’s a career that offers growth opportunities, an independent work environment, and a dynamic, supportive company with a...",full_time,3714513,false,true,"Regional Marketing Specialist, APAC",https://www.jobstreet.co.id/id/job/regional-marketing-specialist-apac-3714513?token=0~916255a4-270b-4461-835b-b5d737cefb1c&sectionRank=1257&jobId=jobstreet-id-job-3714513,Jakarta Barat,21 hours ago,2021-12-23T20:30:56Z,,,,monthly,,"A leading global provider of Microsoft Dynamics 365 solutions,Highly experienced, collaborative, supportive, and fun team,Independent work environment with personal growth opportunities"
standard,"513,111","Layanan Kesehatan,Praktisi/Asisten Medis",432382,EUROMEDICA GROUP,false,Kualifikasi: Minimum D3 Nursing/Perawat Berpengalaman di bidang Beauty Care/salon/klinik aestetik minimal 1 tahun sebagai Beautician/Nurse Terbiasa...,full_time,3714525,false,false,Nurse (Mall Artha Gading),https://www.jobstreet.co.id/id/job/nurse-mall-artha-gading-3714525?token=0~916255a4-270b-4461-835b-b5d737cefb1c&sectionRank=1258&jobId=jobstreet-id-job-3714525,Jakarta Utara,21 hours ago,2021-12-23T20:30:56Z,IDR,2800000,3920000,monthly,,
standard,"514,104","Lainnya,Jurnalis/Editor",432543,PT FOOMEE INTELLIGENCE SCIENCE,false,"Candidate must possess at least Bachelor's Degree in any field Required languange(s): Mandarin, Bahasa Indonesia At least 1 year working experience in...",full_time,3714531,false,false,Mandarin Translator,https://www.jobstreet.co.id/id/job/mandarin-translator-3714531?token=0~916255a4-270b-4461-835b-b5d737cefb1c&sectionRank=1259&jobId=jobstreet-id-job-3714531,Jakarta Utara,21 hours ago,2021-12-23T20:30:56Z,IDR,7000000,10000000,monthly,,
standard,"503,203","Penjualan / Pemasaran,Digital Marketing",436461,PT Reycom Document Solusi,false,Job Description: Making an interesting and creative design for company branding and digital marketing either online or print media. Writing content...,full_time,3714440,false,false,Digital Marketing,https://www.jobstreet.co.id/id/job/digital-marketing-3714440?token=0~916255a4-270b-4461-835b-b5d737cefb1c&sectionRank=1260&jobId=jobstreet-id-job-3714440,Jakarta Pusat,21 hours ago,2021-12-23T20:30:56Z,,,,monthly,,
