adType,categoriesCode,categoriesName,companyId,companyName,companyPrivate,description,employment,id,isClassified,isStandout,jobTitle,jobUrl,locations,postingDuration,postedAt,salarycurrency,salaryMin,salaryMax,salaryPeriod,salaryTerm,sellingPoints
auto_inclusion,"508,191","Komputer/Teknologi Informasi,IT-Perangkat Lunak",508601,Xendit,false,"Xendit provides payment infrastructure across Southeast Asia, with a focus on Indonesia and the Philippines. We process payments, power marketplaces,...",,1029755909,false,false,SEO Manager,https://www.jobstreet.co.id/id/job/seo-manager-1029755909?token=0~3c6442c2-2157-4d13-8baa-01ce76acb3dd&sectionRank=188&jobId=jobstreet-id-job-1029755909,Jakarta Raya,2 hours ago,2021-12-25T15:07:32Z,,,,monthly,,
auto_inclusion,"504,100","Seni/Media/Komunikasi,Periklanan",5263,Mindshare,false,DescriptionReporting of the roleThis role primarily reports to the Partner Connection/Client Lead or Group Director.Best things about the job: A...,,1029806206,false,false,"Mindshare | Group Head Connection Planning",https://www.jobstreet.co.id/id/job/mindshare-%7C-group-head-connection-planning-1029806206?token=0~3c6442c2-2157-4d13-8baa-01ce76acb3dd&sectionRank=189&jobId=jobstreet-id-job-1029806206,Jakarta Raya,2 hours ago,2021-12-25T15:07:23Z,,,,monthly,,
auto_inclusion,"502,137","Sumber Daya Manusia/Personalia,Sumber Daya Manusia / HR",508285,Kantar Added Value,false,"Key ResponsibilitiesAs a Strategic Insight Director, you will be responsible for leading a portfolio of client service teams to drive and achieve the...",,1029755937,false,false,Strategic Insights Director,https://www.jobstreet.co.id/id/job/strategic-insights-director-1029755937?token=0~3c6442c2-2157-4d13-8baa-01ce76acb3dd&sectionRank=190&jobId=jobstreet-id-job-1029755937,Jakarta Raya,2 hours ago,2021-12-25T15:07:15Z,,,,monthly,,
auto_inclusion,"505,138","Pelayanan,Pengacara / Asisten Legal",289980,Prudential Corporation Asia,false,"At Prudential, we understand that success comes from the talent and commitment of our people. Together, we have a shared vision in securing the future...",,1030017327,false,false,SE - Regulatory Compliance,https://www.jobstreet.co.id/id/job/se-regulatory-compliance-1030017327?token=0~3c6442c2-2157-4d13-8baa-01ce76acb3dd&sectionRank=191&jobId=jobstreet-id-job-1030017327,Jakarta Raya,2 hours ago,2021-12-25T15:06:57Z,,,,monthly,,
auto_inclusion,"505,134","Pelayanan,Layanan Pelanggan",289980,Prudential Corporation Asia,false,"At Prudential, we understand that success comes from the talent and commitment of our people. Together, we have a shared vision in securing the future...",,1030017332,false,false,SM – Head of Client Relation & Distribution Support,https://www.jobstreet.co.id/id/job/sm-head-of-client-relation-distribution-support-1030017332?token=0~3c6442c2-2157-4d13-8baa-01ce76acb3dd&sectionRank=192&jobId=jobstreet-id-job-1030017332,Jakarta Raya,2 hours ago,2021-12-25T15:06:04Z,,,,monthly,,
auto_inclusion,"503,143","Penjualan / Pemasaran,Penjualan - Teknik/Teknikal/IT",378635,Acronis,false,"SUMMARYAcronis leads the world in cyber protection - solving safety, accessibility, privacy, authenticity, and security (SAPAS) challenges with...",,1030017328,false,false,"Cloud Inside Sales, Bahasa - Indonesia",https://www.jobstreet.co.id/id/job/cloud-inside-sales-bahasa-indonesia-1030017328?token=0~3c6442c2-2157-4d13-8baa-01ce76acb3dd&sectionRank=193&jobId=jobstreet-id-job-1030017328,Jakarta Raya,2 hours ago,2021-12-25T15:05:47Z,,,,monthly,,
auto_inclusion,"503,142","Penjualan / Pemasaran,Penjualan - Korporasi",508597,Workato,false,About WorkatoWorkato is the only integration and automation platform that is as simple as it is powerful — and because it’s built to power the largest...,,1030017361,false,false,"Channel Partnerships Manager, Business Development",https://www.jobstreet.co.id/id/job/channel-partnerships-manager-business-development-1030017361?token=0~3c6442c2-2157-4d13-8baa-01ce76acb3dd&sectionRank=194&jobId=jobstreet-id-job-1030017361,Indonesia,2 hours ago,2021-12-25T15:05:37Z,,,,monthly,,
auto_inclusion,"503,139","Penjualan / Pemasaran,Pemasaran/Pengembangan Bisnis",jobstreet-id-1000024972,PT Shopback Mitra Sejahtera,false,"ABOUT USRewarding Your Everyday.ShopBack is Asia-Pacific’s leading shopping and rewards platform, serving over 30 million shoppers across our nine...",,1030017317,false,false,Partnerships Coordinator,https://www.jobstreet.co.id/id/job/partnerships-coordinator-1030017317?token=0~3c6442c2-2157-4d13-8baa-01ce76acb3dd&sectionRank=195&jobId=jobstreet-id-job-1030017317,Jakarta Raya,2 hours ago,2021-12-25T15:05:37Z,,,,monthly,,
auto_inclusion,"503,139","Penjualan / Pemasaran,Pemasaran/Pengembangan Bisnis",1040,Phillip Morris Latinoamérica,false,MAKE HISTORY WITH US! We’ve chosen to do something incredible. We’re totally transforming our business and building our future on smoke-free products...,,1030017336,false,false,Supervisor Consumer Engagement - Kotabumi,https://www.jobstreet.co.id/id/job/supervisor-consumer-engagement-kotabumi-1030017336?token=0~3c6442c2-2157-4d13-8baa-01ce76acb3dd&sectionRank=196&jobId=jobstreet-id-job-1030017336,Indonesia,2 hours ago,2021-12-25T15:05:09Z,,,,monthly,,
auto_inclusion,"501,131","Akuntansi / Keuangan,Akuntansi Umum / Pembiayaan",820,Citigroup Inc.,false,The Finance Acctg Intmd. Analyst is a developing professional role. Deals with most problems independently and has some latitude to solve complex...,,1030017302,false,false,Local Regulatory Reporting (Manager),https://www.jobstreet.co.id/id/job/local-regulatory-reporting-manager-1030017302?token=0~3c6442c2-2157-4d13-8baa-01ce76acb3dd&sectionRank=197&jobId=jobstreet-id-job-1030017302,Jakarta Raya,2 hours ago,2021-12-25T15:04:16Z,,,,monthly,,
standard,"506,107","Hotel/Restoran,Makanan/Minuman/Pelayanan Restoran",jobstreet-id-344004,MAEJIN TTEOG,false,"Kualifikasi : Jujur, disipin dan bertanggung jawab Teliti dan pekerja keras Memiliki kemampuan interpersonal yang baik Memiliki kemampuan komunikasi...",full_time,3732540,false,false,Crew Stand,https://www.jobstreet.co.id/id/job/crew-stand-3732540?token=0~3c6442c2-2157-4d13-8baa-01ce76acb3dd&sectionRank=198&jobId=jobstreet-id-job-3732540,Gresik,3 hours ago,2021-12-25T14:23:31Z,IDR,2160000,2400000,monthly,,
standout,"502,137","Sumber Daya Manusia/Personalia,Sumber Daya Manusia / HR",426674,PT Dejavu Express,false,"DEJAVU EXPRESS adalah perusahaan trucking nasional yang berkembang pesat dan penuh peluang. Kami telah melayani banyak perusahaan besar, termasuk...",full_time,3732538,false,true,HR & GA STAFF,https://www.jobstreet.co.id/id/job/hr-ga-staff-3732538?token=0~3c6442c2-2157-4d13-8baa-01ce76acb3dd&sectionRank=199&jobId=jobstreet-id-job-3732538,Bogor,3 hours ago,2021-12-25T14:01:50Z,,,,monthly,,"Kesempatan peningkatan karir,Lingkungan kerja kekeluargaan,Kesempatan menuangkan ide-ide kreatif demi pengembangan perusahaa"
standout,"514,116","Lainnya,Lainnya/Kategori tidak tersedia",jobstreet-id-9231,PT Thomasong Nirmala,false,Ø  Melakukan registrasi produk alat kesehatan impor baru dan perpanjangan/perubahan ke sistem Regalkes Online Kemenkes.Ø  Melakukan pengajuan surat...,full_time,3732536,false,true,Regulatory Officer RO Kemenkes,https://www.jobstreet.co.id/id/job/regulatory-officer-ro-kemenkes-3732536?token=0~3c6442c2-2157-4d13-8baa-01ce76acb3dd&sectionRank=200&jobId=jobstreet-id-job-3732536,Jakarta Pusat,4 hours ago,2021-12-25T13:24:02Z,,,,monthly,,"Perusahaan solid telah berdiri sejak tahun 1970,Kesejahteraan karyawan untuk BPJS terjamin,Jam kantor sesuai dengan jam kerja normal"
standout,"508,191","Komputer/Teknologi Informasi,IT-Perangkat Lunak",506861,PT SAGLOBAL INDONESIA OPERATIONS,false,"What are you looking for?If it’s a career that offers growth opportunities, an independent work environment, and a dynamic, supportive company with a...",full_time,3732534,false,true,Microsoft D365 CE & Power Platform Functional Consultant,https://www.jobstreet.co.id/id/job/microsoft-d365-ce-power-platform-functional-consultant-3732534?token=0~3c6442c2-2157-4d13-8baa-01ce76acb3dd&sectionRank=201&jobId=jobstreet-id-job-3732534,Jakarta Barat,4 hours ago,2021-12-25T13:05:04Z,,,,monthly,,"A leading global provider of Microsoft Dynamics 365 solutions,Highly experienced, collaborative, supportive, and fun team,Independent work environment with personal growth opportunities"
standout,"510,194","Manufaktur,Manufaktur",438241,PT Wanxiang Nickel Indonesia,false,"Persyaratan : Max 30 tahun Pendidikan Min. S1 segala jurusan Mandarin dan Inggris lisan dan tulisan Bertanggung jawab, jujur dan teliti Bersedia Dinas...",full_time,3732531,false,true,Staff Purchasing,https://www.jobstreet.co.id/id/job/staff-purchasing-3732531?token=0~3c6442c2-2157-4d13-8baa-01ce76acb3dd&sectionRank=202&jobId=jobstreet-id-job-3732531,Jakarta Selatan,5 hours ago,2021-12-25T12:19:44Z,,,,monthly,,"THR, Fasilitas BPJS Kesehatan dan Ketenagakerjaan"
standard,"509,189","Teknik,Teknik Lingkungan",428680,PT Tamara Overseas Corporindo,false,Kualifikasi: Usia Maksimal 30 tahun Pendidikan IT/Elektromedik/Elektronika pengalaman minimal 1 tahun di bidang yang sama Diutamakan yang mempunyai...,full_time,3732530,false,false,Teknisi Elektromedik,https://www.jobstreet.co.id/id/job/teknisi-elektromedik-3732530?token=0~3c6442c2-2157-4d13-8baa-01ce76acb3dd&sectionRank=203&jobId=jobstreet-id-job-3732530,Jakarta Barat,5 hours ago,2021-12-25T12:14:11Z,,,,monthly,,
standard,"506,107","Hotel/Restoran,Makanan/Minuman/Pelayanan Restoran",jobstreet-id-175849,Rooftop West,false,We are looking for an enthousiastic Sous-Chef or CDP to add to our kitchen team. We are an international restaurant and bar with Western and Asian...,full_time,3732526,false,false,Souschef or CDP,https://www.jobstreet.co.id/id/job/souschef-or-cdp-3732526?token=0~3c6442c2-2157-4d13-8baa-01ce76acb3dd&sectionRank=204&jobId=jobstreet-id-job-3732526,Jakarta Barat,7 hours ago,2021-12-25T10:52:12Z,,,,monthly,,
standard,"503,143","Penjualan / Pemasaran,Penjualan - Teknik/Teknikal/IT",380758,D-Link International Pte Ltd,false,"Position Overview The Pre-sales Engineer is responsible for pre-sales activities from conceptualizations, demonstrations, architecting/design,...",full_time,3732523,false,false,Technical Engineer,https://www.jobstreet.co.id/id/job/technical-engineer-3732523?token=0~3c6442c2-2157-4d13-8baa-01ce76acb3dd&sectionRank=205&jobId=jobstreet-id-job-3732523,Jakarta Raya,8 hours ago,2021-12-25T09:35:43Z,,,,monthly,,
standard,"510,194","Manufaktur,Manufaktur",451575,PT Jatim Taman Steel MFG,false,Tugas dan Tanggung Jawab Memastikan proses produksi sesuai dengan SOP/WI Melakukan kontrol terhadap ketersediaan material untuk mendukung proses...,full_time,3732522,false,false,PRODUCTION STAFF,https://www.jobstreet.co.id/id/job/production-staff-3732522?token=0~3c6442c2-2157-4d13-8baa-01ce76acb3dd&sectionRank=206&jobId=jobstreet-id-job-3732522,Sidoarjo,8 hours ago,2021-12-25T09:34:44Z,,,,monthly,,
standard,"506,107","Hotel/Restoran,Makanan/Minuman/Pelayanan Restoran",433368,PT Hiro Group Indonesia,false,Kualifikasi : Minimal latar belakang pendidikan SMA / SMK (Perhotelan dan Restoran lebih disukai) Usia maksimal 25 tahun Tinggi Min 160 cm (P) 170cm...,contract,3732521,false,false,Server/Waiter,https://www.jobstreet.co.id/id/job/server-waiter-3732521?token=0~3c6442c2-2157-4d13-8baa-01ce76acb3dd&sectionRank=207&jobId=jobstreet-id-job-3732521,Jakarta Raya,8 hours ago,2021-12-25T09:28:52Z,IDR,4000000,4500000,monthly,,
standard,"510,140","Manufaktur,Pembelian/Manajemen Material",437638,PT Team Creative Design,false,"""URGENT""Dibutuhkan Segera dan langsung Siap Kerja dalam waktu singkat Perusahaan Advertising di Kelapa Gading , jakarta Utara membutuhkan "" PURCHASING...",full_time,3732520,false,false,Purchasing Officer,https://www.jobstreet.co.id/id/job/purchasing-officer-3732520?token=0~3c6442c2-2157-4d13-8baa-01ce76acb3dd&sectionRank=208&jobId=jobstreet-id-job-3732520,Jakarta Utara,8 hours ago,2021-12-25T09:24:00Z,IDR,3500000,5500000,monthly,,
standout,"510,140","Manufaktur,Pembelian/Manajemen Material",427099,PT HOFZ INDONESIA,false,HOFZ is a leading design and manufacturing company in the field of specialized driveline systems for high mobility vehicles. Our products have been...,full_time,3732519,false,true,Warehouse Supervisor,https://www.jobstreet.co.id/id/job/warehouse-supervisor-3732519?token=0~3c6442c2-2157-4d13-8baa-01ce76acb3dd&sectionRank=209&jobId=jobstreet-id-job-3732519,Cikarang,8 hours ago,2021-12-25T09:12:43Z,,,,monthly,,
standout,"513,111","Layanan Kesehatan,Praktisi/Asisten Medis",438603,ZAP Clinic (PT. Zulu Alpha Papa),false,ZAP Clinic sedang membuka lowongan untuk posisi Perawat  penempatan Tasikmalaya.Kami mencari talent berbakat untuk join dalam team medical ZAP...,contract,3732515,false,true,Perawat (Penempatan  Tasikmalaya),https://www.jobstreet.co.id/id/job/perawat-penempatan-tasikmalaya-3732515?token=0~3c6442c2-2157-4d13-8baa-01ce76acb3dd&sectionRank=210&jobId=jobstreet-id-job-3732515,Tasikmalaya,9 hours ago,2021-12-25T08:14:20Z,,,,monthly,,"Best Benefits, Work Life Balance,Work with Culture"
standard,"506,107","Hotel/Restoran,Makanan/Minuman/Pelayanan Restoran",430054,PT Mega Mahadana Hadiya,false,"Deskripsi pekerjaan: Menyajikan seluruh produk secara akurat, sesuai standard waktu yang telah ditentukan Menjalankan program Excellent Service...",part_time,3732514,false,false,Crew Part Time Restaurant (WINGSTOP & CARLS JR)-BEKASI JATIASIH,https://www.jobstreet.co.id/id/job/crew-part-time-restaurant-wingstop-carls-jr-bekasi-jatiasih-3732514?token=0~90caf8b0-1d17-4c06-a809-941cce7ca635&sectionRank=211&jobId=jobstreet-id-job-3732514,"Bekasi,Bogor,Cikarang,Jakarta Timur",10 hours ago,2021-12-25T07:50:01Z,,,,monthly,,
standout,"503,202","Penjualan / Pemasaran,E-commerce",jobstreet-id-207416,PT Kivee International Trade,false,Mohon membaca sebelum ApplySpesifikasi: membutuhkan konten creator handal yang berpengalaman dapat bekerja dalam tim dapat berkerja di bawah tekanan...,full_time,3732513,false,true,Konten Creator Live Stream & Admin E-commerce,https://www.jobstreet.co.id/id/job/konten-creator-live-stream-admin-e-commerce-3732513?token=0~90caf8b0-1d17-4c06-a809-941cce7ca635&sectionRank=212&jobId=jobstreet-id-job-3732513,Jakarta Pusat,10 hours ago,2021-12-25T07:46:14Z,IDR,4500000,6300000,monthly,,
standard,"508,193","Komputer/Teknologi Informasi,IT-Admin Jaringan/Sistem/Database",414113,"PT. Metrodata Electronics, Tbk",false,Qualification: 2 years of working experience in the related is required Have excellent knowledge &amp; experience on Oracle Dba/Oracle PostgreSql on...,contract,3732511,false,false,DBA Oracle,https://www.jobstreet.co.id/id/job/dba-oracle-3732511?token=0~90caf8b0-1d17-4c06-a809-941cce7ca635&sectionRank=213&jobId=jobstreet-id-job-3732511,Tangerang,10 hours ago,2021-12-25T07:21:06Z,,,,monthly,,
standard,"503,139","Penjualan / Pemasaran,Pemasaran/Pengembangan Bisnis",433716,PT Infomedia Solusi Humanika,false,Digital Channel Expert Kualifikasi : Usia maksimal 30 tahun Pendidikan minimal S1 semua jurusan Memiliki pengalaman dibidang digital marketing /...,full_time,3732510,false,false,Digital Channel Expert (Area Makassar),https://www.jobstreet.co.id/id/job/digital-channel-expert-area-makassar-3732510?token=0~90caf8b0-1d17-4c06-a809-941cce7ca635&sectionRank=214&jobId=jobstreet-id-job-3732510,Makassar,10 hours ago,2021-12-25T07:20:37Z,IDR,3200000,4160000,monthly,,
standard,"505,152","Pelayanan,Teknikal & Bantuan Pelanggan",433716,PT Infomedia Solusi Humanika,false,Engineering on Site (EOS) Kualifikasi : Belum menikah Usia maksimal 28 tahun Pendidikan minimal D3 jurusan Sistem Informasi / Teknik Informatika /...,full_time,3732509,false,false,Engineering on Site (EOS) - Area Jakarta,https://www.jobstreet.co.id/id/job/engineering-on-site-eos-area-jakarta-3732509?token=0~90caf8b0-1d17-4c06-a809-941cce7ca635&sectionRank=215&jobId=jobstreet-id-job-3732509,Jakarta Raya,10 hours ago,2021-12-25T07:08:51Z,IDR,4400000,5720000,monthly,,
standard,"506,107","Hotel/Restoran,Makanan/Minuman/Pelayanan Restoran",jobstreet-id-343367,KooD Restaurant,false,Persyaratan : Memiliki pengalaman di bidang Baking (5 tahun) Memiliki pengalaman sebagai Supervisor (2th) Memiliki pengalaman di bidang memasak/...,full_time,3732505,false,false,Senior Baker,https://www.jobstreet.co.id/id/job/senior-baker-3732505?token=0~90caf8b0-1d17-4c06-a809-941cce7ca635&sectionRank=216&jobId=jobstreet-id-job-3732505,Denpasar,11 hours ago,2021-12-25T06:42:48Z,IDR,4500000,4800000,monthly,,
standard,"503,203","Penjualan / Pemasaran,Digital Marketing",430094,ACT Foundation,false,"Tugas dan Tanggung Jawab: Membuat surat dan proposal penawaran kemitraan kepada calon mitra personal, komunitas dan perusahaan/instansi; Membuat list...",full_time,3732500,false,false,MARKETING COMMUNICATION CABANG BELITUNG - TANJUNG PANDAN,https://www.jobstreet.co.id/id/job/marketing-communication-cabang-belitung-tanjung-pandan-3732500?token=0~90caf8b0-1d17-4c06-a809-941cce7ca635&sectionRank=217&jobId=jobstreet-id-job-3732500,Belitung,11 hours ago,2021-12-25T06:03:26Z,,,,monthly,,
standard,"503,203","Penjualan / Pemasaran,Digital Marketing",430094,ACT Foundation,false,"Deskripsi PekerjaanTugas dan Tanggung Jawab: Membuat surat dan proposal penawaran kemitraan kepada calon mitra personal, komunitas dan...",full_time,3732499,false,false,MARKETING COMMUNICATION CABANG PALEMBANG,https://www.jobstreet.co.id/id/job/marketing-communication-cabang-palembang-3732499?token=0~90caf8b0-1d17-4c06-a809-941cce7ca635&sectionRank=218&jobId=jobstreet-id-job-3732499,Palembang,12 hours ago,2021-12-25T05:57:44Z,,,,monthly,,
standout,"511,184","Bangunan/Konstruksi,Teknik Sipil/Konstruksi Bangunan",431597,PT Cipta Baja Trimatra,false,"Tugas dan Tanggung Jawab : Usia minimal 35 tahun, Pendidikan minimal S1 Teknik Sipil, Pengalaman minimal 5 tahun sebagai Site Manager di Proyek...",full_time,3732498,false,true,SITE MANAGER,https://www.jobstreet.co.id/id/job/site-manager-3732498?token=0~90caf8b0-1d17-4c06-a809-941cce7ca635&sectionRank=219&jobId=jobstreet-id-job-3732498,Cikarang,12 hours ago,2021-12-25T05:56:34Z,,,,monthly,,
standard,"503,203","Penjualan / Pemasaran,Digital Marketing",430094,ACT Foundation,false,"Tugas dan Tanggung Jawab: Membuat surat dan proposal penawaran kemitraan kepada calon mitra personal, komunitas dan perusahaan/instansi; Membuat list...",full_time,3732497,false,false,MARKETING COMMUNICATION CABANG SOLOK,https://www.jobstreet.co.id/id/job/marketing-communication-cabang-solok-3732497?token=0~90caf8b0-1d17-4c06-a809-941cce7ca635&sectionRank=220&jobId=jobstreet-id-job-3732497,Sumatera Barat,12 hours ago,2021-12-25T05:54:23Z,,,,monthly,,
standard,"511,184","Bangunan/Konstruksi,Teknik Sipil/Konstruksi Bangunan",451934,yuni bersaudara sejahtera,false,Staff Engineering Pabrik Kelapa SawitSyarat: Menguasai teknik perhitungan design pabrik kelapa sawit Memiliki pengalaman mendesign bagian maupun...,contract,3732496,false,false,Engineering Pabrik Kelapa Sawit,https://www.jobstreet.co.id/id/job/engineering-pabrik-kelapa-sawit-3732496?token=0~90caf8b0-1d17-4c06-a809-941cce7ca635&sectionRank=221&jobId=jobstreet-id-job-3732496,Pekanbaru,12 hours ago,2021-12-25T05:44:45Z,IDR,6000000,10000000,monthly,,
standard,"503,203","Penjualan / Pemasaran,Digital Marketing",430094,ACT Foundation,false,"Deskripsi PekerjaanTugas dan Tanggung Jawab: Membuat surat dan proposal penawaran kemitraan kepada calon mitra personal, komunitas dan...",full_time,3732495,false,false,MARKETING COMMUNICATION CABANG BALI,https://www.jobstreet.co.id/id/job/marketing-communication-cabang-bali-3732495?token=0~90caf8b0-1d17-4c06-a809-941cce7ca635&sectionRank=222&jobId=jobstreet-id-job-3732495,Denpasar,12 hours ago,2021-12-25T05:44:38Z,,,,monthly,,
standard,"502,137","Sumber Daya Manusia/Personalia,Sumber Daya Manusia / HR",451934,yuni bersaudara sejahtera,false,Dibutuhkan Supervisor HRD untuk bergabung dengan tim kami.Syarat: Pengalaman minimal 2 tahun di level supervisor Memiliki pengalaman pada posisi...,full_time,3732493,false,false,Human Resource Supervisor,https://www.jobstreet.co.id/id/job/human-resource-supervisor-3732493?token=0~90caf8b0-1d17-4c06-a809-941cce7ca635&sectionRank=223&jobId=jobstreet-id-job-3732493,Riau,13 hours ago,2021-12-25T04:55:56Z,,,,monthly,,
standard,"503,203","Penjualan / Pemasaran,Digital Marketing",430094,ACT Foundation,false,"Deskripsi PekerjaanTugas dan Tanggung Jawab: Membuat surat dan proposal penawaran kemitraan kepada calon mitra personal, komunitas dan...",full_time,3732492,false,false,MARKETING COMMUNICATION CABANG SURABAYA,https://www.jobstreet.co.id/id/job/marketing-communication-cabang-surabaya-3732492?token=0~90caf8b0-1d17-4c06-a809-941cce7ca635&sectionRank=224&jobId=jobstreet-id-job-3732492,Surabaya,13 hours ago,2021-12-25T04:55:47Z,,,,monthly,,
standard,"503,203","Penjualan / Pemasaran,Digital Marketing",430094,ACT Foundation,false,"Deskripsi PekerjaanTugas dan Tanggung Jawab: Membuat surat dan proposal penawaran kemitraan kepada calon mitra personal, komunitas dan...",full_time,3732491,false,false,MARKETING COMMUNICATION CABANG TEGAL,https://www.jobstreet.co.id/id/job/marketing-communication-cabang-tegal-3732491?token=0~90caf8b0-1d17-4c06-a809-941cce7ca635&sectionRank=225&jobId=jobstreet-id-job-3732491,Tegal,13 hours ago,2021-12-25T04:52:51Z,,,,monthly,,
standard,"503,203","Penjualan / Pemasaran,Digital Marketing",430094,ACT Foundation,false,"Deskripsi PekerjaanTugas dan Tanggung Jawab: Membuat surat dan proposal penawaran kemitraan kepada calon mitra personal, komunitas dan...",full_time,3732489,false,false,MARKETING COMMUNICATION CABANG TANGERANG SELATAN,https://www.jobstreet.co.id/id/job/marketing-communication-cabang-tangerang-selatan-3732489?token=0~90caf8b0-1d17-4c06-a809-941cce7ca635&sectionRank=226&jobId=jobstreet-id-job-3732489,Tangerang,13 hours ago,2021-12-25T04:39:39Z,,,,monthly,,
standout,"503,139","Penjualan / Pemasaran,Pemasaran/Pengembangan Bisnis",,,true,Responsibilities Develop sales and marketing strategy to meet management goals. Ensure that the projected sales unit is under reviewed periodically...,full_time,3732488,false,true,Marketing,https://www.jobstreet.co.id/id/job/marketing-3732488?token=0~90caf8b0-1d17-4c06-a809-941cce7ca635&sectionRank=227&jobId=jobstreet-id-job-3732488,Pekanbaru,13 hours ago,2021-12-25T04:39:08Z,IDR,5000000,7000000,monthly,,
standout,"503,203","Penjualan / Pemasaran,Digital Marketing",,,true,Responsibilities: Managing and developing digital marketing for all company products &amp; services Build and develop social media strategies to be...,full_time,3732487,false,true,Digital Marketing,https://www.jobstreet.co.id/id/job/digital-marketing-3732487?token=0~90caf8b0-1d17-4c06-a809-941cce7ca635&sectionRank=228&jobId=jobstreet-id-job-3732487,Jakarta Raya,13 hours ago,2021-12-25T04:37:39Z,IDR,5000000,7000000,monthly,,
standard,"506,107","Hotel/Restoran,Makanan/Minuman/Pelayanan Restoran",433368,PT Hiro Group Indonesia,false,Requirements : Max age 30 - 32 years old High school diploma or Hospitality/FnB background Must have experience work as Italian Cuisine's Cook Willing...,full_time,3732486,false,false,Commis Pizza and Grill,https://www.jobstreet.co.id/id/job/commis-pizza-and-grill-3732486?token=0~90caf8b0-1d17-4c06-a809-941cce7ca635&sectionRank=229&jobId=jobstreet-id-job-3732486,Jakarta Utara,13 hours ago,2021-12-25T04:30:15Z,IDR,4000000,4500000,monthly,,
standard,"503,203","Penjualan / Pemasaran,Digital Marketing",430094,ACT Foundation,false,"Deskripsi PekerjaanTugas dan Tanggung Jawab: Membuat surat dan proposal penawaran kemitraan kepada calon mitra personal, komunitas dan...",full_time,3732484,false,false,MARKETING COMMUNICATION CABANG MANOKWARI,https://www.jobstreet.co.id/id/job/marketing-communication-cabang-manokwari-3732484?token=0~90caf8b0-1d17-4c06-a809-941cce7ca635&sectionRank=230&jobId=jobstreet-id-job-3732484,Manokwari,14 hours ago,2021-12-25T03:46:04Z,,,,monthly,,
standard,"507,121","Pendidikan/Pelatihan,Pelatihan & Pengembangan",427250,PT. INTI BERKAT JAYA,false,Job Responsibility Membuat product knowledge &amp; memastikan seluruh karyawan dapat memahaminya. Job Requirements Maksimal 35 tahun Minimal S1 segala...,full_time,3732483,false,false,Product Specialist,https://www.jobstreet.co.id/id/job/product-specialist-3732483?token=0~90caf8b0-1d17-4c06-a809-941cce7ca635&sectionRank=231&jobId=jobstreet-id-job-3732483,Jakarta Utara,14 hours ago,2021-12-25T03:40:56Z,,,,monthly,,
standard,"503,151","Penjualan / Pemasaran,Telesales/Telemarketing",430094,ACT Foundation,false,"Tugas dan Tanggung Jawab : Melakukan asesmen dan membuat laporan potensi wilayah sebagai dasar penentuan segmentasi marketing, program yang mungkin...",full_time,3732482,false,false,PARTNERSHIP CABANG MANOKWARI,https://www.jobstreet.co.id/id/job/partnership-cabang-manokwari-3732482?token=0~90caf8b0-1d17-4c06-a809-941cce7ca635&sectionRank=232&jobId=jobstreet-id-job-3732482,Manokwari,14 hours ago,2021-12-25T03:40:56Z,,,,monthly,,
standard,"503,139","Penjualan / Pemasaran,Pemasaran/Pengembangan Bisnis",430094,ACT Foundation,false,"Tugas dan Tanggung Jawab:1. Melakukan perencanaan, pengelolaan, monitoring dan evaluasi fungsi pencapaian fundraising cabang dengan detil sebagai...",full_time,3732481,false,false,BRANCH MANAGER MANOKWARI,https://www.jobstreet.co.id/id/job/branch-manager-manokwari-3732481?token=0~90caf8b0-1d17-4c06-a809-941cce7ca635&sectionRank=233&jobId=jobstreet-id-job-3732481,Manokwari,14 hours ago,2021-12-25T03:17:02Z,,,,monthly,,
