adType,categoriesCode,categoriesName,companyId,companyName,companyPrivate,description,employment,id,isClassified,isStandout,jobTitle,jobUrl,locations,postingDuration,postedAt,salarycurrency,salaryMin,salaryMax,salaryPeriod,salaryTerm,sellingPoints
standard,"506,107","Hotel/Restoran,Makanan/Minuman/Pelayanan Restoran",jobstreet-id-342784,CheTea,false,"CheTea, merupakan badan usaha yang bergerak dalam bidang Food and Beverage. Saat ini sedang membutuhkan kandidat untuk bergabung dan berkembang...",full_time,3727327,false,false,Crew Outlet,https://www.jobstreet.co.id/id/job/crew-outlet-3727327?token=0~7e32dde7-8ac1-4e77-b79f-bdf07d298279&sectionRank=371&jobId=jobstreet-id-job-3727327,Makassar,5 hours ago,2021-12-20T10:43:29Z,,,,monthly,,
standout,"514,116","Lainnya,Lainnya/Kategori tidak tersedia",436090,Pradipta Paramita,false,Kualifikasi:-Lulusan Sarjana di Fakultas/ Jurusan MIPA/Biologi/ Mikrobiologi/Kimia/Teknobiologi/Bioscience-Fresh graduate/ berpengalaman usia maksimal...,full_time,3727326,false,true,Supervisor Development Program Laboratorium,https://www.jobstreet.co.id/id/job/supervisor-development-program-laboratorium-3727326?token=0~7e32dde7-8ac1-4e77-b79f-bdf07d298279&sectionRank=372&jobId=jobstreet-id-job-3727326,Jawa Tengah,5 hours ago,2021-12-20T10:41:51Z,,,,monthly,,"Snack pagi & Makan Siang,BPJS Ketenagakerjaan & Kesehatan"
standard,"509,187","Teknik,Teknik Elektro",434401,PT Korosi Specindo,false,"Deskripsi Pekerjaan Mengembangkan embedded System berbasis ARM Mengembangkan penggunaan embedded OS FreeRTOS, ChibiOS atau sejenisnya Mengembangkan...",full_time,3727325,false,false,R&D Senior Engineer,https://www.jobstreet.co.id/id/job/r-d-senior-engineer-3727325?token=0~7e32dde7-8ac1-4e77-b79f-bdf07d298279&sectionRank=373&jobId=jobstreet-id-job-3727325,Jakarta Pusat,6 hours ago,2021-12-20T10:41:28Z,,,,monthly,,
standard,"508,191","Komputer/Teknologi Informasi,IT-Perangkat Lunak",413752,PT Bali Towerindo Sentra Tbk,false,"Responsibilities : Solving Problem Module Financial and Distribution as due date in helpdesk application (Monitoring Helpdesk) Create Solution,...",full_time,3727323,false,false,IT Functional EBS Oracle,https://www.jobstreet.co.id/id/job/it-functional-ebs-oracle-3727323?token=0~7e32dde7-8ac1-4e77-b79f-bdf07d298279&sectionRank=374&jobId=jobstreet-id-job-3727323,Jakarta Pusat,6 hours ago,2021-12-20T10:40:39Z,,,,monthly,,
standard,"503,145","Penjualan / Pemasaran,Penjualan Ritel",jobstreet-id-342760,PT Aurora Indah Elektrik,false,Kualifikasi: Pendidikan SMA/D3 Usia maksimal 30 tahun Berpengalaman minimal 1 tahun sebagai Sales Executive Terbiasa dengan target harian dan bulanan...,full_time,3727322,false,false,SALES EXECUTIVE,https://www.jobstreet.co.id/id/job/sales-executive-3727322?token=0~7e32dde7-8ac1-4e77-b79f-bdf07d298279&sectionRank=375&jobId=jobstreet-id-job-3727322,Surabaya,6 hours ago,2021-12-20T10:39:18Z,,,,monthly,,
standard,"509,185","Teknik,Teknik Kimia",451902,PT.  Universal Eco Pasific,false,Requirement : Min Lulusan D3 Kimia/Teknik Kimia/Teknik Lingkungan Diutamakan pernah SMK analis dan bekerja di laboratorium lingkungan Setidaknya...,contract,3727321,false,false,Penyelia Laboratorium Lingkungan,https://www.jobstreet.co.id/id/job/penyelia-laboratorium-lingkungan-3727321?token=0~7e32dde7-8ac1-4e77-b79f-bdf07d298279&sectionRank=376&jobId=jobstreet-id-job-3727321,Serang,6 hours ago,2021-12-20T10:38:57Z,,,,monthly,,
standout,"501,131","Akuntansi / Keuangan,Akuntansi Umum / Pembiayaan",jobstreet-id-280006,Mesin Mineral Indonesia,false,*Jurusan akuntansi atau keuangan* Memiliki pengetahuan profesional tentang keuangan yang kuat* Mahir menggunakan perangkat lunak keuangan Acc dan...,full_time,3727320,false,true,Accounting,https://www.jobstreet.co.id/id/job/accounting-3727320?token=0~7e32dde7-8ac1-4e77-b79f-bdf07d298279&sectionRank=377&jobId=jobstreet-id-job-3727320,Jakarta Raya,6 hours ago,2021-12-20T10:38:43Z,IDR,5000000,10000000,monthly,,
standard,"503,145","Penjualan / Pemasaran,Penjualan Ritel",jobstreet-id-342663,PT Biostar Indomakmur Abadi,false,PT. BIOSTAR INDOMAKMUR ABADI merupakan salah satu perusahaan yang menjual bahan kimia teksil dibandung sedang membutuhkan Sales Marketing yang ingin...,full_time,3727319,false,false,SALES MARKETING KIMIA,https://www.jobstreet.co.id/id/job/sales-marketing-kimia-3727319?token=0~7e32dde7-8ac1-4e77-b79f-bdf07d298279&sectionRank=378&jobId=jobstreet-id-job-3727319,Jawa Barat,6 hours ago,2021-12-20T10:38:23Z,,,,monthly,,
standout,"503,144","Penjualan / Pemasaran,Penjualan - Jasa Keuangan",433382,PT Home Credit Indonesia,false,Tugas: Menawarkan produk pembayaran Home Credit Indonesia di Toko Mempromosikan produk pembiayaan HCI melalui Sosial Media Melayani dan memandu...,full_time,3727318,false,true,Sales Counter (SPG/SPB) area Tangerang Selatan,https://www.jobstreet.co.id/id/job/sales-counter-spg-spb-area-tangerang-selatan-3727318?token=0~7e32dde7-8ac1-4e77-b79f-bdf07d298279&sectionRank=379&jobId=jobstreet-id-job-3727318,Banten,6 hours ago,2021-12-20T10:36:45Z,,,,monthly,,"Jenjang Karir,Bonus Tidak Terbatas,Pelatihan dan Pengembangan Diri"
standout,"509,195","Teknik,Mekanikal",507206,Chifeng LXML,false,"Chifeng Gold’s Lane Xang Minerals Limited (LXML) operates the Sepon Gold and Copper Operation, located in Vilabouly District, Savannakhet Province,...",contract,4769973,false,true,Technical Advisor - Maintenance Planning,https://www.jobstreet.co.id/id/job/technical-advisor-maintenance-planning-4769973/origin/my?token=0~7e32dde7-8ac1-4e77-b79f-bdf07d298279&sectionRank=380&jobId=jobstreet-my-job-4769973,Savannakhet Province,6 hours ago,2021-12-20T10:36:44Z,,,,monthly,,
standard,"513,113","Layanan Kesehatan,Diagnosa/Lainnya",432797,PT Gold Coin Indonesia,false,Job Responsibilities: Directly report to Veterinary Health Care Assistant Manager. This position will support company business on poultry disease...,full_time,3727317,false,false,Field Service Veterinarian / Dokter Hewan (Palembang & Lampung),https://www.jobstreet.co.id/id/job/field-service-veterinarian-dokter-hewan-palembang-lampung-3727317?token=0~7e32dde7-8ac1-4e77-b79f-bdf07d298279&sectionRank=381&jobId=jobstreet-id-job-3727317,Palembang,6 hours ago,2021-12-20T10:36:43Z,,,,monthly,,
standard,"513,113","Layanan Kesehatan,Diagnosa/Lainnya",414082,"PT Malindo Feedmill,Tbk",false,Kualifikasi : Pendidikan Program Profesi Dokter Hewan (PPDH) Fresh Graduate / pengalaman 1 tahun Memiliki pengetahuan terkait penyakit Ayam dan...,full_time,3727316,false,false,Veterinary,https://www.jobstreet.co.id/id/job/veterinary-3727316?token=0~7e32dde7-8ac1-4e77-b79f-bdf07d298279&sectionRank=382&jobId=jobstreet-id-job-3727316,"Jawa Tengah,Makassar,Pontianak",6 hours ago,2021-12-20T10:36:26Z,,,,monthly,,
standard,"509,186","Teknik,Teknik Elektronika",jobstreet-id-342557,ATKOMINDO,false,Persyaratan Utama: Minimal Pendidikan SLTA/Sederajat Memiliki Pengalaman kerja di bidang telekomuniasi IP PBX Memahami dengan baik sistem IP PBX...,full_time,3727314,false,false,Engineer,https://www.jobstreet.co.id/id/job/engineer-3727314?token=0~7e32dde7-8ac1-4e77-b79f-bdf07d298279&sectionRank=383&jobId=jobstreet-id-job-3727314,"Depok,Jakarta Pusat",6 hours ago,2021-12-20T10:35:54Z,IDR,5330000,8330000,monthly,,
standard,"504,101","Seni/Media/Komunikasi,Seni / Desain Kreatif",jobstreet-id-342680,IMANDA GEMILANG DIGITAL PRINTING,false,Kualifikasi :1. Minimal lulusan SMA / SMK atau sederajat2. Usia 20 - 28 tahun3. Memiliki sepeda motor pribadi4. Menguasai CorelDraw (WAJIB)5....,full_time,3727313,false,false,Crew Imanda Gemilang DIgital Printing,https://www.jobstreet.co.id/id/job/crew-imanda-gemilang-digital-printing-3727313?token=0~7e32dde7-8ac1-4e77-b79f-bdf07d298279&sectionRank=384&jobId=jobstreet-id-job-3727313,Jember,6 hours ago,2021-12-20T10:35:42Z,,,,monthly,,
standout,"503,203","Penjualan / Pemasaran,Digital Marketing",jobstreet-id-75336,PT Dami Sariwana (Jakarta),false,DIGITAL MARKETING SPECIALIST  Job Description Bertanggung jawab terhadap optimalisasi beberapa Akun Website atau Marketplace. Melakukan posting...,full_time,3727312,false,true,Digital Marketing Specialist,https://www.jobstreet.co.id/id/job/digital-marketing-specialist-3727312?token=0~7e32dde7-8ac1-4e77-b79f-bdf07d298279&sectionRank=385&jobId=jobstreet-id-job-3727312,Banten,6 hours ago,2021-12-20T10:35:34Z,IDR,5000000,7000000,monthly,,"Bonus Pencapaian Target,THR,5 Hari Kerja"
standout,"508,193","Komputer/Teknologi Informasi,IT-Admin Jaringan/Sistem/Database",519681,PT Sharing Vision Indonesia,false,PT Sharing Vision Indonesia masih membutuhkan beberapa orang minimal S1/D4/S2 dari Teknik Informatika/Sistem Teknologi Informasi/Teknik Elektro/Teknik...,full_time,3727311,false,true,Data Engineer,https://www.jobstreet.co.id/id/job/data-engineer-3727311?token=0~7e32dde7-8ac1-4e77-b79f-bdf07d298279&sectionRank=386&jobId=jobstreet-id-job-3727311,Jakarta Raya,6 hours ago,2021-12-20T10:34:20Z,IDR,8000000,12000000,monthly,,
standard,"503,142","Penjualan / Pemasaran,Penjualan - Korporasi",447720,RGF HR Agent Indonesia,false,"About The Company: The working venue is in Tangerang. Our client is a Japanese property company. Currently, they are looking for Sales &amp; Promotion...",full_time,3727296,false,false,Sales & Promotion Assistant Manager - Property - Tangerang (B-66393),https://www.jobstreet.co.id/id/job/sales-promotion-assistant-manager-property-tangerang-b-66393-3727296?token=0~7e32dde7-8ac1-4e77-b79f-bdf07d298279&sectionRank=387&jobId=jobstreet-id-job-3727296,Tangerang,6 hours ago,2021-12-20T10:33:42Z,IDR,15000000,25000000,monthly,,
standard,"513,113","Layanan Kesehatan,Diagnosa/Lainnya",414082,"PT Malindo Feedmill,Tbk",false,Kualifikasi :  Pendidikan Program Profesi Dokter Hewan (PPDH) Memiliki pengalaman minimal 5 - 10 tahun dengan ruang lingkup kerja yang sama (lebih...,full_time,3727310,false,false,Assistant Manager Veterinary,https://www.jobstreet.co.id/id/job/assistant-manager-veterinary-3727310?token=0~7e32dde7-8ac1-4e77-b79f-bdf07d298279&sectionRank=388&jobId=jobstreet-id-job-3727310,Jawa Barat,6 hours ago,2021-12-20T10:33:41Z,,,,monthly,,
standout,"503,145","Penjualan / Pemasaran,Penjualan Ritel",jobstreet-id-194109,DV MEDIKA,false,Tugas &amp; tanggung jawab: melakukan penawaran dan penjualan produk alat kesehatan Barang Habis Pakai (BHP) sesuai target yang telah ditentukan...,full_time,3727308,false,true,Sales Representative (BHP),https://www.jobstreet.co.id/id/job/sales-representative-bhp-3727308?token=0~7e32dde7-8ac1-4e77-b79f-bdf07d298279&sectionRank=389&jobId=jobstreet-id-job-3727308,Lombok,6 hours ago,2021-12-20T10:33:21Z,,,,monthly,,"Competitive salary & benefit,Sales Incentive"
standard,"508,191","Komputer/Teknologi Informasi,IT-Perangkat Lunak",jobstreet-id-342727,PT Pasar Segar Indonesia,false,Pasar Segar is a Indonesia Marketplace which is looking for an experienced Web developer / designer for our office in West Jakarta. Candidates should...,full_time,3727307,false,false,Web App Developer,https://www.jobstreet.co.id/id/job/web-app-developer-3727307?token=0~7e32dde7-8ac1-4e77-b79f-bdf07d298279&sectionRank=390&jobId=jobstreet-id-job-3727307,Jakarta Barat,6 hours ago,2021-12-20T10:33:02Z,IDR,7000000,10000000,monthly,,
standard,"509,189","Teknik,Teknik Lingkungan",432599,PT Future Pipe Industries,false,"Job Purpose :Develop and maintain the Company’s Quality Assurance, Environment Health and Safety, and Quality Control Management Systems and ensure...",full_time,3727306,false,false,QHSE Manager,https://www.jobstreet.co.id/id/job/qhse-manager-3727306?token=0~496b6ef3-96a9-44aa-b177-845b5390b651&sectionRank=391&jobId=jobstreet-id-job-3727306,Tangerang,6 hours ago,2021-12-20T10:31:55Z,,,,monthly,,
standout,"502,133","Sumber Daya Manusia/Personalia,Staf / Administrasi umum",427430,Kay Collection,false,• Pendidikan minimal SMU/SMK• Lebih diutamakan yg memiliki pengalaman di bidang administrasi• Mampu mengoperasikan komputer &amp; menguasai program...,full_time,3727305,false,true,Admin Operasional,https://www.jobstreet.co.id/id/job/admin-operasional-3727305?token=0~496b6ef3-96a9-44aa-b177-845b5390b651&sectionRank=392&jobId=jobstreet-id-job-3727305,Jakarta Barat,6 hours ago,2021-12-20T10:30:40Z,IDR,3500000,4000000,monthly,,
standout,"503,144","Penjualan / Pemasaran,Penjualan - Jasa Keuangan",433382,PT Home Credit Indonesia,false,Tugas: Menawarkan produk pembayaran Home Credit Indonesia di Toko Mempromosikan produk pembiayaan HCI melalui Sosial Media Melayani dan memandu...,full_time,3727304,false,true,Sales Counter (SPG/SPB) area Tangerang,https://www.jobstreet.co.id/id/job/sales-counter-spg-spb-area-tangerang-3727304?token=0~496b6ef3-96a9-44aa-b177-845b5390b651&sectionRank=393&jobId=jobstreet-id-job-3727304,Banten,6 hours ago,2021-12-20T10:30:04Z,,,,monthly,,"Jenjang Karir,Bonus Tidak Terbatas,Pelatihan dan Pengembangan Diri"
standard,"503,145","Penjualan / Pemasaran,Penjualan Ritel",jobstreet-id-1065,PT Lentera Dunia,false,Deskripsi Pekerjaan: Melakukan kunjungan ke toko-toko sesuai rute yang telah ditentukan hingga area berhasil ter-cover. Menawarkan barang ke toko-toko...,full_time,3727303,false,false,Sales Executive,https://www.jobstreet.co.id/id/job/sales-executive-3727303?token=0~496b6ef3-96a9-44aa-b177-845b5390b651&sectionRank=394&jobId=jobstreet-id-job-3727303,Bekasi,6 hours ago,2021-12-20T10:29:06Z,IDR,4000000,4500000,monthly,,
standard,"502,146","Sumber Daya Manusia/Personalia,Sekretaris",414230,"PT Puradelta Lestari, Tbk",false,"Job Descriptions : Respond to calls, emails, and routine letters; direct inquiries to the appropriate person Manage schedules &amp; Calenders;...",full_time,3724878,false,false,Secretary Director,https://www.jobstreet.co.id/id/job/secretary-director-3724878?token=0~496b6ef3-96a9-44aa-b177-845b5390b651&sectionRank=395&jobId=jobstreet-id-job-3724878,Bekasi,6 hours ago,2021-12-20T10:27:54Z,IDR,5500000,6500000,monthly,,
standard,"505,147","Pelayanan,Logistik/Rantai Pasokan",jobstreet-id-342791,J&T Express Maesan,false,Kualifikasi : Usia maksimal 29 tahun Pendidikan minimal SMA Sederajat Memiliki HP Android minimal RAM 2 GB Siap bekerja dibawah tekanan Siap bekerja...,full_time,3727302,false,false,Kurir,https://www.jobstreet.co.id/id/job/kurir-3727302?token=0~496b6ef3-96a9-44aa-b177-845b5390b651&sectionRank=396&jobId=jobstreet-id-job-3727302,Jawa Timur,6 hours ago,2021-12-20T10:27:05Z,,,,monthly,,
standout,"504,100","Seni/Media/Komunikasi,Periklanan",437184,PT Solusi Manajemen Artistika Konsultan,false,Kualifikasi:• Memiliki setidaknya 1 tahun pengalaman dalam operasi teknis atau bidang terkait.• Memiliki pengetahuan tentang OBS (Open Broadcaster...,contract,3727301,false,true,Event Live Streaming,https://www.jobstreet.co.id/id/job/event-live-streaming-3727301?token=0~496b6ef3-96a9-44aa-b177-845b5390b651&sectionRank=397&jobId=jobstreet-id-job-3727301,Depok,6 hours ago,2021-12-20T10:26:50Z,,,,monthly,,
standout,"503,142","Penjualan / Pemasaran,Penjualan - Korporasi",426936,PT Geget Gigit,false,"Requirements: Bachelor’s degree in marketing, business, or related field. Minimum 3 years of working experience in handling events, multimedia, from...",full_time,3727300,false,true,Sales and Marketing Event,https://www.jobstreet.co.id/id/job/sales-and-marketing-event-3727300?token=0~496b6ef3-96a9-44aa-b177-845b5390b651&sectionRank=398&jobId=jobstreet-id-job-3727300,Jakarta Selatan,6 hours ago,2021-12-20T10:26:35Z,,,,monthly,,
standard,"503,143","Penjualan / Pemasaran,Penjualan - Teknik/Teknikal/IT",434625,PT. Lintas Teknologi Indonesia,false,PT. Lintas Teknologi Indonesia - Account Manager  Job Description: Responsible for sales activity both product and services in Indonesia. The...,full_time,3727299,false,false,Telco Account Manager,https://www.jobstreet.co.id/id/job/telco-account-manager-3727299?token=0~496b6ef3-96a9-44aa-b177-845b5390b651&sectionRank=399&jobId=jobstreet-id-job-3727299,Jakarta Raya,6 hours ago,2021-12-20T10:24:58Z,,,,monthly,,
standout,"510,140","Manufaktur,Pembelian/Manajemen Material",436667,PT. SAMUDRA RETAIL INDONESIA,false,KualifikasiMax 35 TahunD3 / SarjanaMin 2 tahun pengalaman di bidang yang samaFasih Ms. OfficeMemiliki keahlian negosiasi yang baikFasih (...,full_time,3727298,false,true,PURCHASING,https://www.jobstreet.co.id/id/job/purchasing-3727298?token=0~496b6ef3-96a9-44aa-b177-845b5390b651&sectionRank=400&jobId=jobstreet-id-job-3727298,Jakarta Utara,6 hours ago,2021-12-20T10:24:47Z,IDR,4500000,6000000,monthly,,"BPJS Ketenagakerjaan,BPJS Kesehatan"
standard,"501,132","Akuntansi / Keuangan,Keuangan / Investasi Perusahaan ",jobstreet-id-29638,PT Arah Environmental Indonesia,false,"Consolidate, reconcile and analyze financial data (budgets, income statement forecasts etc). Assemble and summarize data from different departments...",full_time,3727297,false,false,Corporate Finance Analyst,https://www.jobstreet.co.id/id/job/corporate-finance-analyst-3727297?token=0~496b6ef3-96a9-44aa-b177-845b5390b651&sectionRank=401&jobId=jobstreet-id-job-3727297,Jakarta Selatan,6 hours ago,2021-12-20T10:23:49Z,,,,monthly,,
standout,"505,118","Pelayanan,Perawatan Pribadi",jobstreet-id-335841,PT Cantika Gemilang Indonesia,false,"Syarat :-Usia maks.30 tahun-Pendidikan minimal D3 Tata Rias atau Keperawatan SMA/SMK/Sederajat-Berpengalaman dibidang Skincare, Salon, Klinik...",full_time,3727295,false,true,Beauty Therapist,https://www.jobstreet.co.id/id/job/beauty-therapist-3727295?token=0~496b6ef3-96a9-44aa-b177-845b5390b651&sectionRank=402&jobId=jobstreet-id-job-3727295,Medan,6 hours ago,2021-12-20T10:23:32Z,,,,monthly,,
standard,"503,151","Penjualan / Pemasaran,Telesales/Telemarketing",jobstreet-id-264916,Arsy Gemilang Indonusa,false,Kami jasa Konsultan Keuangan dan Mediasi Perbankan Arsy Gemilang Law Office dibawah naungan PT Arsy Gemilang Indonusa membuka lowongan kerja sebagai...,full_time,3727294,false,false,Telesales,https://www.jobstreet.co.id/id/job/telesales-3727294?token=0~496b6ef3-96a9-44aa-b177-845b5390b651&sectionRank=403&jobId=jobstreet-id-job-3727294,Depok,6 hours ago,2021-12-20T10:22:15Z,,,,monthly,,
standout,"501,131","Akuntansi / Keuangan,Akuntansi Umum / Pembiayaan",jobstreet-id-262111,PT Leenoh Consulting Indonesia,false,"Requirement : Minimum education D3 / S1 (preferably majoring in Accounting, Economics, Finance) Minimum 5 years work experience in Accounting Firm...",contract,3727293,false,true,Accounting Auditor,https://www.jobstreet.co.id/id/job/accounting-auditor-3727293?token=0~496b6ef3-96a9-44aa-b177-845b5390b651&sectionRank=404&jobId=jobstreet-id-job-3727293,Jakarta Selatan,6 hours ago,2021-12-20T10:22:09Z,,,,monthly,,
standard,"501,131","Akuntansi / Keuangan,Akuntansi Umum / Pembiayaan",jobstreet-id-341760,Westown View,false,1. Sarjana Akuntansi2. Minimal memiliki 1-3 tahun pengalaman sebagai staff akunting3. Memiliki kemampuan mendalam di bidang Akuntansi4. Memiliki...,full_time,3722871,false,false,Accounting Staff,https://www.jobstreet.co.id/id/job/accounting-staff-3722871?token=0~496b6ef3-96a9-44aa-b177-845b5390b651&sectionRank=405&jobId=jobstreet-id-job-3722871,Surabaya,6 hours ago,2021-12-20T10:20:41Z,,,,monthly,,
standout,"502,137","Sumber Daya Manusia/Personalia,Sumber Daya Manusia / HR",jobstreet-id-189113,PT. Hati Anak Bangsa,false,DescriptionWe are looking for an experienced Talent Acquisition Specialist for our company. You will hiring the best talents to grow together with our...,full_time,3727292,false,true,Talent Acquisition Specialist,https://www.jobstreet.co.id/id/job/talent-acquisition-specialist-3727292?token=0~496b6ef3-96a9-44aa-b177-845b5390b651&sectionRank=406&jobId=jobstreet-id-job-3727292,Jakarta Raya,6 hours ago,2021-12-20T10:20:32Z,,,,monthly,,
standout,"511,184","Bangunan/Konstruksi,Teknik Sipil/Konstruksi Bangunan",433595,PT Indonesia Applicad,false,•	Presentation products and install software to customers•	Evaluation and solve software problems•	Prepare training guide book and conduct training...,full_time,3727291,false,true,Technical Support,https://www.jobstreet.co.id/id/job/technical-support-3727291?token=0~496b6ef3-96a9-44aa-b177-845b5390b651&sectionRank=407&jobId=jobstreet-id-job-3727291,Jakarta Utara,6 hours ago,2021-12-20T10:20:04Z,,,,monthly,,"Dynamic,Friendly,Competitive remuneration"
standard,"503,145","Penjualan / Pemasaran,Penjualan Ritel",jobstreet-id-342788,JAVA CHAKRA PRODUCTION (JAVA KOPI),false,Kualifikasi :1. Berpenampilan rapi2. Well Groomed3. Minimal lulusan SMA / SMK atau sederajat4. Usia maksimal 35 tahun5. Memiliki kemampuan komunikasi...,full_time,3727290,false,false,SPG MOBILE,https://www.jobstreet.co.id/id/job/spg-mobile-3727290?token=0~496b6ef3-96a9-44aa-b177-845b5390b651&sectionRank=408&jobId=jobstreet-id-job-3727290,Surabaya,6 hours ago,2021-12-20T10:19:58Z,,,,monthly,,
standard,"503,143","Penjualan / Pemasaran,Penjualan - Teknik/Teknikal/IT",434625,PT. Lintas Teknologi Indonesia,false,SOFTWARE ACCOUNT MANAGER Carry out and monitor profitable sales and foster working relationships routinely with customers and parties who relate to...,full_time,3727289,false,false,Software Account Manager,https://www.jobstreet.co.id/id/job/software-account-manager-3727289?token=0~496b6ef3-96a9-44aa-b177-845b5390b651&sectionRank=409&jobId=jobstreet-id-job-3727289,Jakarta Raya,6 hours ago,2021-12-20T10:19:31Z,,,,monthly,,
standard,"508,191","Komputer/Teknologi Informasi,IT-Perangkat Lunak",431853,PT Datacaraka Solusindo,false,"Responsibilities: Responding to queries on the phone, via email, in person, or through remote access. Training application on computer users. Running...",full_time,3727288,false,false,IT Helpdesk,https://www.jobstreet.co.id/id/job/it-helpdesk-3727288?token=0~496b6ef3-96a9-44aa-b177-845b5390b651&sectionRank=410&jobId=jobstreet-id-job-3727288,Jakarta Raya,6 hours ago,2021-12-20T10:19:30Z,,,,monthly,,
standout,"509,187","Teknik,Teknik Elektro",jobstreet-id-61543,Indah Plastic,false,"Kualifikasi : Usia Maksimal 35 tahun Lulusan minimal D3 Menguasai bahasa inggris Diutamakan berpengalaman minimal 1 tahun Pro Active, Jujur dan...",full_time,3727287,false,true,Electrical Engineering/Technician,https://www.jobstreet.co.id/id/job/electrical-engineering-technician-3727287?token=0~496b6ef3-96a9-44aa-b177-845b5390b651&sectionRank=411&jobId=jobstreet-id-job-3727287,Sidoarjo,6 hours ago,2021-12-20T10:19:15Z,,,,monthly,,"Lokasi kerja strategis,Transportasi mudah dijangkau,Lingkungan kerja menyenangkan"
standard,"506,107","Hotel/Restoran,Makanan/Minuman/Pelayanan Restoran",jobstreet-id-342644,MANGALIA COFFEE,false,"Kualifikasi : Usia maksimal 25 tahun Jujur paling utama Mudah bergaul, rajin dan disiplin Ramah, sopan, gesit dan pekerja keras Mampu berkomunikasi...",full_time,3727286,false,false,BARISTA,https://www.jobstreet.co.id/id/job/barista-3727286?token=0~496b6ef3-96a9-44aa-b177-845b5390b651&sectionRank=412&jobId=jobstreet-id-job-3727286,Kalimantan Tengah,6 hours ago,2021-12-20T10:19:13Z,,,,monthly,,
standard,"503,145","Penjualan / Pemasaran,Penjualan Ritel",439508,PT Mega Central Finance,false,Uraian Pekerjaan: Melakukan mapping potensi pasar di sekitar lokasi cabang secara berkala serta melakukan Competitor Check  untuk menentukan strategy...,full_time,3723400,false,false,KEPALA POS (TEBO),https://www.jobstreet.co.id/id/job/kepala-pos-tebo-3723400?token=0~496b6ef3-96a9-44aa-b177-845b5390b651&sectionRank=413&jobId=jobstreet-id-job-3723400,Purbalingga,6 hours ago,2021-12-20T10:19:12Z,,,,monthly,,
standard,"514,110","Lainnya,Pekerjaan Umum",433521,PT Indesso Aroma,false,"Responsibilities : Understand and be able to carry out licensing at the Ministry level, the ability to build good relations with the authorities...",full_time,3727285,false,false,Head of GA,https://www.jobstreet.co.id/id/job/head-of-ga-3727285?token=0~496b6ef3-96a9-44aa-b177-845b5390b651&sectionRank=414&jobId=jobstreet-id-job-3727285,Cileungsi,6 hours ago,2021-12-20T10:19:09Z,,,,monthly,,
standout,"503,139","Penjualan / Pemasaran,Pemasaran/Pengembangan Bisnis",jobstreet-id-67196,PT Medkes Global Prima,false,"Melakukan semua kegiatan promosi, branding, dan operational marketing Menawarkan jasa kepada konsumen baik secara langsung, melalui iklan, maupun...",full_time,3727284,false,true,Marketing Supervisor - Maklon,https://www.jobstreet.co.id/id/job/marketing-supervisor-maklon-3727284?token=0~496b6ef3-96a9-44aa-b177-845b5390b651&sectionRank=415&jobId=jobstreet-id-job-3727284,Jawa Barat,6 hours ago,2021-12-20T10:19:09Z,IDR,6000000,7500000,monthly,,
standout,"502,133","Sumber Daya Manusia/Personalia,Staf / Administrasi umum",jobstreet-id-61543,Indah Plastic,false,We are looking for a responsible Administrative Assistant to perform a variety of administrative and clerical tasks. Duties of the Administrative...,full_time,3727282,false,true,Staff Admininstration,https://www.jobstreet.co.id/id/job/staff-admininstration-3727282?token=0~496b6ef3-96a9-44aa-b177-845b5390b651&sectionRank=416&jobId=jobstreet-id-job-3727282,Jawa Timur,6 hours ago,2021-12-20T10:17:36Z,,,,monthly,,
standard,"510,194","Manufaktur,Manufaktur",433521,PT Indesso Aroma,false,Responsibilities: Monitoring all production process also completing the troubleshooting process Introducing the latest process technologies Handling...,full_time,3727280,false,false,Production Section Head,https://www.jobstreet.co.id/id/job/production-section-head-3727280?token=0~496b6ef3-96a9-44aa-b177-845b5390b651&sectionRank=417&jobId=jobstreet-id-job-3727280,Cileungsi,6 hours ago,2021-12-20T10:16:44Z,,,,monthly,,
standard,"509,185","Teknik,Teknik Kimia",433521,PT Indesso Aroma,false,Responsibilities : as an engineer who runs production systems and industrial digitalization processes Requirements : Bachelor degree from Chemical...,full_time,3727279,false,false,Production Engineer,https://www.jobstreet.co.id/id/job/production-engineer-3727279?token=0~496b6ef3-96a9-44aa-b177-845b5390b651&sectionRank=418&jobId=jobstreet-id-job-3727279,Purwokerto,6 hours ago,2021-12-20T10:15:23Z,,,,monthly,,
