adType,categoriesCode,categoriesName,companyId,companyName,companyPrivate,description,employment,id,isClassified,isStandout,jobTitle,jobUrl,locations,postingDuration,postedAt,salarycurrency,salaryMin,salaryMax,salaryPeriod,salaryTerm,sellingPoints
standout,"505,134","Pelayanan,Layanan Pelanggan",jobstreet-id-77809,PT The Master Steel MFc,false,"Sophisticated and timeless, Le Mansion provide a hip, hospitable and homey environment, complementing the lifestyles of its guests with the highest...",contract,3732254,false,true,Guest Relation Officer (GRO/ Receptionist),https://www.jobstreet.co.id/id/job/guest-relation-officer-gro-receptionist-3732254?token=0~06eba652-f9dc-4b95-a459-313f9ace08bb&sectionRank=425&jobId=jobstreet-id-job-3732254,Jakarta Selatan,8 hours ago,2021-12-24T09:11:37Z,IDR,4000000,4500000,monthly,,
standard,"501,135","Akuntansi / Keuangan,Perbankan / Jasa Finansial ",413769,"PT. Bank Mega, Tbk",false,Mencari nasabah baru (Funding and Wealth Product). Menjaga hubungan baik dengan customer dan calon customer. Memenuhi target sales dengan konsisten....,full_time,3732253,false,false,Retail Funding Officer Jabodetabek,https://www.jobstreet.co.id/id/job/retail-funding-officer-jabodetabek-3732253?token=0~06eba652-f9dc-4b95-a459-313f9ace08bb&sectionRank=426&jobId=jobstreet-id-job-3732253,"Jakarta Raya,Bekasi,Bogor,Depok,Tangerang",8 hours ago,2021-12-24T09:11:13Z,,,,monthly,,
standout,"513,111","Layanan Kesehatan,Praktisi/Asisten Medis",,,true,Dibutuhkan Perawat untuk klinik kecantikan area Jakarta Selatan Lulusan D3 Keperawatan Berpengalaman min 1 tahun sebagai perawat di klinik kecantikan...,full_time,3732252,false,true,Perawat Klinik Kecantikan,https://www.jobstreet.co.id/id/job/perawat-klinik-kecantikan-3732252?token=0~06eba652-f9dc-4b95-a459-313f9ace08bb&sectionRank=427&jobId=jobstreet-id-job-3732252,Jakarta Selatan,8 hours ago,2021-12-24T09:11:07Z,,,,monthly,,
standard,"506,107","Hotel/Restoran,Makanan/Minuman/Pelayanan Restoran",jobstreet-id-343912,Kamsia Boba Kendari,false,"Kamsia Boba Kendari, merupakan badan usaha yang bergerak dalam bidang Food and Beverage. Terletak di Bundaran Pesawat Lepo-lepo, Kendari, Sulawesi...",full_time,3732251,false,false,Crew Outlet,https://www.jobstreet.co.id/id/job/crew-outlet-3732251?token=0~06eba652-f9dc-4b95-a459-313f9ace08bb&sectionRank=428&jobId=jobstreet-id-job-3732251,Kendari,8 hours ago,2021-12-24T09:10:53Z,,,,monthly,,
standout,"511,184","Bangunan/Konstruksi,Teknik Sipil/Konstruksi Bangunan",jobstreet-id-265486,PT SENTRA INTI PERKASA,false,Kualifikasi : Pendidikan S1 di utamakan Teknik (Sipil) atau setara. Setidaknya 3 Tahun pengalaman kerja di bidang terkait diperlukan untuk posisi ini....,full_time,3732250,false,true,SITE MANAGER,https://www.jobstreet.co.id/id/job/site-manager-3732250?token=0~06eba652-f9dc-4b95-a459-313f9ace08bb&sectionRank=429&jobId=jobstreet-id-job-3732250,Surabaya,8 hours ago,2021-12-24T09:10:37Z,,,,monthly,,
standard,"513,111","Layanan Kesehatan,Praktisi/Asisten Medis",436732,PT. Sarana Meditama International (OMNI Hospitals Group),false,Tugas &amp; Tanggung Jawab :1. Melaksanakan dan bertanggung jawab atas kelengkapan isi formulir berkas rekam medis rawat inap dan rawat jalan.2....,full_time,3732249,false,false,Medical Record Staff (RS EMC Pulomas),https://www.jobstreet.co.id/id/job/medical-record-staff-rs-emc-pulomas-3732249?token=0~06eba652-f9dc-4b95-a459-313f9ace08bb&sectionRank=430&jobId=jobstreet-id-job-3732249,Jakarta Timur,8 hours ago,2021-12-24T09:09:56Z,IDR,4000000,5200000,monthly,,
standard,"507,105","Pendidikan/Pelatihan,Pendidikan",jobstreet-id-343764,SDI Salsabila Nganjuk,false,Kualifikasi : Pendidikan minimal S1 PGSD Terbuka untuk Fresh Graduate Mampu berbahasa Inggris (minimal pasif) Dapat bekerjasama dengan team Memiliki...,full_time,3732248,false,false,Guru Kelas,https://www.jobstreet.co.id/id/job/guru-kelas-3732248?token=0~06eba652-f9dc-4b95-a459-313f9ace08bb&sectionRank=431&jobId=jobstreet-id-job-3732248,Jawa Timur,8 hours ago,2021-12-24T09:09:35Z,,,,monthly,,
standout,"508,193","Komputer/Teknologi Informasi,IT-Admin Jaringan/Sistem/Database",jobstreet-id-61164,QHomemart Supermarket Bangunan,false,Anda menyukai bidang teknologi? Jago dibidang Web Developer ? Memiliki Pengalaman dalam merancang dan membangun web ? Jadilah Web Developer di...,full_time,3732247,false,true,WEB DEVELOPER,https://www.jobstreet.co.id/id/job/web-developer-3732247?token=0~06eba652-f9dc-4b95-a459-313f9ace08bb&sectionRank=432&jobId=jobstreet-id-job-3732247,Bantul,8 hours ago,2021-12-24T09:09:20Z,,,,monthly,,
standard,"509,189","Teknik,Teknik Lingkungan",413917,"PT Fajar Surya Wisesa,Tbk",false,REQUIREMENT : Candidate must possess at least Bachelor's Degree in Engineering (Environmental/Health/Safety) or equivalent. Minimum 5 years of working...,full_time,3732245,false,false,HSE System Development Supervisor,https://www.jobstreet.co.id/id/job/hse-system-development-supervisor-3732245?token=0~06eba652-f9dc-4b95-a459-313f9ace08bb&sectionRank=433&jobId=jobstreet-id-job-3732245,Bekasi,8 hours ago,2021-12-24T09:08:41Z,,,,monthly,,
standout,"510,194","Manufaktur,Manufaktur",429360,PT LasalleFood Indonesia Tbk,false,Bertanggung jawab memastikan kelancaran pengoperasian mesin dan peralatan utility untuk mencapai target produksi. Ikut serta dalam implementasi Safety...,contract,3732244,false,true,ASSISTANT SUPERVISOR UTILITY,https://www.jobstreet.co.id/id/job/assistant-supervisor-utility-3732244?token=0~06eba652-f9dc-4b95-a459-313f9ace08bb&sectionRank=434&jobId=jobstreet-id-job-3732244,Jawa Barat,8 hours ago,2021-12-24T09:06:44Z,,,,monthly,,
standard,"505,147","Pelayanan,Logistik/Rantai Pasokan",436449,PT Repex Wahana,false,"Responsibilities: Visit target customer minimum 4 clients per day Calculate weight, volume, or cost of goods to be moved air and sea Select shipment...",full_time,3732242,false,false,Account Executive (Clearance & Freight Forwarding),https://www.jobstreet.co.id/id/job/account-executive-clearance-freight-forwarding-3732242?token=0~06eba652-f9dc-4b95-a459-313f9ace08bb&sectionRank=435&jobId=jobstreet-id-job-3732242,Jakarta Selatan,8 hours ago,2021-12-24T09:04:59Z,,,,monthly,,
standard,"510,194","Manufaktur,Manufaktur",jobstreet-id-342782,Rose More Clothing,false,Kualifikasi : Berusia 20-30 tahun Berdomisili di Yogyakarta Dapat menggunakan kamera digital dan handphone Bersedia bekerja dengan waktu flexible...,full_time,3732241,false,false,Freelance Staff,https://www.jobstreet.co.id/id/job/freelance-staff-3732241?token=0~06eba652-f9dc-4b95-a459-313f9ace08bb&sectionRank=436&jobId=jobstreet-id-job-3732241,Yogyakarta,8 hours ago,2021-12-24T09:04:38Z,,,,monthly,,
standard,"509,187","Teknik,Teknik Elektro",1511,PT ISS INDONESIA (Bintaro),false,Deskripsi Pekerjaan : Pendidikan minimal SMK Elektrikal / Sipil Pengalaman minimal 1 tahun sebagai teknisi ( diutamakan pengalaman handle gedung Rumah...,full_time,3732240,false,false,Teknisi Gedung,https://www.jobstreet.co.id/id/job/teknisi-gedung-3732240?token=0~06eba652-f9dc-4b95-a459-313f9ace08bb&sectionRank=437&jobId=jobstreet-id-job-3732240,Jakarta Raya,8 hours ago,2021-12-24T09:04:36Z,,,,monthly,,
standout,"508,191","Komputer/Teknologi Informasi,IT-Perangkat Lunak",427354,PT KAHAPTEX,false,"-Usia maksimal 30 tahun-Pendidikan D3/S1 Ilmu Komputer/Teknik Komputer/Sistem Informasi, -Pengalaman minimal 1 tahun di bidang yang sama (fresh...",full_time,3732239,false,true,IT Programmer,https://www.jobstreet.co.id/id/job/it-programmer-3732239?token=0~06eba652-f9dc-4b95-a459-313f9ace08bb&sectionRank=438&jobId=jobstreet-id-job-3732239,Bogor,8 hours ago,2021-12-24T09:04:04Z,,,,monthly,,
standout,"501,131","Akuntansi / Keuangan,Akuntansi Umum / Pembiayaan",428290,PT Simbarco Kencana,false,Kualifikasi: Pendidikan Minimal D3 Jurusan Akuntansi Usia Maximal 35 Tahun Dapat Membuat Jurnal s/d menyusun laporan keuangan Mengerti peraturan...,full_time,3732238,false,true,Staff Accounting ( General Ledger ),https://www.jobstreet.co.id/id/job/staff-accounting-general-ledger-3732238?token=0~06eba652-f9dc-4b95-a459-313f9ace08bb&sectionRank=439&jobId=jobstreet-id-job-3732238,Jakarta Pusat,8 hours ago,2021-12-24T09:03:55Z,,,,monthly,,"Pengembangan Karir,BPJS Ketenagakerjaan,BPJS Kesehatan"
standard,"511,184","Bangunan/Konstruksi,Teknik Sipil/Konstruksi Bangunan",414349,"PT Tower Bersama Infrastructure, Tbk",false,Tugas dan Tanggung Jawab : Memastikan Delivery RFI tepat waktu Memastikan penyelesaian untuk proses ATP ke mitra dan operator sesuai leadtime...,full_time,3732237,false,false,CME Inspector (Pekanbaru),https://www.jobstreet.co.id/id/job/cme-inspector-pekanbaru-3732237?token=0~06eba652-f9dc-4b95-a459-313f9ace08bb&sectionRank=440&jobId=jobstreet-id-job-3732237,Pekanbaru,8 hours ago,2021-12-24T09:03:01Z,,,,monthly,,
standard,"503,145","Penjualan / Pemasaran,Penjualan Ritel",jobstreet-id-343737,SAPTA GAMER,false,Deskripsi Pekerjaan : Memasarkan produk perusahaan. Mengumpulkan database costumer baru. Mengembangkan perencanaan kerja dan menjalankan program...,full_time,3732236,false,false,Sales Marketing,https://www.jobstreet.co.id/id/job/sales-marketing-3732236?token=0~06eba652-f9dc-4b95-a459-313f9ace08bb&sectionRank=441&jobId=jobstreet-id-job-3732236,Bali,8 hours ago,2021-12-24T09:02:32Z,,,,monthly,,
standout,"508,191","Komputer/Teknologi Informasi,IT-Perangkat Lunak",jobstreet-id-285482,PT Limabelas Inovasi Informatika,false,Responsibilities. Writing clean and efficient codes for Android applications. Monitoring the performance of live apps and work on optimizing them at...,full_time,3726406,false,true,Go Developer,https://www.jobstreet.co.id/id/job/go-developer-3726406?token=0~06eba652-f9dc-4b95-a459-313f9ace08bb&sectionRank=442&jobId=jobstreet-id-job-3726406,Jakarta Selatan,8 hours ago,2021-12-24T09:01:58Z,IDR,12000000,15000000,monthly,,Uang Lembur
standard,"504,101","Seni/Media/Komunikasi,Seni / Desain Kreatif",jobstreet-id-343910,Slidesignus,false,"Usia Maksimal 25 tahun, Menguasai software design (Photoshop, Adobe Illustration, PowerPoint), Fresh Graduate diperbolehkan, Jujur, disiplin, teliti,...",full_time,3732235,false,false,Graphic Designer,https://www.jobstreet.co.id/id/job/graphic-designer-3732235?token=0~06eba652-f9dc-4b95-a459-313f9ace08bb&sectionRank=443&jobId=jobstreet-id-job-3732235,Malang,8 hours ago,2021-12-24T09:01:23Z,IDR,2500000,3500000,monthly,,
standard,"503,145","Penjualan / Pemasaran,Penjualan Ritel",434645,PT Lock & Lock Indonesia,false,"Requirement: Candidate must possess at least Bachelor's Degree, preferably majoring in Broadcasting. At least 3 Year(s) of working experience in the...",full_time,3732234,false,false,SALES STAFF,https://www.jobstreet.co.id/id/job/sales-staff-3732234?token=0~06eba652-f9dc-4b95-a459-313f9ace08bb&sectionRank=444&jobId=jobstreet-id-job-3732234,Jakarta Selatan,9 hours ago,2021-12-24T09:00:43Z,,,,monthly,,
standout,"510,115","Manufaktur,Pemeliharaan",jobstreet-id-2967,PT Trimitra Baterai Prakasa,false,"Kualifikasi Pendidikan minimal D3 – Engineering,Teknik Lingkunga,  disukai Teknik Sipil. Memiliki Sertifikasi K3 - Umum Usia Maksimal 35 Tahun....",full_time,3732233,false,true,General Affair Supervisor,https://www.jobstreet.co.id/id/job/general-affair-supervisor-3732233?token=0~06eba652-f9dc-4b95-a459-313f9ace08bb&sectionRank=445&jobId=jobstreet-id-job-3732233,Jakarta Raya,9 hours ago,2021-12-24T09:00:01Z,,,,monthly,,
standard,"510,194","Manufaktur,Manufaktur",428384,PT Star Cosmos,false,Kualifikasi : Pendidikan minimal D3/S1 Teknik Industri/ Elektro/ Mesin/Kimia/manajemen Usia 25-35 tahun Pengalaman minimal 3 tahun sebagai Staff...,contract,3732232,false,false,Supervisor Assembling,https://www.jobstreet.co.id/id/job/supervisor-assembling-3732232?token=0~06eba652-f9dc-4b95-a459-313f9ace08bb&sectionRank=446&jobId=jobstreet-id-job-3732232,Tangerang,9 hours ago,2021-12-24T08:59:30Z,,,,monthly,,
standard,"508,191","Komputer/Teknologi Informasi,IT-Perangkat Lunak",443452,PT Bussan Auto Finance (BAF),false,Kualifikasi : Pendidikan minimal S1 Teknik Informatika/ teknik Elektro (komputer/telekomunikasi) Memiliki pengalaman minimal 2 tahun dibidang yang...,full_time,3732231,false,false,IT Product Owner Specialist,https://www.jobstreet.co.id/id/job/it-product-owner-specialist-3732231?token=0~06eba652-f9dc-4b95-a459-313f9ace08bb&sectionRank=447&jobId=jobstreet-id-job-3732231,Jakarta Selatan,9 hours ago,2021-12-24T08:59:15Z,,,,monthly,,
standard,"508,191","Komputer/Teknologi Informasi,IT-Perangkat Lunak",443452,PT Bussan Auto Finance (BAF),false,Job Description : Coordinate the development of new application systems (new applications and supporting applications) Coordinating the implementation...,full_time,3732229,false,false,IT Software Engineer (Developer) Specialist,https://www.jobstreet.co.id/id/job/it-software-engineer-developer-specialist-3732229?token=0~06eba652-f9dc-4b95-a459-313f9ace08bb&sectionRank=448&jobId=jobstreet-id-job-3732229,Jakarta Selatan,9 hours ago,2021-12-24T08:58:25Z,,,,monthly,,
standard,"501,135","Akuntansi / Keuangan,Perbankan / Jasa Finansial ",443452,PT Bussan Auto Finance (BAF),false,Tanggung Jawab Kerja: Menyiapkan dokumen dan regulasi yang dibutuhkan dalam menerapkan produk pembiayaan usaha mikro / UMKM (micro loan) Support...,full_time,3732228,false,false,Micro Loan Business Developmen Senior Officer (Pembiayaan Usaha Mikro/UMKM),https://www.jobstreet.co.id/id/job/micro-loan-business-developmen-senior-officer-pembiayaan-usaha-mikro-umkm-3732228?token=0~06eba652-f9dc-4b95-a459-313f9ace08bb&sectionRank=449&jobId=jobstreet-id-job-3732228,Jakarta Selatan,9 hours ago,2021-12-24T08:57:25Z,,,,monthly,,
standard,"503,139","Penjualan / Pemasaran,Pemasaran/Pengembangan Bisnis",443452,PT Bussan Auto Finance (BAF),false,Tangung jawab: Melakukan proses pemasaran produk pembiayaan beragunan properti untuk pembiayaan usaha mikro Melakukan proses survey terhadap usaha...,full_time,3732227,false,false,Account Officer (Pembiayaan Usaha Mikro),https://www.jobstreet.co.id/id/job/account-officer-pembiayaan-usaha-mikro-3732227?token=0~06eba652-f9dc-4b95-a459-313f9ace08bb&sectionRank=450&jobId=jobstreet-id-job-3732227,Jakarta Raya,9 hours ago,2021-12-24T08:56:41Z,,,,monthly,,
standard,"503,145","Penjualan / Pemasaran,Penjualan Ritel",jobstreet-id-43911,PT Tirtakencana Tatawarna (Bali),false,TUGAS UTAMA: Melakukan direct selling kepada customer Bertanggung jawab atas distribusi ke outlet yang sudah terdata Melakukan perluasan cover area...,full_time,3732226,false,false,SALES,https://www.jobstreet.co.id/id/job/sales-3732226?token=0~b4e49505-98fb-4020-ad52-cfe67aa172b8&sectionRank=451&jobId=jobstreet-id-job-3732226,Bali,9 hours ago,2021-12-24T08:56:19Z,,,,monthly,,
standard,"503,145","Penjualan / Pemasaran,Penjualan Ritel",jobstreet-id-343219,UD Lucky,false,Deskripsi Pekerjaan : Memasarkan produk perusahaan. Mengumpulkan database costumer baru. Mengembangkan perencanaan kerja dan menjalankan program...,full_time,3732225,false,false,Sales Marketing,https://www.jobstreet.co.id/id/job/sales-marketing-3732225?token=0~b4e49505-98fb-4020-ad52-cfe67aa172b8&sectionRank=452&jobId=jobstreet-id-job-3732225,Bali,9 hours ago,2021-12-24T08:54:56Z,,,,monthly,,
standout,"503,151","Penjualan / Pemasaran,Telesales/Telemarketing",jobstreet-id-299300,3G Power Computer,false,"Anda Cakap Mengelola Tim?Di 3G Power Computer kami memiliki lingkungan bisnis yang santai, tidak banyak aturan, solidaritas yang tinggi. Namun, kami...",full_time,3732224,false,true,Sales Team Leader,https://www.jobstreet.co.id/id/job/sales-team-leader-3732224?token=0~b4e49505-98fb-4020-ad52-cfe67aa172b8&sectionRank=453&jobId=jobstreet-id-job-3732224,Semarang,9 hours ago,2021-12-24T08:54:52Z,IDR,3000000,5000000,monthly,,"Jenjang Karir,Lingkungan Kerja Yang Fun,Bonus Performance"
standard,"503,203","Penjualan / Pemasaran,Digital Marketing",jobstreet-id-343895,VIXION Wedding Surabaya,false,VIXION Wedding Surabaya Membuka Lowongan Content Creator dengan persyaratan : Pendidikan minimal SMA sederajat Aktif dan Paham dengan Sosial media...,full_time,3732223,false,false,CONTENT CREATOR,https://www.jobstreet.co.id/id/job/content-creator-3732223?token=0~b4e49505-98fb-4020-ad52-cfe67aa172b8&sectionRank=454&jobId=jobstreet-id-job-3732223,Surabaya,9 hours ago,2021-12-24T08:54:48Z,,,,monthly,,
standard,"502,133","Sumber Daya Manusia/Personalia,Staf / Administrasi umum",359293,PT SHARP Electronics Indonesia,false,"​Job Specification : Maximum 28 years old and must possess at least Bachelor's Degree preferably in Management, Psychology, Statistics Experienced...",contract,3732220,false,false,Structure reform and project staff,https://www.jobstreet.co.id/id/job/structure-reform-and-project-staff-3732220?token=0~b4e49505-98fb-4020-ad52-cfe67aa172b8&sectionRank=455&jobId=jobstreet-id-job-3732220,Karawang,9 hours ago,2021-12-24T08:52:11Z,,,,monthly,,
standout,"505,147","Pelayanan,Logistik/Rantai Pasokan",430623,PT Asian Paints Indonesia,false,Key Responsibilities : Preparation of MIS and regular reporting to management. Verification / authentication of the order from the sales team /...,full_time,3732218,false,true,Logistic Officer,https://www.jobstreet.co.id/id/job/logistic-officer-3732218?token=0~b4e49505-98fb-4020-ad52-cfe67aa172b8&sectionRank=456&jobId=jobstreet-id-job-3732218,Palembang,9 hours ago,2021-12-24T08:50:43Z,IDR,5000000,7000000,monthly,,
standard,"513,112","Layanan Kesehatan,Farmasi",jobstreet-id-226457,klinik jrc ppti,false,Kualifikasi : D3 Farmasi yang sudah memiliki STRTTK (Surat Tanda Registrasi) Usia maksimal 35 tahun Bersedia bekerja dalam sistem shift Bisa bekerja...,full_time,3732217,false,false,Assistant Apoteker,https://www.jobstreet.co.id/id/job/assistant-apoteker-3732217?token=0~b4e49505-98fb-4020-ad52-cfe67aa172b8&sectionRank=457&jobId=jobstreet-id-job-3732217,Jakarta Raya,9 hours ago,2021-12-24T08:49:48Z,,,,monthly,,
standard,"513,112","Layanan Kesehatan,Farmasi",jobstreet-id-343804,PT ASASTA HUTAMA SENTOSA,false,APOTEK K-24 MAGELANGMembuka lowongan pekerjaan posisiAPOTEKERSyarat: Pendidikan Profesi Apoteker Mempunyai STR aktif Memiliki Jiwa kepemimpinan untuk...,full_time,3731778,false,false,APOTEKER,https://www.jobstreet.co.id/id/job/apoteker-3731778?token=0~b4e49505-98fb-4020-ad52-cfe67aa172b8&sectionRank=458&jobId=jobstreet-id-job-3731778,Magelang,9 hours ago,2021-12-24T08:49:48Z,IDR,3500000,3700000,monthly,,
standard,"511,184","Bangunan/Konstruksi,Teknik Sipil/Konstruksi Bangunan",414349,"PT Tower Bersama Infrastructure, Tbk",false,Tugas dan Tanggung Jawab : Memastikan Delivery RFI tepat waktu Memastikan penyelesaian untuk proses ATP ke mitra dan operator sesuai leadtime...,full_time,3732216,false,false,CME Inspector (Bandung),https://www.jobstreet.co.id/id/job/cme-inspector-bandung-3732216?token=0~b4e49505-98fb-4020-ad52-cfe67aa172b8&sectionRank=459&jobId=jobstreet-id-job-3732216,Bandung,9 hours ago,2021-12-24T08:49:19Z,,,,monthly,,
standard,"506,107","Hotel/Restoran,Makanan/Minuman/Pelayanan Restoran",jobstreet-id-343683,Food Venture,false,Deskripsi Pekerjaan: Menarik pelanggan baru Menjaga ketersediaan semua stok makanan dan peralatan yang ada Meningkatkan reputasi brand dengan terus...,full_time,3732215,false,false,Staff Outlet,https://www.jobstreet.co.id/id/job/staff-outlet-3732215?token=0~b4e49505-98fb-4020-ad52-cfe67aa172b8&sectionRank=460&jobId=jobstreet-id-job-3732215,Bali,9 hours ago,2021-12-24T08:49:03Z,,,,monthly,,
standout,"507,105","Pendidikan/Pelatihan,Pendidikan",jobstreet-id-62399,Exito Course,false,Type: part Time (Offline &amp; Online)Frequency: 1-3 sessions per week per studentDuration: 90 minutes per session.Requirements: Bachelor degree in...,part_time,3732214,false,true,"Business Studies, Accounting, Economics A Level Teacher / Tutor - Part time",https://www.jobstreet.co.id/id/job/business-studies-accounting-economics-a-level-teacher-tutor-part-time-3732214?token=0~b4e49505-98fb-4020-ad52-cfe67aa172b8&sectionRank=461&jobId=jobstreet-id-job-3732214,Jakarta Raya,9 hours ago,2021-12-24T08:48:38Z,,,,monthly,,
standard,"501,135","Akuntansi / Keuangan,Perbankan / Jasa Finansial ",jobstreet-id-343795,KSP Mitra duta Artha Pule,false,Lowongan PekerrjaanField CollectorKualifikasi : Usia Max 28 tahun Minimal Pendidikan SMA Memiliki kendaraan bermotor dan SIM C aktif Domisili area...,full_time,3732213,false,false,Field Collector,https://www.jobstreet.co.id/id/job/field-collector-3732213?token=0~b4e49505-98fb-4020-ad52-cfe67aa172b8&sectionRank=462&jobId=jobstreet-id-job-3732213,Jawa Timur,9 hours ago,2021-12-24T08:47:56Z,,,,monthly,,
standout,"507,105","Pendidikan/Pelatihan,Pendidikan",428145,Saint Nicholas School,false,Teach Mandarin Make Lesson Plan and Semester Plan Participate in all events and activities Follow Saint Nicholas SOP  QUALIFICATION At least 25 years...,full_time,3732212,false,true,Mandarin Teacher,https://www.jobstreet.co.id/id/job/mandarin-teacher-3732212?token=0~b4e49505-98fb-4020-ad52-cfe67aa172b8&sectionRank=463&jobId=jobstreet-id-job-3732212,Jakarta Utara,9 hours ago,2021-12-24T08:47:54Z,,,,monthly,,
standout,"508,191","Komputer/Teknologi Informasi,IT-Perangkat Lunak",444344,PT Cartrack South East Asia,false,"We’re a world-leading smart mobility SaaS tech company with over 1.4 millions subscribers across 23 countries. Our teams are collaborative, vibrant,...",full_time,3732211,false,true,Senior Mobile Developer,https://www.jobstreet.co.id/id/job/senior-mobile-developer-3732211?token=0~b4e49505-98fb-4020-ad52-cfe67aa172b8&sectionRank=464&jobId=jobstreet-id-job-3732211,Jakarta Raya,9 hours ago,2021-12-24T08:46:47Z,,,,monthly,,"International Collaboration and Teamwork,Innovative & Emerging technologies industry"
standout,"502,137","Sumber Daya Manusia/Personalia,Sumber Daya Manusia / HR",jobstreet-id-269447,PT Mitra Angkasa Sejahtera (Jakarta),false,"HRGA STAFFKriteria :1. Penampilan rapih2. Usia maksimal 30 tahun3. Sehat jasmani dan rohani4. Lulusan D3 ~ S15. Berakhlak baik, santun, berkemampuan...",contract,3732210,false,true,HRGA STAFF ADMIN,https://www.jobstreet.co.id/id/job/hrga-staff-admin-3732210?token=0~b4e49505-98fb-4020-ad52-cfe67aa172b8&sectionRank=465&jobId=jobstreet-id-job-3732210,Jakarta Barat,9 hours ago,2021-12-24T08:46:24Z,,,,monthly,,
standard,"502,133","Sumber Daya Manusia/Personalia,Staf / Administrasi umum",jobstreet-id-343896,UNDR ctrl,false,UNDR Ctrl membuka Lowongan Admin Online dengan persyaratan : Pendidikan minimal SMA / SMK sederajat. Familiar dengan Marketplace. Menguasai Ms Office....,full_time,3732209,false,false,ADMIN ONLINE,https://www.jobstreet.co.id/id/job/admin-online-3732209?token=0~b4e49505-98fb-4020-ad52-cfe67aa172b8&sectionRank=466&jobId=jobstreet-id-job-3732209,Surabaya,9 hours ago,2021-12-24T08:45:32Z,IDR,2500000,3500000,monthly,,
standout,"513,112","Layanan Kesehatan,Farmasi",jobstreet-id-175774,PT Harsen Laboratories,false,Responsibilities : -         Maintaining relationship between Hospitals and Clinics to participate in sending samples to...,full_time,3732208,false,true,SALES MARKETING INSTITUTION (Laboratorium Clinic),https://www.jobstreet.co.id/id/job/sales-marketing-institution-laboratorium-clinic-3732208?token=0~b4e49505-98fb-4020-ad52-cfe67aa172b8&sectionRank=467&jobId=jobstreet-id-job-3732208,Jakarta Raya,9 hours ago,2021-12-24T08:44:02Z,,,,monthly,,
standard,"505,147","Pelayanan,Logistik/Rantai Pasokan",jobstreet-id-317487,PT MAN Energy Solutions Indonesia - Surabaya,false,"Manages all the import/export processes, inbound/outbound shipments and related documentation to meet the on-time delivery and lowest optimized costs...",full_time,3732207,false,false,Logistics Supervisor,https://www.jobstreet.co.id/id/job/logistics-supervisor-3732207?token=0~b4e49505-98fb-4020-ad52-cfe67aa172b8&sectionRank=468&jobId=jobstreet-id-job-3732207,Jawa Timur,9 hours ago,2021-12-24T08:43:33Z,,,,monthly,,
standout,"503,139","Penjualan / Pemasaran,Pemasaran/Pengembangan Bisnis",430066,PT Abadinusa Usaha Semesta,false,Tugas &amp; Tanggung Jawab : Bertanggung jawab atas pengembangan produk Mengetahui kebutuhan pelanggan melalui riset pasar Berkomunikasi dengan tim...,full_time,3732206,false,true,Product Manager,https://www.jobstreet.co.id/id/job/product-manager-3732206?token=0~b4e49505-98fb-4020-ad52-cfe67aa172b8&sectionRank=469&jobId=jobstreet-id-job-3732206,Jakarta Raya,9 hours ago,2021-12-24T08:42:44Z,,,,monthly,,
standout,"503,145","Penjualan / Pemasaran,Penjualan Ritel",430066,PT Abadinusa Usaha Semesta,false,Tugas &amp; Tanggung Jawab : Melakukan pekerjaan utama untuk posisi Sales Executive Membuat perencanaan strategi penjualan Mempromosikan &amp;...,full_time,3732204,false,true,Sales Executive,https://www.jobstreet.co.id/id/job/sales-executive-3732204?token=0~b4e49505-98fb-4020-ad52-cfe67aa172b8&sectionRank=470&jobId=jobstreet-id-job-3732204,"Jakarta Raya,Medan,Bandung,Semarang,Surabaya,Makassar",9 hours ago,2021-12-24T08:42:11Z,,,,monthly,,
standard,"506,107","Hotel/Restoran,Makanan/Minuman/Pelayanan Restoran",430426,ANUGERAH GROUP,false,Requirements : Relevant educational background with the position applied Minimum 1 year of relevant experience in similar positions Excellent...,full_time,3732202,false,false,Waiter / Waitress,https://www.jobstreet.co.id/id/job/waiter-waitress-3732202?token=0~b4e49505-98fb-4020-ad52-cfe67aa172b8&sectionRank=471&jobId=jobstreet-id-job-3732202,Jawa Tengah,9 hours ago,2021-12-24T08:40:00Z,,,,monthly,,
standard,"506,107","Hotel/Restoran,Makanan/Minuman/Pelayanan Restoran",jobstreet-id-343888,LESUNG KRESEK,false,Kualifikasi :1. Memiliki pengalaman di bidang yang sama2. Minimal lulusan SMA / SMK atau sederajat3. Penempatan di Lesung Kresek Madiun4. Siap bekerja...,full_time,3732201,false,false,Kitchen Crew,https://www.jobstreet.co.id/id/job/kitchen-crew-3732201?token=0~b4e49505-98fb-4020-ad52-cfe67aa172b8&sectionRank=472&jobId=jobstreet-id-job-3732201,Madiun,9 hours ago,2021-12-24T08:39:57Z,,,,monthly,,
