adType,categoriesCode,categoriesName,companyId,companyName,companyPrivate,description,employment,id,isClassified,isStandout,jobTitle,jobUrl,locations,postingDuration,postedAt,salarycurrency,salaryMin,salaryMax,salaryPeriod,salaryTerm,sellingPoints
standout,"511,184","Bangunan/Konstruksi,Teknik Sipil/Konstruksi Bangunan",jobstreet-id-167927,PT LSS Global Kontraktor,false,Kualifikasi : Bertanggung jawab dalam perhitungan dan perencanaan untuk penawaran / submit tender secara detail dan akurat Diutamakan berpengalaman...,full_time,3725804,false,true,Engineer Coordinator,https://www.jobstreet.co.id/id/job/engineer-coordinator-3725804?token=0~abe88d9e-e8fd-41ba-97c3-7b723ea8914e&sectionRank=372&jobId=jobstreet-id-job-3725804,Sidoarjo,13 hours ago,2021-12-18T04:41:42Z,,,,monthly,,
standard,"504,100","Seni/Media/Komunikasi,Periklanan",437458,PT Surya Citra Televisi  ( SCTV ),false,Responsibilities: Ensuring the process of advertising materials from clients to editor until MCR &amp; broadcasting. Filling in advertising version...,full_time,3725803,false,false,Traffic Operational Media Copy,https://www.jobstreet.co.id/id/job/traffic-operational-media-copy-3725803?token=0~abe88d9e-e8fd-41ba-97c3-7b723ea8914e&sectionRank=373&jobId=jobstreet-id-job-3725803,Jakarta Pusat,13 hours ago,2021-12-18T04:39:45Z,,,,monthly,,
standout,"503,145","Penjualan / Pemasaran,Penjualan Ritel",,,true,Key Job Requirement :   Bachelor’s Degree in any background from top tier university At least 2 years as Key Account Executive from reputable Fast...,full_time,3725802,false,true,Key Account Executive - Jakarta (FMCG),https://www.jobstreet.co.id/id/job/key-account-executive-jakarta-fmcg-3725802?token=0~abe88d9e-e8fd-41ba-97c3-7b723ea8914e&sectionRank=374&jobId=jobstreet-id-job-3725802,Jakarta Raya,13 hours ago,2021-12-18T04:38:09Z,,,,monthly,,
standard,"501,131","Akuntansi / Keuangan,Akuntansi Umum / Pembiayaan",431815,PT Daidan Aditama Yaksa,false,Job Requirements:1.      Have a good communication skill2.      Able to be fast responsive on online communication3.      Able to work under pressure...,full_time,3725801,false,false,Account Executive,https://www.jobstreet.co.id/id/job/account-executive-3725801?token=0~abe88d9e-e8fd-41ba-97c3-7b723ea8914e&sectionRank=375&jobId=jobstreet-id-job-3725801,Jakarta Raya,13 hours ago,2021-12-18T04:33:11Z,,,,monthly,,
standout,"503,203","Penjualan / Pemasaran,Digital Marketing",451327,Aisyah Morioka Industries,false,"Bertanggung jawab terhadap pengembangan/ Branding strategi produk-produk, baik dari produk existing (reformulasi dan redesain) maupun produk-produk...",full_time,3725800,false,true,Creative Campaign,https://www.jobstreet.co.id/id/job/creative-campaign-3725800?token=0~abe88d9e-e8fd-41ba-97c3-7b723ea8914e&sectionRank=376&jobId=jobstreet-id-job-3725800,Jakarta Timur,13 hours ago,2021-12-18T04:31:48Z,IDR,5000000,7000000,monthly,,
standout,"503,139","Penjualan / Pemasaran,Pemasaran/Pengembangan Bisnis",,,true,Responsibilities: Analyzing and evaluating existing product from 4Ps perspective (Product Price Promotion Positioning). Making yearly marketing plan...,full_time,3725799,false,true,Marketing Manager - FMCG,https://www.jobstreet.co.id/id/job/marketing-manager-fmcg-3725799?token=0~abe88d9e-e8fd-41ba-97c3-7b723ea8914e&sectionRank=377&jobId=jobstreet-id-job-3725799,Jakarta Raya,13 hours ago,2021-12-18T04:26:34Z,,,,monthly,,
standout,"503,139","Penjualan / Pemasaran,Pemasaran/Pengembangan Bisnis",jobstreet-id-209627,WWIEK MUSLIMAH,false,"Sebagai Marketing Manager memiliki tugas dan fungsi utama bertanggung jawab pada semua aktivitas operasional perusahaan yang dibawahinya, mulai dari...",full_time,3725798,false,true,Marketing Manager,https://www.jobstreet.co.id/id/job/marketing-manager-3725798?token=0~abe88d9e-e8fd-41ba-97c3-7b723ea8914e&sectionRank=378&jobId=jobstreet-id-job-3725798,Jakarta Barat,13 hours ago,2021-12-18T04:26:08Z,,,,monthly,,"Lingkungan kerja kekeluargaan,Bisnis sedang berkembang pesat"
standout,"513,113","Layanan Kesehatan,Diagnosa/Lainnya",jobstreet-id-340244,Klinik Radini Fisioterapi Center,false,Persyaratan : Pendidikan Profesi Dokter Spesialis Rehabilitasi Medis / KFR Memiliki Surat Register (STR) dari Konsil Kedokteran yang masih berlaku...,contract,3725797,false,true,Dokter Rehabilitasi Medis,https://www.jobstreet.co.id/id/job/dokter-rehabilitasi-medis-3725797?token=0~abe88d9e-e8fd-41ba-97c3-7b723ea8914e&sectionRank=379&jobId=jobstreet-id-job-3725797,Jakarta Timur,13 hours ago,2021-12-18T04:25:30Z,,,,monthly,,
standout,"503,203","Penjualan / Pemasaran,Digital Marketing",jobstreet-id-12735,PT Made Chahaya ( Lily Jean ),false,"Lily Jean Bali is looking for Digital Marketing and E – Commerce Specialist who is responsible for engaging, converting and keeping loyal consumers,...",full_time,3725796,false,true,Digital Marketing & E – Commerce Specialist,https://www.jobstreet.co.id/id/job/digital-marketing-e-commerce-specialist-3725796?token=0~abe88d9e-e8fd-41ba-97c3-7b723ea8914e&sectionRank=380&jobId=jobstreet-id-job-3725796,Badung,13 hours ago,2021-12-18T04:23:33Z,IDR,6000000,8000000,monthly,,
standout,"503,145","Penjualan / Pemasaran,Penjualan Ritel",,,true,Qualification: Bachelor’s Degree from any major At least 3 year experience as Area Sales Supervisor from reputable FMCG company Working Placement...,full_time,3725795,false,true,Area Sales Supervisor - Karawang,https://www.jobstreet.co.id/id/job/area-sales-supervisor-karawang-3725795?token=0~abe88d9e-e8fd-41ba-97c3-7b723ea8914e&sectionRank=381&jobId=jobstreet-id-job-3725795,Jawa Barat,13 hours ago,2021-12-18T04:20:52Z,,,,monthly,,
standout,"514,116","Lainnya,Lainnya/Kategori tidak tersedia",jobstreet-id-291142,PT. Emitraco Transportasi Mandiri,false,"Pendidikan minimal D3/S1 semua jurusan Usia minimal 35 tahun Pengalaman 5 tahun dibidang Pelabuhan, Alat Berat dan Transportasi Bertanggung jawab,...",full_time,3725794,false,true,Branch Manager,https://www.jobstreet.co.id/id/job/branch-manager-3725794?token=0~abe88d9e-e8fd-41ba-97c3-7b723ea8914e&sectionRank=382&jobId=jobstreet-id-job-3725794,Batam,13 hours ago,2021-12-18T04:17:53Z,IDR,8000000,15000000,monthly,,"Bpjs Ketenagakerjaan,Bpjs Kesehatan"
standout,"503,145","Penjualan / Pemasaran,Penjualan Ritel",,,true,Qualification: Bachelor’s Degree from any major At least 3 year experience as Area Sales Manager from reputable FMCG company Working Placement :...,full_time,3725793,false,true,Area Sales Manager - Jawa Barat,https://www.jobstreet.co.id/id/job/area-sales-manager-jawa-barat-3725793?token=0~abe88d9e-e8fd-41ba-97c3-7b723ea8914e&sectionRank=383&jobId=jobstreet-id-job-3725793,Bekasi,13 hours ago,2021-12-18T04:17:40Z,,,,monthly,,
standout,"503,145","Penjualan / Pemasaran,Penjualan Ritel",,,true,Qualification: Bachelor’s Degree from any major At least 5 year experience as Area Sales Supervisor from reputable FMCG company Working Placement...,full_time,3725792,false,true,Area Sales Supervisor - Bojonegoro,https://www.jobstreet.co.id/id/job/area-sales-supervisor-bojonegoro-3725792?token=0~abe88d9e-e8fd-41ba-97c3-7b723ea8914e&sectionRank=384&jobId=jobstreet-id-job-3725792,Jawa Timur,13 hours ago,2021-12-18T04:14:12Z,,,,monthly,,
standard,"503,145","Penjualan / Pemasaran,Penjualan Ritel",437302,PT Sukanda Djaya,false,Pendidikan minimal SMA/SMK Semua Jurusan Usia masimal 30 tahun Berpengalaman sebagai salesman FMCG makanan dan minuman minimal 2 tahun di area Tegal...,full_time,3725791,false,false,Salesman GT (Tegal Branch),https://www.jobstreet.co.id/id/job/salesman-gt-tegal-branch-3725791?token=0~abe88d9e-e8fd-41ba-97c3-7b723ea8914e&sectionRank=385&jobId=jobstreet-id-job-3725791,Tegal,13 hours ago,2021-12-18T04:14:04Z,,,,monthly,,
standout,"503,139","Penjualan / Pemasaran,Pemasaran/Pengembangan Bisnis",,,true,"Roles &amp; Responsibilities : Develop new, different, better concepts consistent with the brand's sense of purpose, by integrating consumer insights...",full_time,3725790,false,true,Product Innovation Manager,https://www.jobstreet.co.id/id/job/product-innovation-manager-3725790?token=0~abe88d9e-e8fd-41ba-97c3-7b723ea8914e&sectionRank=386&jobId=jobstreet-id-job-3725790,Jakarta Barat,13 hours ago,2021-12-18T04:12:58Z,,,,monthly,,
standout,"503,203","Penjualan / Pemasaran,Digital Marketing",451720,PT Oskindo Sejahtera Kencana,false,"Tanggung Jawab Pekerjaan :– Mengelola Media Sosial dan melakukan kegiatan yang memancing followers baru– Membuat konten untuk FB, Tik tok, Ig ,...",full_time,3725789,false,true,Content Creator,https://www.jobstreet.co.id/id/job/content-creator-3725789?token=0~abe88d9e-e8fd-41ba-97c3-7b723ea8914e&sectionRank=387&jobId=jobstreet-id-job-3725789,Tangerang,13 hours ago,2021-12-18T04:12:50Z,,,,monthly,,"Gaji Pokok, Jenjang Karier"
standard,"506,107","Hotel/Restoran,Makanan/Minuman/Pelayanan Restoran",jobstreet-id-342296,Wisata Edukasi Bungker Kopi Sido Luhur,false,Kualifikasi : Memiliki jiwa pejuang Memiliki kemampuan berkomunikasi yang baik Memiliki loyalitas dan kemauan untuk maju yang tinggi Memiliki...,full_time,3725788,false,false,General Manager,https://www.jobstreet.co.id/id/job/general-manager-3725788?token=0~abe88d9e-e8fd-41ba-97c3-7b723ea8914e&sectionRank=388&jobId=jobstreet-id-job-3725788,Malang,13 hours ago,2021-12-18T04:11:30Z,,,,monthly,,
standout,"510,140","Manufaktur,Pembelian/Manajemen Material",506954,PT Sumatera Kartindo,false,Tugas dan Tanggung Jawab : Mencari &amp; menganalisa calon Vendor/ Supplier yang tepat untuk pembelian barang/ jasa. Melakukan follow up dan negosiasi...,full_time,3725786,false,true,Admin Purchasing,https://www.jobstreet.co.id/id/job/admin-purchasing-3725786?token=0~abe88d9e-e8fd-41ba-97c3-7b723ea8914e&sectionRank=389&jobId=jobstreet-id-job-3725786,Medan,13 hours ago,2021-12-18T04:11:06Z,,,,monthly,,"BPJS Ketenagakerjaan,BPJS Kesehatan"
standout,"503,203","Penjualan / Pemasaran,Digital Marketing",428085,PT Priskila Prima Makmur,false,"Key job responsibilities: Creative Concept &amp; Content, awaken response &amp; emotion  Contribute new approaches and Strategies Passionate in Visual...",full_time,3725785,false,true,Social Media Content Officer,https://www.jobstreet.co.id/id/job/social-media-content-officer-3725785?token=0~abe88d9e-e8fd-41ba-97c3-7b723ea8914e&sectionRank=390&jobId=jobstreet-id-job-3725785,Jakarta Raya,13 hours ago,2021-12-18T04:10:08Z,,,,monthly,,
standard,"506,107","Hotel/Restoran,Makanan/Minuman/Pelayanan Restoran",437363,PT SUMBER NATURAL INDONESIA,false,Qualification : Maksimal 28 Tahun.  Minimum Pendidikan SMA Sederajat  Fresh graduate dapat melamar untuk posisi ini.  Komunikatif dan memiliki suara...,full_time,3725784,false,false,Waiters Kasir,https://www.jobstreet.co.id/id/job/waiters-kasir-3725784?token=0~489af70c-a596-4676-895d-d46bb1021995&sectionRank=391&jobId=jobstreet-id-job-3725784,"Jakarta Raya,Bekasi,Bogor,Depok,Tangerang",13 hours ago,2021-12-18T04:08:58Z,,,,monthly,,
standard,"503,145","Penjualan / Pemasaran,Penjualan Ritel",jobstreet-id-76034,CV Daya Motor II,false,Persyaratan: Minimal pendidikan SMU Sederajat Sedang tidak kuliah Usia Maksimal 30 tahun Bersedia ditempatkan di Kota Batam Tempat tinggal &amp;...,contract,3725783,false,false,Salesman,https://www.jobstreet.co.id/id/job/salesman-3725783?token=0~489af70c-a596-4676-895d-d46bb1021995&sectionRank=392&jobId=jobstreet-id-job-3725783,Pontianak,13 hours ago,2021-12-18T04:08:29Z,,,,monthly,,
standout,"503,139","Penjualan / Pemasaran,Pemasaran/Pengembangan Bisnis",428085,PT Priskila Prima Makmur,false,Job Description Prepare and develop product and sales concept according to Brand Implement marketing plan and strategy to support and create brand...,full_time,3725782,false,true,Brand Manager,https://www.jobstreet.co.id/id/job/brand-manager-3725782?token=0~489af70c-a596-4676-895d-d46bb1021995&sectionRank=393&jobId=jobstreet-id-job-3725782,Jakarta Raya,13 hours ago,2021-12-18T04:08:23Z,,,,monthly,,
standard,"503,142","Penjualan / Pemasaran,Penjualan - Korporasi",jobstreet-id-322226,voxnet.id,false,REQUIREMENTS• Indonesian• Having working experience in Internet Service Provider or Telco industry at least 2 years.• Having proved Sales Portofolio.•...,full_time,3725781,false,false,Sales Account (ISP) Jakarta - Jogya - Semarang,https://www.jobstreet.co.id/id/job/sales-account-isp-jakarta-jogya-semarang-3725781?token=0~489af70c-a596-4676-895d-d46bb1021995&sectionRank=394&jobId=jobstreet-id-job-3725781,"Jakarta Raya,Yogyakarta,Semarang",13 hours ago,2021-12-18T04:05:34Z,,,,monthly,,
standout,"503,145","Penjualan / Pemasaran,Penjualan Ritel",,,true,Qualification: Bachelor’s Degree from any major At least 5 year experience as Area Sales Coordinator from reputable FMCG company Working Placement...,full_time,3725780,false,true,Area Sales Coordinator - Kepulauan Riau,https://www.jobstreet.co.id/id/job/area-sales-coordinator-kepulauan-riau-3725780?token=0~489af70c-a596-4676-895d-d46bb1021995&sectionRank=395&jobId=jobstreet-id-job-3725780,Batam,13 hours ago,2021-12-18T04:04:47Z,,,,monthly,,
standout,"503,203","Penjualan / Pemasaran,Digital Marketing",jobstreet-id-314336,KLAR Smile,false,"Responsibilities: Create social media campaigns and top-line communications strategies, ensuring target audience acquisition and supporting brand and...",full_time,3725779,false,true,Social Media Specialist,https://www.jobstreet.co.id/id/job/social-media-specialist-3725779?token=0~489af70c-a596-4676-895d-d46bb1021995&sectionRank=396&jobId=jobstreet-id-job-3725779,Jakarta Selatan,13 hours ago,2021-12-18T04:03:08Z,IDR,8000000,13000000,monthly,,
standout,"510,194","Manufaktur,Manufaktur",,,true,"Deskripsi Pekerjaan : Bertanggung jawab membuat standarisasi kemas Kosmetik, baik kemas primer maupun kemas sekunder Bertanggung jawab dalam...",full_time,3725778,false,true,Packaging Development Supervisor - FMCG,https://www.jobstreet.co.id/id/job/packaging-development-supervisor-fmcg-3725778?token=0~489af70c-a596-4676-895d-d46bb1021995&sectionRank=397&jobId=jobstreet-id-job-3725778,Jakarta Barat,13 hours ago,2021-12-18T04:02:58Z,,,,monthly,,
standout,"513,112","Layanan Kesehatan,Farmasi",,,true,Deskripsi Pekerjaan :  Memastikan seluruh metode analisa yang dihasilkan dapat dipakai di Laboratorium R&amp;D dan Quality Control untuk pemeriksaan...,full_time,3725776,false,true,R&D Analytical Development Supervisor - FMCG,https://www.jobstreet.co.id/id/job/r-d-analytical-development-supervisor-fmcg-3725776?token=0~489af70c-a596-4676-895d-d46bb1021995&sectionRank=398&jobId=jobstreet-id-job-3725776,Jakarta Barat,13 hours ago,2021-12-18T04:01:48Z,,,,monthly,,
standout,"510,140","Manufaktur,Pembelian/Manajemen Material",428179,PT Sarana Agro Indo Jaya,false,Deskripsi Pekerjaan Melakukan input data ke program dengan cepat dan benar Menyediakan laporan data stock dengan cepat dan tepat akurat Membuat surat...,full_time,3725775,false,true,Admin Gudang / Admin Accounting,https://www.jobstreet.co.id/id/job/admin-gudang-admin-accounting-3725775?token=0~489af70c-a596-4676-895d-d46bb1021995&sectionRank=399&jobId=jobstreet-id-job-3725775,Bandung,13 hours ago,2021-12-18T04:01:24Z,IDR,3000000,3900000,monthly,,
standout,"512,204","Sains,Biomedis",,,true,"Uraian Pekerjaan : Bertanggung jawab dalam pembuatan dan pengembangan formula baik formula baru, existing dan produk inovatif sesuai dengan...",full_time,3725774,false,true,R&D Formulator Supervisor - FMCG (Cosmetic),https://www.jobstreet.co.id/id/job/r-d-formulator-supervisor-fmcg-cosmetic-3725774?token=0~489af70c-a596-4676-895d-d46bb1021995&sectionRank=400&jobId=jobstreet-id-job-3725774,Jakarta Barat,14 hours ago,2021-12-18T04:00:28Z,,,,monthly,,
standout,"503,145","Penjualan / Pemasaran,Penjualan Ritel",428179,PT Sarana Agro Indo Jaya,false,MARKETING TEXTILE FASHIONDeskripsi Pekerjaan·      Kualifikasi :Ø Usia maksimal 35 tahunØ Pengalaman dalam bidang pemasaran industry textile/garment...,full_time,3725773,false,true,SALES & MARKETTING TEXTILE FASHION,https://www.jobstreet.co.id/id/job/sales-marketting-textile-fashion-3725773?token=0~489af70c-a596-4676-895d-d46bb1021995&sectionRank=401&jobId=jobstreet-id-job-3725773,Bandung,14 hours ago,2021-12-18T04:00:17Z,,,,monthly,,
standout,"514,104","Lainnya,Jurnalis/Editor",jobstreet-id-305720,Owuri,false,Kualifikasi : 工作要求Usia 20-35 Tahun年纪20-35岁之间Diwajibkan bisa berbahasa Mandarin lisan (Bisa baca dan Tulis lebih...,full_time,3725772,false,true,MANDARIN TRANSLATOR（中文翻译）,https://www.jobstreet.co.id/id/job/mandarin-translator%EF%BC%88%E4%B8%AD%E6%96%87%E7%BF%BB%E8%AF%91%EF%BC%89-3725772?token=0~489af70c-a596-4676-895d-d46bb1021995&sectionRank=402&jobId=jobstreet-id-job-3725772,Jakarta Barat,14 hours ago,2021-12-18T03:59:45Z,IDR,8000000,15000000,monthly,,
standard,"503,145","Penjualan / Pemasaran,Penjualan Ritel",386274,Ninja Xpress,false,"Responsible as Business representative to prospect and build a pipeline of qualified leads to meet business plans, perform daily cold call in order to...",full_time,3725771,false,false,Sales Executive Kediri,https://www.jobstreet.co.id/id/job/sales-executive-kediri-3725771?token=0~489af70c-a596-4676-895d-d46bb1021995&sectionRank=403&jobId=jobstreet-id-job-3725771,Kediri,14 hours ago,2021-12-18T03:58:17Z,,,,monthly,,
standout,"511,150","Bangunan/Konstruksi,Properti/Real Estate",jobstreet-id-232495,PT. BERKAT PROPERTINDO INDONESIA,false,BEYOND Property Indonesia merupakan sebuah komunitas bagi mereka yang menginginkan penghasilan besar dan berencana untuk menjadi orang kaya dengan...,contract,3725770,false,true,MARKETING PROPERTY,https://www.jobstreet.co.id/id/job/marketing-property-3725770?token=0~489af70c-a596-4676-895d-d46bb1021995&sectionRank=404&jobId=jobstreet-id-job-3725770,Bandung,14 hours ago,2021-12-18T03:54:14Z,,,,monthly,,"Tunjangan kesehatan,Lingkungan kerja yang baik,Reward"
standard,"503,142","Penjualan / Pemasaran,Penjualan - Korporasi",jobstreet-id-185248,Pt Delta Primalab Saintifik,false,Anda Seorang Yang Memiliki Latar Belakang Pendidikan di Bidang Science ?Memiliki Motivasi untuk Berkembang dan Ulet ? PT Delta Primalab Saintifik...,full_time,3725769,false,false,Life Sciences Sales Executive,https://www.jobstreet.co.id/id/job/life-sciences-sales-executive-3725769?token=0~489af70c-a596-4676-895d-d46bb1021995&sectionRank=405&jobId=jobstreet-id-job-3725769,Banten,14 hours ago,2021-12-18T03:52:40Z,,,,monthly,,
standard,"504,101","Seni/Media/Komunikasi,Seni / Desain Kreatif",jobstreet-id-278790,PT Bisnis Bersama Karunia,false,Membuat Konten video yang Winning Kerjasama dengan tim untuk menciptakan ide dan gagasan baru  Memberi - merancang - membuat konsep ide materi berupa...,full_time,3725766,false,false,Video Editor,https://www.jobstreet.co.id/id/job/video-editor-3725766?token=0~489af70c-a596-4676-895d-d46bb1021995&sectionRank=406&jobId=jobstreet-id-job-3725766,Banten,14 hours ago,2021-12-18T03:40:51Z,IDR,4500000,6300000,monthly,,
standard,"514,110","Lainnya,Pekerjaan Umum",439932,PT Multi Wahana Kencana,false,Deskripsi PekerjaanKualifikasi : Pendidikan minimal SMA / SMK Sederajat Memiliki minimal SIM B1 Umum dan atau SIM B2 / B2 umum (bisa mengendarai mobil...,full_time,3725763,false,false,DRIVER,https://www.jobstreet.co.id/id/job/driver-3725763?token=0~489af70c-a596-4676-895d-d46bb1021995&sectionRank=407&jobId=jobstreet-id-job-3725763,Bandung,14 hours ago,2021-12-18T03:36:29Z,IDR,2800000,3200000,monthly,,
standout,"503,202","Penjualan / Pemasaran,E-commerce",jobstreet-id-223799,PT. Triguna Medika Pratama,false,Memahami teknis &amp; konsep digital marketing &amp; E-Commerce secara umum. Cepat belajar dan adaptif dengan teknologi baru. Mampu berkomunikasi...,full_time,3725762,false,true,Admin E-Commerce,https://www.jobstreet.co.id/id/job/admin-e-commerce-3725762?token=0~489af70c-a596-4676-895d-d46bb1021995&sectionRank=408&jobId=jobstreet-id-job-3725762,Surabaya,14 hours ago,2021-12-18T03:35:48Z,IDR,3600000,5040000,monthly,,Insentif penjualan
standout,"503,151","Penjualan / Pemasaran,Telesales/Telemarketing",jobstreet-id-38392,PT Setiawan Mitra Utama Logistik,false,"Kualifikasi : Pendidikan min D3 segala jurusan. Pengalaman min 2 tahun di bidang marketing dan diutamakan berpengalaman sebagai marketing bank,...",full_time,3725761,false,true,MARKETING,https://www.jobstreet.co.id/id/job/marketing-3725761?token=0~489af70c-a596-4676-895d-d46bb1021995&sectionRank=409&jobId=jobstreet-id-job-3725761,Surabaya,14 hours ago,2021-12-18T03:35:32Z,,,,monthly,,"Memberikan Peluang Pengembangan Karier,BPJS Ketenagakerjaan, BPJS Kesehatan, Voucher Belanja,Budaya kerja yang inovatif dan penuh semangat"
standout,"508,191","Komputer/Teknologi Informasi,IT-Perangkat Lunak",439305,PT. Majoo Teknologi Indonesia,false,"Job Descriptions:Your daily activities are to gather business requirements, create detailed requirements, communicate requirements to the development...",full_time,3725760,false,true,Product Owner,https://www.jobstreet.co.id/id/job/product-owner-3725760?token=0~489af70c-a596-4676-895d-d46bb1021995&sectionRank=410&jobId=jobstreet-id-job-3725760,Jakarta Raya,14 hours ago,2021-12-18T03:29:30Z,,,,monthly,,"Medical / Health Insurance,Flexitime,Work From Home"
standard,"510,194","Manufaktur,Manufaktur",437399,Sunrecruit Indonesia,false,"for our client new startup manufacturing located in Tangerang, looking for Factory Operation Manager with details as follow:  About the Role : Reviews...",full_time,3725759,false,false,Factory Operation Manager,https://www.jobstreet.co.id/id/job/factory-operation-manager-3725759?token=0~489af70c-a596-4676-895d-d46bb1021995&sectionRank=411&jobId=jobstreet-id-job-3725759,Banten,14 hours ago,2021-12-18T03:29:15Z,,,,monthly,,
standard,"503,143","Penjualan / Pemasaran,Penjualan - Teknik/Teknikal/IT",433285,PT Harta Ban Indonesia,false,"Tanggung Jawab: Mempromosikan dan memasarkan produk-produk ban berkualitas tinggi kepada para konsumen dalam bisnis industri pertambangan, perkebunan,...",full_time,3725758,false,false,SALES & MARKETING TYRE - BANJARMASIN,https://www.jobstreet.co.id/id/job/sales-marketing-tyre-banjarmasin-3725758?token=0~489af70c-a596-4676-895d-d46bb1021995&sectionRank=412&jobId=jobstreet-id-job-3725758,Banjarbaru,14 hours ago,2021-12-18T03:28:26Z,IDR,3000000,4000000,monthly,,
standout,"507,121","Pendidikan/Pelatihan,Pelatihan & Pengembangan",428000,PT Phitagoras Global Duta,false,Kualifikasi - Pendidikan minimal S1- Memiliki pengalaman dibidangnya minimal 10 tahun- Memiliki pengalaman sebagai Trainer / konsultan- Diutamakan...,full_time,3725756,false,true,QHSE Trainer / Consultant,https://www.jobstreet.co.id/id/job/qhse-trainer-consultant-3725756?token=0~489af70c-a596-4676-895d-d46bb1021995&sectionRank=413&jobId=jobstreet-id-job-3725756,Tangerang,14 hours ago,2021-12-18T03:25:10Z,,,,monthly,,
standout,"502,133","Sumber Daya Manusia/Personalia,Staf / Administrasi umum",jobstreet-id-286171,PT JARINGAN TOKOBAKO NUSANTARA,false,ADMIN GUDANG: PENDIDIKAN MINIMAL D3 ADA SIM A DAN C PENGALAMAN MINIMAL 1 TAHUN DIBAGIAN GUDANG TERBIASA STOK OPNAME BARANG ANALISA KUAT DAN PAHAM ALUR...,full_time,3725754,false,true,ADM. GUDANG,https://www.jobstreet.co.id/id/job/adm-gudang-3725754?token=0~489af70c-a596-4676-895d-d46bb1021995&sectionRank=414&jobId=jobstreet-id-job-3725754,Jawa Tengah,14 hours ago,2021-12-18T03:21:38Z,IDR,2500000,3000000,monthly,,
standard,"505,119","Pelayanan,Angkatan Bersenjata",1742,G4S Indonesia,false,Kualifikasi: Minimal Umur 21 tahun Maksimal umur 35 tahun Minimal Pendidikan SMA/SMK Sederajat Bisa mengoprasikan komputer min. microsoft office...,full_time,3725753,false,false,Security Officer,https://www.jobstreet.co.id/id/job/security-officer-3725753?token=0~489af70c-a596-4676-895d-d46bb1021995&sectionRank=415&jobId=jobstreet-id-job-3725753,"Jawa Barat,Jakarta Raya,Papua",14 hours ago,2021-12-18T03:21:27Z,,,,monthly,,
standard,"511,184","Bangunan/Konstruksi,Teknik Sipil/Konstruksi Bangunan",437663,PT Tekniko Indonesia,false,REQUIREMENTS : Candidate must possess at least Bachelor's Degree in Civil Engineering or equivalent. At least 7 years of working experience for this...,full_time,3725752,false,false,Chief Engineer,https://www.jobstreet.co.id/id/job/chief-engineer-3725752?token=0~489af70c-a596-4676-895d-d46bb1021995&sectionRank=416&jobId=jobstreet-id-job-3725752,Balikpapan,14 hours ago,2021-12-18T03:21:00Z,,,,monthly,,
standout,"511,150","Bangunan/Konstruksi,Properti/Real Estate",jobstreet-id-158732,Koperasi Property Today Indonesia,false,Melakukan posting iklan di media online Menerima respon konsumen Melakukan follow up kepada konsumen Melayani survey lokasi kepada konsumen Melayani...,full_time,3725751,false,true,Marketing Property,https://www.jobstreet.co.id/id/job/marketing-property-3725751?token=0~489af70c-a596-4676-895d-d46bb1021995&sectionRank=417&jobId=jobstreet-id-job-3725751,Yogyakarta,14 hours ago,2021-12-18T03:18:37Z,,,,monthly,,"Mendapatkan bonus penjualan sebesar 2,5%,Pelatihan Pengembangan Diri dan Kompetensi secara berkala,Fasilitas mobil operasional, budget iklan, dan tools digital"
standard,"511,184","Bangunan/Konstruksi,Teknik Sipil/Konstruksi Bangunan",jobstreet-id-161837,PT Kumala Cemerlang Abadi,false,REQUIREMENTS: Usia Maks. 35 Tahun Pendidikan min. S1 Teknik Sipil / Arsitektur Berpengalaman di bidang terkait min. 1 tahun Memahami aturan kerja...,full_time,3725750,false,false,Drafter & Estimator Project,https://www.jobstreet.co.id/id/job/drafter-estimator-project-3725750?token=0~489af70c-a596-4676-895d-d46bb1021995&sectionRank=418&jobId=jobstreet-id-job-3725750,Makassar,14 hours ago,2021-12-18T03:18:02Z,IDR,3500000,4900000,monthly,,
