adType,categoriesCode,categoriesName,companyId,companyName,companyPrivate,description,employment,id,isClassified,isStandout,jobTitle,jobUrl,locations,postingDuration,postedAt,salarycurrency,salaryMin,salaryMax,salaryPeriod,salaryTerm,sellingPoints
standout,"508,191","Komputer/Teknologi Informasi,IT-Perangkat Lunak",426742,PT Dua Puluh Empat Jam Online (UniPin),false,"The ideal candidate will be responsible for designing, developing, testing, and debugging responsive web and mobile applications for the company.Job...",full_time,3722173,false,true,Front End Developer,https://www.jobstreet.co.id/id/job/front-end-developer-3722173?token=0~ea6d5a5b-5e43-4793-92bb-435226b4ac2d&sectionRank=596&jobId=jobstreet-id-job-3722173,Tangerang,22 hours ago,2021-12-24T20:00:48Z,,,,monthly,,
standout,"508,191","Komputer/Teknologi Informasi,IT-Perangkat Lunak",jobstreet-id-14069,PT Gunatronikatama Cipta (GASI),false,"Confirm project requirements by reviewing program objective, input data and output requirement with supervisor and client. Prepare programming...",full_time,3722176,false,true,JAVA PROGRAMMER,https://www.jobstreet.co.id/id/job/java-programmer-3722176?token=0~ea6d5a5b-5e43-4793-92bb-435226b4ac2d&sectionRank=597&jobId=jobstreet-id-job-3722176,Jakarta Raya,22 hours ago,2021-12-24T20:00:48Z,IDR,10000000,15000000,monthly,,
standard,"508,191","Komputer/Teknologi Informasi,IT-Perangkat Lunak",439232,PT Bursa Komoditi Dan Derivatif Indonesia,false,"As a Full Stack Developer, you will be responsible for Software development projects. Producing, testing and debugging code. Maintain and update...",full_time,3722135,false,false,Full Stack Developer,https://www.jobstreet.co.id/id/job/full-stack-developer-3722135?token=0~ea6d5a5b-5e43-4793-92bb-435226b4ac2d&sectionRank=598&jobId=jobstreet-id-job-3722135,Jakarta Pusat,22 hours ago,2021-12-24T20:00:48Z,,,,monthly,,
standout,"501,132","Akuntansi / Keuangan,Keuangan / Investasi Perusahaan ",433382,PT Home Credit Indonesia,false,Tugas dan tanggung jawab: Berkunjung ke rumah customer untuk melakukan kegiatan penagihan secara langsung kepada customer yang terlambat membayar...,full_time,3722180,false,true,Field Collection Gresik,https://www.jobstreet.co.id/id/job/field-collection-gresik-3722180?token=0~ea6d5a5b-5e43-4793-92bb-435226b4ac2d&sectionRank=599&jobId=jobstreet-id-job-3722180,Jakarta Raya,22 hours ago,2021-12-24T20:00:48Z,,,,monthly,,"Bonus tanpa batas,Jenjang Karir,Flexible working hours"
standout,"503,139","Penjualan / Pemasaran,Pemasaran/Pengembangan Bisnis",jobstreet-id-223481,PT Jasa Cepat Internasional,false,Job Descriptions : Define product roadmap and success measure for a product area that aligned with product strategy &amp; OKR Define product solutions...,full_time,3722186,false,true,Product Development,https://www.jobstreet.co.id/id/job/product-development-3722186?token=0~ea6d5a5b-5e43-4793-92bb-435226b4ac2d&sectionRank=600&jobId=jobstreet-id-job-3722186,Jakarta Pusat,22 hours ago,2021-12-24T20:00:48Z,,,,monthly,,
standout,"504,101","Seni/Media/Komunikasi,Seni / Desain Kreatif",jobstreet-id-26661,UD New Fanda Print,false,Membuat Design Undangan Membuat Design Hampers Follow Up Customer Mampu Menjelaskan Hasil Design kepada Costumer dengan baik Mampu Bekerja dengan...,full_time,3722190,false,true,GRAPHIC DESIGN,https://www.jobstreet.co.id/id/job/graphic-design-3722190?token=0~7374d957-93be-42ef-b24b-6f1f8f6a949a&sectionRank=601&jobId=jobstreet-id-job-3722190,Surabaya,22 hours ago,2021-12-24T20:00:48Z,,,,monthly,,
standout,"503,139","Penjualan / Pemasaran,Pemasaran/Pengembangan Bisnis",426520,PT Carlcare Service Ila,false,Requirements: Must active speak English (Oral and written) Two year sales experience in the mobile phone accessory business Good at data statistics...,full_time,3722230,false,true,MARKETING SUPERVISOR,https://www.jobstreet.co.id/id/job/marketing-supervisor-3722230?token=0~7374d957-93be-42ef-b24b-6f1f8f6a949a&sectionRank=602&jobId=jobstreet-id-job-3722230,Jakarta Raya,22 hours ago,2021-12-24T20:00:47Z,IDR,6000000,7000000,monthly,,
standout,"513,111","Layanan Kesehatan,Praktisi/Asisten Medis",jobstreet-id-337956,OneSmile Indonesia,false,Requirements: Diploma or Bachelor degree in Dental Nurse or Dental Technician Having 3+ years experience in the same position Having an outstanding...,full_time,3722231,false,true,Dental Nurse Leader,https://www.jobstreet.co.id/id/job/dental-nurse-leader-3722231?token=0~7374d957-93be-42ef-b24b-6f1f8f6a949a&sectionRank=603&jobId=jobstreet-id-job-3722231,Jakarta Selatan,22 hours ago,2021-12-24T20:00:47Z,,,,monthly,,
standard,"507,105","Pendidikan/Pelatihan,Pendidikan",428988,Yayasan Bina Nusantara,false,Requirements Master degree with relevant field of knowledge Having academic status (Jenjang Jabatan Akademik) from DIKTI (would be an advantage)...,full_time,3722233,false,false,Business Advisor - Entre. - Buss. Creation (BINUS Malang),https://www.jobstreet.co.id/id/job/business-advisor-entre-buss-creation-binus-malang-3722233?token=0~7374d957-93be-42ef-b24b-6f1f8f6a949a&sectionRank=604&jobId=jobstreet-id-job-3722233,Malang,22 hours ago,2021-12-24T20:00:47Z,,,,monthly,,
standard,"514,104","Lainnya,Jurnalis/Editor",434365,Kompas Gramedia - KG Media,false,Job Description Developing and writing news related to trend issues Job Requirements Candidate must have at least Bachelor's Degree in any discipline...,contract,3722235,false,false,News Content Writer Weekend - Kompas.com,https://www.jobstreet.co.id/id/job/news-content-writer-weekend-kompas-com-3722235?token=0~7374d957-93be-42ef-b24b-6f1f8f6a949a&sectionRank=605&jobId=jobstreet-id-job-3722235,Surakarta,22 hours ago,2021-12-24T20:00:47Z,,,,monthly,,
standout,"508,193","Komputer/Teknologi Informasi,IT-Admin Jaringan/Sistem/Database",429368,PT Lawencon Internasional,false,Requirements: Bachelor/Professional Degree in Engineering: Computer/Information/Tech/Science/Math or relevant Have a least two (2) year of experience...,full_time,3722206,false,true,SOA Webmethod Developer,https://www.jobstreet.co.id/id/job/soa-webmethod-developer-3722206?token=0~7374d957-93be-42ef-b24b-6f1f8f6a949a&sectionRank=606&jobId=jobstreet-id-job-3722206,Jakarta Raya,22 hours ago,2021-12-24T20:00:47Z,IDR,10000000,12000000,monthly,,
standard,"514,104","Lainnya,Jurnalis/Editor",434365,Kompas Gramedia - KG Media,false,Job Descriptions : Writing and reporting news related to economic trends and/or issues.  Job Requirements : Having 1-2 years experience in the same...,full_time,3722210,false,false,Reporter Money - Kompas.com,https://www.jobstreet.co.id/id/job/reporter-money-kompas-com-3722210?token=0~7374d957-93be-42ef-b24b-6f1f8f6a949a&sectionRank=607&jobId=jobstreet-id-job-3722210,Jakarta Pusat,22 hours ago,2021-12-24T20:00:47Z,,,,monthly,,
standout,"508,191","Komputer/Teknologi Informasi,IT-Perangkat Lunak",429368,PT Lawencon Internasional,false,We are looking for an experienced and talented programmer for our Development Team Project. You will be working with our Lead Developer and Project...,full_time,3722211,false,true,IOS Developer,https://www.jobstreet.co.id/id/job/ios-developer-3722211?token=0~7374d957-93be-42ef-b24b-6f1f8f6a949a&sectionRank=608&jobId=jobstreet-id-job-3722211,Jakarta Raya,22 hours ago,2021-12-24T20:00:47Z,,,,monthly,,
standout,"513,113","Layanan Kesehatan,Diagnosa/Lainnya",432268,PT. EMDEE GRACIA ESTETIKA,false,Kualifikasi : Usia maksimal 35 tahun Memiliki STR Dokter Memiliki Sertifikat Estetika menjadi nilai plus Pengalaman minimal 1 tahun di Aestetika/...,full_time,3722214,false,true,AESTHETIC DOCTOR,https://www.jobstreet.co.id/id/job/aesthetic-doctor-3722214?token=0~7374d957-93be-42ef-b24b-6f1f8f6a949a&sectionRank=609&jobId=jobstreet-id-job-3722214,Semarang,22 hours ago,2021-12-24T20:00:47Z,,,,monthly,,
standard,"507,105","Pendidikan/Pelatihan,Pendidikan",428988,Yayasan Bina Nusantara,false,Requirements Master Degree in Any Major Have experience in business development Have experience as entrepreneur is an advantages Good at communication...,full_time,3722219,false,false,Binus Entrepreneurship Center Section Head - Binus Bandung,https://www.jobstreet.co.id/id/job/binus-entrepreneurship-center-section-head-binus-bandung-3722219?token=0~7374d957-93be-42ef-b24b-6f1f8f6a949a&sectionRank=610&jobId=jobstreet-id-job-3722219,Bandung,22 hours ago,2021-12-24T20:00:47Z,,,,monthly,,
standout,"508,193","Komputer/Teknologi Informasi,IT-Admin Jaringan/Sistem/Database",431883,PT DAYASA ARIA PRIMA,false,JOB DESCRIPTION Maintance existing SAP FICO module Develop new feature and report in SAP Give training how to use SAP create document (functional...,full_time,3722221,false,true,IT Group Leader,https://www.jobstreet.co.id/id/job/it-group-leader-3722221?token=0~7374d957-93be-42ef-b24b-6f1f8f6a949a&sectionRank=611&jobId=jobstreet-id-job-3722221,Gresik,22 hours ago,2021-12-24T20:00:47Z,,,,monthly,,
standard,"514,104","Lainnya,Jurnalis/Editor",434365,Kompas Gramedia - KG Media,false,Job Description: Writing and editing about lifestyle trends and/or issues. Job Requirements: Must have at least Bachelor Degree in Journalism....,full_time,3722226,false,false,Content Writer Lifestyle - Kompas.com Solo,https://www.jobstreet.co.id/id/job/content-writer-lifestyle-kompas-com-solo-3722226?token=0~7374d957-93be-42ef-b24b-6f1f8f6a949a&sectionRank=612&jobId=jobstreet-id-job-3722226,Surakarta,22 hours ago,2021-12-24T20:00:47Z,,,,monthly,,
standard,"510,197","Manufaktur,Penjaminan Kualitas / QA",432328,PT Erela,false,Jobdesc:- Melakukan validasi metode analisa pembersihan dan bahan baku- melakukan trial metode sesuai compendial- melakukan review produk yang akan...,full_time,3722227,false,false,Supervisor QC Validasi dan Kualifikasi,https://www.jobstreet.co.id/id/job/supervisor-qc-validasi-dan-kualifikasi-3722227?token=0~7374d957-93be-42ef-b24b-6f1f8f6a949a&sectionRank=613&jobId=jobstreet-id-job-3722227,Semarang,22 hours ago,2021-12-24T20:00:47Z,,,,monthly,,
standout,"509,186","Teknik,Teknik Elektronika",428344,PT Skyworth Indonesia,false,Tugas Melakukan perbaikan/servis produk elektronik TV LED dengan cepat dan berkualitas; Memahami bidang teknikal dan mengerti sparepart atau komponen...,full_time,3722192,false,true,TEKNISI ELEKTRONIK (TV) MEDAN,https://www.jobstreet.co.id/id/job/teknisi-elektronik-tv-medan-3722192?token=0~7374d957-93be-42ef-b24b-6f1f8f6a949a&sectionRank=614&jobId=jobstreet-id-job-3722192,Medan,22 hours ago,2021-12-24T20:00:47Z,,,,monthly,,
standout,"501,132","Akuntansi / Keuangan,Keuangan / Investasi Perusahaan ",jobstreet-id-335021,PT. Belle Amanah Sejahtera,false,Menyusun sistem akuntansi Menyusun laporan keuangan kepada pihak-pihak eksternal Menyusun laporan keuangan kepada pemimpin perusahaan Menyusun...,contract,3722193,false,true,Akuntan Internal,https://www.jobstreet.co.id/id/job/akuntan-internal-3722193?token=0~7374d957-93be-42ef-b24b-6f1f8f6a949a&sectionRank=615&jobId=jobstreet-id-job-3722193,Kulon Progo,22 hours ago,2021-12-24T20:00:47Z,,,,monthly,,
standard,"503,139","Penjualan / Pemasaran,Pemasaran/Pengembangan Bisnis",409428,PT Haier Sales Indonesia,false,"JOB DESCRIPTION Manage data (customer voice, competitor information, questionaire) from system (existing sapphire) Supply sell out related data to...",full_time,3722194,false,false,Chief Marketing Intelligence,https://www.jobstreet.co.id/id/job/chief-marketing-intelligence-3722194?token=0~7374d957-93be-42ef-b24b-6f1f8f6a949a&sectionRank=616&jobId=jobstreet-id-job-3722194,Jakarta Utara,22 hours ago,2021-12-24T20:00:47Z,,,,monthly,,
standout,"508,191","Komputer/Teknologi Informasi,IT-Perangkat Lunak",432492,FIBERSTAR (PT. Mega Akses Persada),false,"Job Descriptions: Designing, developing, modifying, testing, improving, looking for breakthroughs to making an evaluation of the software so it can...",full_time,3722195,false,true,Application Developer - Programmer .NET,https://www.jobstreet.co.id/id/job/application-developer-programmer-net-3722195?token=0~7374d957-93be-42ef-b24b-6f1f8f6a949a&sectionRank=617&jobId=jobstreet-id-job-3722195,Jakarta Selatan,22 hours ago,2021-12-24T20:00:47Z,,,,monthly,,"Health Insurance, Dental, and Eyeglasses Allowance,Fast growth company, improvement with new technology trends,Flexible, Hybrid"
standout,"508,191","Komputer/Teknologi Informasi,IT-Perangkat Lunak",jobstreet-id-157622,PT Mekar Intan Global,false,"Job Description : Collaborate and work together with back-end developer Writes well designed, testable, efficient code Ensures designs are in...",full_time,3722196,false,true,Front End Developer,https://www.jobstreet.co.id/id/job/front-end-developer-3722196?token=0~7374d957-93be-42ef-b24b-6f1f8f6a949a&sectionRank=618&jobId=jobstreet-id-job-3722196,Surabaya,22 hours ago,2021-12-24T20:00:47Z,IDR,4000000,5600000,monthly,,Karir di perusahaan startup teknologi
standout,"501,131","Akuntansi / Keuangan,Akuntansi Umum / Pembiayaan",jobstreet-id-24903,PT Xynergy Realty,false,"ABOUT THE ROLEThe role is responsible for applying accepted accounting principles and procedures to analyse financial information, prepare accurate...",full_time,3722255,false,true,TRUST ACCOUNT OFFICER,https://www.jobstreet.co.id/id/job/trust-account-officer-3722255?token=0~7374d957-93be-42ef-b24b-6f1f8f6a949a&sectionRank=619&jobId=jobstreet-id-job-3722255,Jakarta Barat,22 hours ago,2021-12-24T20:00:46Z,,,,monthly,,"An attractive remuneration structure is on offer,Working with a company that values team member development,Training provided"
standout,"506,107","Hotel/Restoran,Makanan/Minuman/Pelayanan Restoran",jobstreet-id-67115,PT Candrabuana Suryasemesta,false,Diskripsi Pekerjaan Dapat membuat basic kue/Cake Dapat menghias/dekorasi kue Tart Dapat dekorasi menggunakan Icing/fondant Kualifikasi : Maksimal usia...,full_time,3722248,false,true,Baker Dekorasi Tart,https://www.jobstreet.co.id/id/job/baker-dekorasi-tart-3722248?token=0~7374d957-93be-42ef-b24b-6f1f8f6a949a&sectionRank=620&jobId=jobstreet-id-job-3722248,Semarang,22 hours ago,2021-12-24T20:00:46Z,IDR,2810025,3200000,monthly,,Tunjangan U. Makan dan transport
standard,"507,105","Pendidikan/Pelatihan,Pendidikan",428988,Yayasan Bina Nusantara,false,Requirements Master Degree in Any Major Have experience in business development Have experience as entrepreneur is an advantages Good at communication...,full_time,3722246,false,false,Business Incubator Coach - Binus Bandung,https://www.jobstreet.co.id/id/job/business-incubator-coach-binus-bandung-3722246?token=0~7374d957-93be-42ef-b24b-6f1f8f6a949a&sectionRank=621&jobId=jobstreet-id-job-3722246,Bandung,22 hours ago,2021-12-24T20:00:46Z,,,,monthly,,
standard,"514,104","Lainnya,Jurnalis/Editor",434365,Kompas Gramedia - KG Media,false,Qualifications: Minimum 5 years experience as Reporter at online media. Have passion in writing about food or culinary. Excellent knowledge and...,full_time,3722283,false,false,Content Writer Food - Kompas.com Solo,https://www.jobstreet.co.id/id/job/content-writer-food-kompas-com-solo-3722283?token=0~7374d957-93be-42ef-b24b-6f1f8f6a949a&sectionRank=622&jobId=jobstreet-id-job-3722283,Surakarta,22 hours ago,2021-12-24T20:00:46Z,,,,monthly,,
standout,"511,180","Bangunan/Konstruksi,Arsitek/Desain Interior",jobstreet-id-276780,PT.Sibambo Karya Internasional,false,"SIBAMBO STUDIO ini kami ciptakan bersama untuk memastikan setiap orang di PT.SIBAMBO KARYA INTERNASIONAL bertumbuh menjadi pribadi yang lebih baik,...",full_time,3722241,false,true,Senior Arsitek,https://www.jobstreet.co.id/id/job/senior-arsitek-3722241?token=0~7374d957-93be-42ef-b24b-6f1f8f6a949a&sectionRank=623&jobId=jobstreet-id-job-3722241,"Bogor,Semarang",22 hours ago,2021-12-24T20:00:46Z,IDR,7000000,10000000,monthly,,"MEMILIKI SKA IAI,MOHON LAMPIRKAN PORFOLIO,asas kekeluargaan dan kebersamaan"
standout,"508,193","Komputer/Teknologi Informasi,IT-Admin Jaringan/Sistem/Database",429368,PT Lawencon Internasional,false,"Job Description : Install, configure, troubleshoot, and deploy applications in an enterprise middleware (WebLogic, WebSphere, JBoss, tomcat, Node.js,...",full_time,3722281,false,true,Pro Switching Engineer,https://www.jobstreet.co.id/id/job/pro-switching-engineer-3722281?token=0~7374d957-93be-42ef-b24b-6f1f8f6a949a&sectionRank=624&jobId=jobstreet-id-job-3722281,Jakarta Raya,22 hours ago,2021-12-24T20:00:46Z,,,,monthly,,
standard,"507,105","Pendidikan/Pelatihan,Pendidikan",451611,Kursus Mandarin Beijing Standard - PT Global Cerdas Nusantara,false,FULL TIME POSITION Working Hours (Full Time): Monday - Friday: 13.00 - 21.00 Saturday: 09.00 - 17.00 Teaching hour per day: 3 hours - 6 hours (around...,full_time,3722279,false,false,Mandarin Teacher (Guru Mandarin),https://www.jobstreet.co.id/id/job/mandarin-teacher-guru-mandarin-3722279?token=0~7374d957-93be-42ef-b24b-6f1f8f6a949a&sectionRank=625&jobId=jobstreet-id-job-3722279,Jakarta Barat,22 hours ago,2021-12-24T20:00:46Z,IDR,7000000,8000000,monthly,,
standard,"505,152","Pelayanan,Teknikal & Bantuan Pelanggan",430155,PT Adiwisesa Mandiri BPI,false,Deskripsi pekerjaan: Memberikan pemahaman spesifikasi teknis setiap jenis produk kepada pelanggan Memberikan pemahaman karakteristik dan...,full_time,3722261,false,false,Technical Support - Bali,https://www.jobstreet.co.id/id/job/technical-support-bali-3722261?token=0~7374d957-93be-42ef-b24b-6f1f8f6a949a&sectionRank=626&jobId=jobstreet-id-job-3722261,Bali,22 hours ago,2021-12-24T20:00:46Z,,,,monthly,,
standout,"503,203","Penjualan / Pemasaran,Digital Marketing",jobstreet-id-296447,Sukses Kreasi Grafika,false,"Our company is engaged in the marketing of Doc Cam, UV Kurin and some famous brand technology productsResponsibilities: Planning, development and...",full_time,3722289,false,true,Digital Marketing,https://www.jobstreet.co.id/id/job/digital-marketing-3722289?token=0~7374d957-93be-42ef-b24b-6f1f8f6a949a&sectionRank=627&jobId=jobstreet-id-job-3722289,Jakarta Barat,22 hours ago,2021-12-24T20:00:45Z,,,,monthly,,
standout,"508,191","Komputer/Teknologi Informasi,IT-Perangkat Lunak",jobstreet-id-76682,PT KASIR PINTAR INTERNASIONAL,false,"Requirements minimum 1 years in writing GO and PHP Laravel, but fresh graduate are welcome to apply. Graduated Degree in Computer Science or...",full_time,3722291,false,true,Backend Engineer (Golang),https://www.jobstreet.co.id/id/job/backend-engineer-golang-3722291?token=0~7374d957-93be-42ef-b24b-6f1f8f6a949a&sectionRank=628&jobId=jobstreet-id-job-3722291,Jawa Timur,22 hours ago,2021-12-24T20:00:45Z,,,,monthly,,"free lunch,asuransi,team building"
standout,"503,139","Penjualan / Pemasaran,Pemasaran/Pengembangan Bisnis",jobstreet-id-340182,Sinergi Foundation ( Yayasan Semai Sinergi Umat),false,Fungsi Jabatan (Tanggung Jawab) :Memimpin Direktorat Fundraising &amp; Marketing untuk mewujudkan target Lembaga yang telah disetujui oleh Pimpinan...,full_time,3722292,false,true,Fundraising & Marketing Director,https://www.jobstreet.co.id/id/job/fundraising-marketing-director-3722292?token=0~7374d957-93be-42ef-b24b-6f1f8f6a949a&sectionRank=629&jobId=jobstreet-id-job-3722292,Bandung,22 hours ago,2021-12-24T20:00:45Z,,,,monthly,,
standout,"503,139","Penjualan / Pemasaran,Pemasaran/Pengembangan Bisnis",jobstreet-id-340182,Sinergi Foundation ( Yayasan Semai Sinergi Umat),false,Fungsi Jabatan (Tanggung Jawab) :Memimpin Direktorat Empowering &amp; Development untuk mewujudkan target Lembaga yang telah disetujui oleh Pimpinan...,full_time,3722301,false,true,Empowering & Development Director,https://www.jobstreet.co.id/id/job/empowering-development-director-3722301?token=0~7374d957-93be-42ef-b24b-6f1f8f6a949a&sectionRank=630&jobId=jobstreet-id-job-3722301,Bandung,22 hours ago,2021-12-24T20:00:45Z,,,,monthly,,
standout,"508,191","Komputer/Teknologi Informasi,IT-Perangkat Lunak",6403,PT Gameloft Indonesia (Yogyakarta),false,"Under the supervision of APAC Lead and Programmer Division Lead, the JavaScript Programmer is expected to do research, propose solutions, implement...",full_time,3722302,false,true,JavaScript Programmer,https://www.jobstreet.co.id/id/job/javascript-programmer-3722302?token=0~b1054cf5-4f46-4f3f-9f1f-45bebf0c36d4&sectionRank=631&jobId=jobstreet-id-job-3722302,Sleman,22 hours ago,2021-12-24T20:00:45Z,,,,monthly,,
standout,"503,145","Penjualan / Pemasaran,Penjualan Ritel",jobstreet-id-157622,PT Mekar Intan Global,false,Menjual Perhiasan kepada customer Menjalaskan product knowledge kepada customer Menjadi konsultan untuk memenuhi kebutuhan customer dan...,full_time,3722304,false,true,Sales,https://www.jobstreet.co.id/id/job/sales-3722304?token=0~b1054cf5-4f46-4f3f-9f1f-45bebf0c36d4&sectionRank=632&jobId=jobstreet-id-job-3722304,Surabaya,22 hours ago,2021-12-24T20:00:45Z,IDR,3750000,5250000,monthly,,
standard,"514,104","Lainnya,Jurnalis/Editor",434365,Kompas Gramedia - KG Media,false,Job Description: Writing and editing news related to health trends and/or issues. Job Requirements: Having 5 years experience as Reporter at online...,full_time,3722312,false,false,Content Writer Health - Kompas.com Solo,https://www.jobstreet.co.id/id/job/content-writer-health-kompas-com-solo-3722312?token=0~b1054cf5-4f46-4f3f-9f1f-45bebf0c36d4&sectionRank=633&jobId=jobstreet-id-job-3722312,Surakarta,22 hours ago,2021-12-24T20:00:45Z,,,,monthly,,
standout,"501,132","Akuntansi / Keuangan,Keuangan / Investasi Perusahaan ",jobstreet-id-340182,Sinergi Foundation ( Yayasan Semai Sinergi Umat),false,Fungsi Jabatan (Tanggung Jawab) :Memimpin Direktorat Resources untuk mewujudkan target Lembaga yang telah disetujui oleh Pimpinan puncak (CEO)....,full_time,3722315,false,true,Resources Director,https://www.jobstreet.co.id/id/job/resources-director-3722315?token=0~b1054cf5-4f46-4f3f-9f1f-45bebf0c36d4&sectionRank=634&jobId=jobstreet-id-job-3722315,Bandung,22 hours ago,2021-12-24T20:00:45Z,,,,monthly,,
standout,"503,139","Penjualan / Pemasaran,Pemasaran/Pengembangan Bisnis",jobstreet-id-340182,Sinergi Foundation ( Yayasan Semai Sinergi Umat),false,Fungsi Jabatan (Tanggung Jawab) :Memimpin Direktorat Business Development (WakafPro Corp) untuk mewujudkan target Lembaga yang telah disetujui oleh...,full_time,3722323,false,true,Business Development (WakafProCorp Director),https://www.jobstreet.co.id/id/job/business-development-wakafprocorp-director-3722323?token=0~b1054cf5-4f46-4f3f-9f1f-45bebf0c36d4&sectionRank=635&jobId=jobstreet-id-job-3722323,Bandung,22 hours ago,2021-12-24T20:00:45Z,,,,monthly,,
standard,"507,105","Pendidikan/Pelatihan,Pendidikan",428988,Yayasan Bina Nusantara,false,Requirements Minimal bachelor degree from any major Have experience to develop curriculum or training module Experience min 3 years as instructional...,full_time,3722329,false,false,Content Curator Quality Assurance Section Head - GreatNusa,https://www.jobstreet.co.id/id/job/content-curator-quality-assurance-section-head-greatnusa-3722329?token=0~b1054cf5-4f46-4f3f-9f1f-45bebf0c36d4&sectionRank=636&jobId=jobstreet-id-job-3722329,Tangerang,22 hours ago,2021-12-24T20:00:45Z,,,,monthly,,
standard,"514,104","Lainnya,Jurnalis/Editor",434365,Kompas Gramedia - KG Media,false,"Job Description: Writing trends and/or issues about home design/concept, interior design, gardening. Job Requirements: Familiar with home lifestyle...",full_time,3722333,false,false,Content Writer Homey - Kompas.com Solo,https://www.jobstreet.co.id/id/job/content-writer-homey-kompas-com-solo-3722333?token=0~b1054cf5-4f46-4f3f-9f1f-45bebf0c36d4&sectionRank=637&jobId=jobstreet-id-job-3722333,Surakarta,22 hours ago,2021-12-24T20:00:45Z,,,,monthly,,
standard,"503,139","Penjualan / Pemasaran,Pemasaran/Pengembangan Bisnis",438846,PT. Berca Hardayaperkasa,false,"Develop and execute sales plans (target achievement, sales strategy, performance measurement, business tactics, and daily management) Aggressively...",full_time,3722336,false,false,Senior Sales Consultant,https://www.jobstreet.co.id/id/job/senior-sales-consultant-3722336?token=0~b1054cf5-4f46-4f3f-9f1f-45bebf0c36d4&sectionRank=638&jobId=jobstreet-id-job-3722336,Jakarta Pusat,22 hours ago,2021-12-24T20:00:45Z,,,,monthly,,
standard,"503,142","Penjualan / Pemasaran,Penjualan - Korporasi",414063,PT Link Net,false,Job Description: Provide sales strategy by seeking corporate customers To execute sales call to create new customer To regularly visit and maintain...,full_time,3722339,false,false,Enterprise Sales Account Executive Bali (PT. Link Net Tbk.),https://www.jobstreet.co.id/id/job/enterprise-sales-account-executive-bali-pt-link-net-tbk-3722339?token=0~b1054cf5-4f46-4f3f-9f1f-45bebf0c36d4&sectionRank=639&jobId=jobstreet-id-job-3722339,Denpasar,22 hours ago,2021-12-24T20:00:45Z,,,,monthly,,
standout,"503,139","Penjualan / Pemasaran,Pemasaran/Pengembangan Bisnis",jobstreet-id-340182,Sinergi Foundation ( Yayasan Semai Sinergi Umat),false,"Fungsi Jabatan (Tanggung Jawab) :Bertanggung jawab menyusun rencana untuk memastikan pencapaian target tahunan Fundraising. mendelegasikan tugas,...",full_time,3722344,false,true,Fundraising Manager,https://www.jobstreet.co.id/id/job/fundraising-manager-3722344?token=0~b1054cf5-4f46-4f3f-9f1f-45bebf0c36d4&sectionRank=640&jobId=jobstreet-id-job-3722344,Bandung,22 hours ago,2021-12-24T20:00:45Z,,,,monthly,,
standard,"508,193","Komputer/Teknologi Informasi,IT-Admin Jaringan/Sistem/Database",435796,PT Panin Dai-ichi Life,false,"Candidate must possess at least a Bachelor's Degree, Engineering (Computer/Telecommunication), Science &amp; Technology or equivalent. Required...","full_time,contract",3722358,false,false,IT Developer (.Net),https://www.jobstreet.co.id/id/job/it-developer-net-3722358?token=0~b1054cf5-4f46-4f3f-9f1f-45bebf0c36d4&sectionRank=641&jobId=jobstreet-id-job-3722358,Jakarta Raya,22 hours ago,2021-12-24T20:00:44Z,IDR,6000000,7500000,monthly,,
